Reference	LeftContext	Pivot	RightContext
1_m00064-plain	o de RM. Wernicke (1874) sugirió que el área	de_PREP_de Broca_NP_Broca contiene_VLfin_contener recuerdos_ADJ_recuerdo motores_NC_motor (_LP_(en_PREP_en particular_ADJ_particular,_CM_,	recuerdos de la secuencia de movimientos musculares requeridos para articular palabras)
1_m00092-plain	acelera el rechazo de un trasplante similar en el animal receptor,	la_ART_el inyección_NC_inyección de_PREP_de células_NC_célula linfoides_ADJ_linfoide (_LP_(en_PREP_en particular_ADJ_particular pequeños_ADJ_pequeño	linfocitos recirculantes) es efectiva en acortar la supervivencia del implante (
1_m00255-plain	produce cierta esterilidad e induce también intensos calambres menstruales. Pero se	supone_VLfin_suponer que_CQUE_que serán_VSfin_ser los_ART_el varones_NC_varón (_LP_(en_PREP_en especial_ADJ_especial los_ART_el	que no fabrican esperma) quienes saldrán más beneficiados de los avances
1_m00680-plain	los pocos días, la inflamación y los agentes químicos que se	liberan_VLfin_liberar de_PREP_de las_ART_el células_NC_célula muertas_ADJ_muerto (_LP_(en_PREP_en particular_ADJ_particular el_ART_el	neurotransmisor glutamato) provocan más necrosis y apoptosis en las células vecinas
1_m00710-plain	superficie del virus. Si ese sujeto sufre una nueva exposición a	la_ART_el misma_ADJ_mismo cepa_NC_cepa,_CM_, los_ART_el anticuerpos_NC_anticuerpo (_LP_(sobre_PREP_sobre todo_QU_todo los_ART_el	dirigidos contra la hemaglutinina) bloquearán prestamente al virus e impedirán que
