Reference	LeftContext	Pivot	RightContext
1_m00003-plain	de asociarlos total o parcialmente al programa.	Los destinatarios de la presente Decisión son los Estados miembros. CONTENIDO CIENTÍFICO Y	TÉCNICO El presente programa específico refleja plenamente las orientaciones del Cuarto Programa
1_m00003-plain	0, 8 % de la población.	La investigación es un elemento indispensable de cualquier estrategia que	se proponga mejorar la salud de los ciudadanos y la competitividad de
1_m00003-plain	fase terminal y la rehabilitación. Investigación farmacéutica	El objetivo general es el desarrollo de las bases científicas y	técnicas necesarias para evaluar nuevos medicamentos, en particular los destinados al
1_m00003-plain	DEL PROGRAMA Las modalidades de participación financiera de	la Comunidad son las previstas en el Anexo IV de	la decisión relativa al Cuarto Programa Marco. Las modalidades de participación
1_m00064-plain	Estructura y funciones de	las células del sistema nervioso El cerebro es el órgano que mueve los músculos.	Esta afirmación puede parecer un poco simple, pero, en última
1_m00064-plain	neurona a otra se transmiten a través de	la sinapsis que es una unión entre los botones terminales (	descritos más adelante) de la neurona emisora y una porción de
1_m00064-plain	célula. Figura Principales estructuras o regiones de	una neurona multipolar Axón El axón es un tubo largo y delgados a menudo	recubierto por una vaina de mielina (la vaina de mielina se
1_m00064-plain	de tipo graso) se producen aquí.	El aparato de Golgi es un tipo especial de retículo endoplasmático.	Algunas moléculas complejas, constituidas por moléculas más sencillas, se ensamblan
1_m00064-plain	Glía Las células de soporte más importantes en	el sistema nervioso central son las que constituyen la neuroglía, o	«pegamento nervioso». La glía (también llamada células gliales
1_m00064-plain	juega un papel especial en el SNC.	Los dos tipos más importantes son los astrocitos y la oligodendroglia. Astrocito	significa célula en forma de estrella, y es un nombre que
1_m00064-plain	puedan pasar aquí libremente. Por ejemplo,	el área postrema es una parte del encéfalo que controla los	vómitos. En ella, la barrera hematoencefálica es mucho más débil
1_m00064-plain	un árbol) nos ayudará a recordar que	el córtex es la capa más externa del cerebro.	Cuando se describen las características de una estructura tan compleja como el
1_m00064-plain	véase la figura 4. 3).	El cerebro es una gran masa de neuronas, glía	y otras células de sostén. Es el órgano más protegido del
1_m00064-plain	véase la figura 4. 6).	Las cámaras de mayor tamaño son los ventrículos laterales, que están conectados	con el tercer ventrículo. El tercer ventrículo está localizado en la
1_m00064-plain	sirve como un punto útil de referencia.	El acueducto cerebral es un largo tubo que conecta el tercer	ventrículo con el cuarto ventrículo. Los ventrículos laterales constituyen el primero
1_m00064-plain	Una sección transversal (o frontal) secciona	el sistema nervioso como si fuera un salchichón, una sección horizontal lo	corta paralelo al suelo, y una sección sagital lo hace de
1_m00064-plain	la luz. Para los seres humanos,	la luz es una estrecha banda del espectro de la	radiación electromagnética. Cuando esta radiación tiene una longitud de onda comprendida
1_m00064-plain	fóvea) ésta desaparece. Otra característica de	la retina es el disco óptico, lugar donde los	axones que llevan la información visual se reúnen y salen del ojo
1_m00064-plain	nervioso: el control de la conducta.	El cerebro es el órgano que mueve los músculos.	Hace también otras muchas cosas, pero todas ellas secundarias en relación
1_m00064-plain	esquelético, el liso y el cardíaco.	EL MÚSCULO ESQUELÉTICO Los músculos esqueléticos son los que hacen posible nuestro movimiento (	o el de nuestros esqueletos), siendo así los responsables de
1_m00064-plain	, causando su movimiento al contraerse. (	Una excepción son los músculos de los ojos y también	algunos músculos abdominales, los cuales están unidos a los huesos únicamente
1_m00064-plain	energía del ATP presente en el citoplasma.	El proceso es el siguiente: los puentes de cruzamiento	de la miosina se ligan alternativamente a las hebras de actina,
1_m00064-plain	de células rítmicamente activas que se sitúan en	el marcapasos del corazón y que son las que inician las contracciones musculares que	constituyen los latidos cardíacos. Resumen intermedio En nuestro cuerpo hay músculos
1_m00064-plain	longitud de todo el músculo. REFLEJOS POLISINÁPTICOS	El reflejo monosináptico de extensión es el único reflejo espinal conocido que involucra	una única sinapsis. Todos los demás son polisinápticos. Se pueden
1_m00064-plain	, la responsable de nuestro dimorfismo sexual.	Lo que controla el cromosoma Y es el desarrollo de la glándula que produce	hormonas sexuales masculinas. Existen tres categorías generales de órganos sexuales:
1_m00064-plain	pueden transformarse en testículos o en ovarios.	El factor que controla su desarrollo parece ser un único gen del cromosoma Y llamado	SRY. Este gen produce un enzima llamado factor determinante de los
1_m00064-plain	capacidad de producir óvulos. Figura Desarrollo de	los órganos sexuales internos Los genitales externos son los órganos sexuales visibles e incluyen el	pene y el escroto en varones, y los labios vulvares,
1_m00064-plain	feminización de los órganos sexuales internos y de	los genitales externos Las dos hormonas gonadotropas son la hormona folículo-estimulante (HFE) y	la hormona luteinizante (HL), denominadas así por los efectos
1_m00064-plain	diferente). La característica principal que distingue	los ciclos menstruales de los ciclos estrales es el crecimiento y la pérdida mensuales de	la mucosa uterina. Las otras características son aproximadamente las mismas (
1_m00064-plain	administración únicamente de elevadas dosis de estradiol,	el tratamiento más eficaz es el que mimetiza la secuencia normal de	hormonas: una pequeña cantidad de estradiol seguida por progesterona. La
1_m00064-plain	Breedlove, 1992). Esto significa que	el único estradiol que ejerce efectos organizadores es el que se produce dentro de la	célula por acción de la aromatasa sobre las moléculas de testosterona.
1_m00064-plain	. En esencia, lo que ha logrado	el proceso evolutivo ha sido la capacidad para producir nuestra propia agua	marina que rodea o baña nuestras células, la capacidad para añadir
1_m00064-plain	la variable sistema al valor fijo establecido.	Un ejemplo de un sistema regulador es el de una habitación cuya temperatura sea	regulada por un calentador controlado a través de un termostato. La
1_m00064-plain	calentador controlado a través de un termostato.	La variable sistema es la temperatura del aire de la habitación	y el detector de esta variable es el termostato. Este dispositivo
1_m00064-plain	la temperatura del aire de la habitación y	el detector de esta variable es el termostato. Este dispositivo puede ajustarse	de modo que los contactos de un interruptor se cierren cuando la
1_m00064-plain	y hace que éste apague el calentador.	El feedback negativo es una característica esencial de todos los sistemas	reguladores. En este capítulo y en el 13 se tratan los
1_m00064-plain	«estar entre»; de hecho,	el fluido intersticial es el que está entre nuestras células (	es como el «agua marina» que las baña).
1_m00064-plain	y la excreción de sodio. Obviamente,	los riñones son los responsables de excretar tanto el agua	como el sodio, mientras que la ingesta de estas sustancias se
1_m00064-plain	provocar la contracción de los vasos sanguíneos.	Un término mucho más adecuado es el de hormona antidiurética (la palabra	diuresis proviene de los términos griegos dia, «a través»
1_m00064-plain	producción de orina). No obstante,	el nombre de vasopresina es el que los fisiólogos utilizan con más	frecuencia. La vasopresina es una hormona peptídica secretada por la neurohipófisis
1_m00064-plain	que los fisiólogos utilizan con más frecuencia.	La vasopresina es una hormona peptídica secretada por la neurohipófisis	. Se produce en los cuerpos celulares de neuronas localizadas en dos
1_m00064-plain	. Finalmente, la pérdida de agua de	las células y del plasma sanguíneo será lo suficientemente grande como para provocar la	sed, tanto osmótica como volémica (véase la figura 12.
1_m00064-plain	la figura 12. 8). Si	la evaporación fuera el único medio de producir alteraciones en	la distribución del agua en los tres compartimentos de fluidos, entonces
1_m00064-plain	procede de los fluidos intersticial e intracelular.	El resultado neto es una pérdida de agua de las células	. En ningún momento descendió el volumen de plasma sanguíneo; en
1_m00064-plain	, Verney había establecido la hipótesis de que	el estímulo que causa la sed osmótica es la pérdida de agua de las células	del cuerpo. Fitzsimons (1972) obtuvo pruebas que apoyaban la
1_m00064-plain	de agua fuera de ellas; así,	el estímulo para la sed osmótica es la deshidratación celular. Además, Fitzsimons	halló que una inyección de urea provocaba la conducta de beber,
1_m00064-plain	tanto sed volémica como sed osmótica. Si	la evaporación fuera el único modo mediante el cual nuestro	cuerpo perdiera fluidos, no necesitaríamos tener mecanismos reguladores de la conducta
1_m00064-plain	sin que el compartimento intersticial quede afectado.	La pérdida de sangre es la causa más obvia de la sed	volémica pura. Desde la más remota historia, las crónicas de
1_m00064-plain	su espalda (Fitzsimons, 1961).	Un coloide es una sustancia parecida a la cola (	del griego kolla, «goma») constituida por grandes moléculas
1_m00064-plain	rápidamente por un enzima en angiotensina II.	La forma activa es la angiotensina II, que abreviaremos como	AII.) La angiotensina II tiene numerosos efectos fisiológicos: estimula
1_m00064-plain	. Como han indicado muchos investigadores, comprender	la fisiología de la memoria es el desafío fundamental de la investigación en	neurociencia. El cerebro es complejo, y también lo son el
1_m00064-plain	. Sin embargo, el hecho de que	la función última del aprendizaje sea un cambio útil de la conducta no	significa que el aprendizaje se produzca sólo en las regiones cerebrales que
1_m00064-plain	15 se hará referencia al aprendizaje relacional.	El aprendizaje perceptivo es la capacidad para aprender a reconocer estímulos	vistos con anterioridad y a distinguirlos de otros similares. La principal
1_m00064-plain	nuestra experiencia con ello, y aprovecharnos de	la experiencia es lo que caracteriza al aprendizaje).	Cada uno de nuestros sistemas sensoriales es capaz de mostrar aprendizajes perceptivos
1_m00064-plain	componentes subcorticales de los sistemas sensoriales.)	El aprendizaje estímulo-respuesta es la capacidad para aprender a realizar un	tipo específico de conducta ante un determinado estímulo. Por tanto,
1_m00064-plain	psicólogos: condicionamiento clásico y condicionamiento instrumental.	El condicionamiento clásico es una forma de aprendizaje en la que	un estímulo no significativo adquiere las propiedades de uno significativo. Implica
1_m00064-plain	el soplo de aire funciona como EI.	El EC es un tono de 1. 000 Hz	. Para simplificar, imaginaremos que el EI es detectado por una
1_m00064-plain	animal acaba de parpadear, la mayoría de	las células activadas más recientemente serán las que controlen el parpadeo (y	sólo las sinapsis con estas células se verán reforzadas). Cuando
1_m00064-plain	titulado «Mecanismos de plasticidad sináptica».	El segundo tipo principal de aprendizaje estímulo-respuesta es el condicionamiento instrumental (también denominado condicionamiento	operante). Mientras que el condicionamiento clásico implica respuestas automáticas,
1_m00064-plain	asociación entre una respuesta y un estímulo.	El condicionamiento instrumental es una forma de aprendizaje más flexible y	adaptativa. Permite que un organismo adapte su conducta en función de
1_m00064-plain	los sistemas perceptivos y los sistemas motores.	Las formas más importantes de aprendizaje estímulo-respuesta son el condicionamiento clásico y el instrumental.	El condicionamiento clásico tiene lugar cuando un estimulo neutro es seguido por
1_m00064-plain	esta alteración se describirá más adelante).	La lesión es la región oscura señalada por la flecha	(véase la figura 16. 1). La categoría más
1_m00064-plain	determinar qué lado del cerebro es dominante para	el habla es la de administrar el test de Wada	, denominado así en honor a su inventor. (Como vimos
1_m00064-plain	déficit importante del habla que se observa en	la afasia de Broca es la anomia (sin nombre).	Anomia se refiere a la dificultad para hallar la palabra adecuada;
1_m00064-plain	palabras adecuadas. La tercera característica importante de	la afasia de Broca es la existencia de dificultades articulatorias. Los	pacientes pronuncian mal las palabras, a menudo alterando la secuencia de
1_m00064-plain	de movimientos de los músculos del habla.	El siguiente nivel es el de la selección de «programas	» específicos para cada palabra individual; la afectación de esta capacidad
1_m00064-plain	de esta capacidad provoca anomia. Finalmente,	el nivel más elevado es la selección de la estructura gramatical,	como el orden de las palabras, el uso de términos funcionales
1_m00064-plain	síntomas descritos en esta sección, sugieren que	una importante función del lóbulo frontal izquierdo es la secuenciación - de movimientos de los	músculos del habla (al producir palabras), y de palabras
1_m00064-plain	sensación de que se van a morir.	La ansiedad es una reacción normal frente a muchas situaciones	estresantes de la vida, y ninguno de nosotros está completamente libre
1_m00064-plain	Americana de Psiquiatría, la agorafobia asociada a	las crisis de angustia es un miedo a «estar en lugares	o situaciones de los cuales es difícil (o embarazoso) escapar
1_m00064-plain	Otras dos sustancias que han sido implicadas en	la angustia son la colecistoquinina y la serotonina. Como	vimos en el capítulo 13, la colecistoquinina (CCK) podría
1_m00064-plain	veces comiéndoselos (Rapoport, 1991).	La onicofagia es una conducta compulsiva consistente en comerse las	uñas, que, en caso extremo, puede provocar graves lesiones
1_m00064-plain	Leonard y cols., 1992).	La acrodermatitis causada por lameduras es una enfermedad de los perros, no	de los humanos. Algunos perros se lamen continuamente alguna parte de
1_m00092-plain	immunitas, libre o exento de) contra	la infección y cuyo estudio es el objetivo de la disciplina denominada "	Inmunología ". Además de factores constitucionales mal conocidos por los cuales
1_m00092-plain	el organismo (fig. 1-2).	La principal línea de defensa es la piel, que cuando se encuentra	indemne es impermeable a la mayoría de los microorganismos; al producirse
1_m00092-plain	sebácea y el pH ácido que generan.	Una excepción es el Staphylococcus aureus, el cual suele	infectar los folículos pilosos y las glándulas, que son relativamente vulnerables
1_m00092-plain	, las secreciones nasales y la saliva.	Un mecanismo totalmente diferente es el del antagonismo microbiano que se asocia	con la flora bacteriana normal del organismo. Esta última inhibe la
1_m00092-plain	hematopoyético común con los otros elementos formes de	la sangre y es el leucocito predominante en el torrente sanguíneo	. Se trata de una célula indivisible de vida breve con núcleo
1_m00092-plain	. La célula pequeña con coloración focal en	la parte superior es un linfocito T. c) Cuatro	neutrófilos polimorfonucleares y un eosinófilo. Se observan con claridad los núcleos
1_m00092-plain	del complemento. El complemento facilita la fagocitosis	El complemento y su activación Complemento es el nombre dado a un complejo grupo	de unas 20 proteínas que, junto con los mecanismos de la
1_m00092-plain	mediada por un fenómeno en cascada, donde	el producto de una reacción es el catalizador enzimático de la siguiente.	Algunos de los componentes del complemento se designan con la letra "
1_m00092-plain	y sus efectos sobre los vasos sanguíneos.	El C5a es un poderoso agente quimiotáctico para los neutrófilos	, capaz de actuar directamente sobre el endotelio capilar para producir vasodilatación
1_m00092-plain	los factores H e I. Aunque desde	el punto de vista filogenético es la vía más antigua, fue descubierta	con posterioridad a otra vía que se estudiará en el próximo capítulo
1_m00092-plain	Bhakdit). MOLÉCULAS QUE RECONOCEN AL ANTÍGENO	Las inmunoglobinas La estructura básica es una unidad tetrapeptídica La molécula de anticuerpo	está compuesta por dos cadenas pesadas idénticas y dos cadenas livianas idénticas
1_m00092-plain	totalidad e indicar identidad inmunológica, pueden mostrar	un " espolón " como es el caso de antígenos parcialmente relacionados,	o pueden cruzarse, por tratarse de antígenos no relacionados (fig
1_m00092-plain	un anillo de precipitado. Cuanto mayor sea	la concentración del antígeno mayor será el diámetro del anillo (fig.	5-5). Si se incorporan por ejemplo tres patrones de concentración
1_m00092-plain	los casos de la aspergilosis broncopulmonar alérgica.	La electroforesis en cohete es un método cuantitativo que incluye la electroforesis	del antígeno en un gel que contiene el anticuerpo. El arco
1_m00092-plain	uno de varios antígenos en una mezcla.	Un ejemplo es la estimación del grado de conversión del	tercer componente del complemento (xxx) a la forma inactiva xxx
1_m00092-plain	maduración sin afectar la clase de xxx.	El concepto de que IL-4 era un factor de variación de xxx partía	fundamentalmente de resultados obtenidos con un linfoma dado, pero sin datos
1_m00092-plain	células madre hematopoyéticas. En el ratón,	la célula más probable es la que presenta el siguiente fenotipo de	superficie: alta expresión del CMH, baja positividad para xxx,
1_m00092-plain	antígenos diferentes en las células epiteliales corticales,	una de las cuales es el receptor de xxx. Este marco	celular provee el microambiente para la diferenciación de los linfocitos T y
1_m00092-plain	selectiva inducida por numerosos agentes: así,	el blanco primario de la organotina es el timocito cortical inmaduro, la dioxina	interactúa con un receptor sobre las células epiteliales corticales, mientras que
1_m00092-plain	con células epiteliales. Una característica notable de	las células que abandonan el timo fetal es la restricción de la utilización de genes	V. Así casi toda la primera ola de células xxx fetales
1_m00092-plain	Fig. 9-8). De este modo	el fenotipo del timo es el que imprime la restricción xxx sobre	los linfocitos T en diferenciación. En la figura 9-8 se observa
1_m00092-plain	absorción intestinal de las inmunoglobulinas del calostro.	La principal inmunoglobulina de la leche es la xxx secretora que no es absorbida	por el bebé pero permanece en el intestino para proteger las superficies
1_m00092-plain	por células y humoral. Un ejemplo de	una construcción en la cual la vacuna es un vector para un gen extraño insertado	se describe en la figura 11-4. Una amplia variedad de genes
1_m00092-plain	atenuada contiene varias mutaciones. Otra desventaja de	las cepas atenuadas es la dificultad y el costo que implica	mantener condiciones adecuadas de almacenamiento en Frío, sobre todo en lugares
1_m00092-plain	los injertos Durante mucho tiempo, uno de	los objetivos de la medicina fue el reemplazo de los órganos enfermos por	un trasplante de tejido sano, que se vio frustrado en gran
1_m00092-plain	diarrea y esplenomegalia, y se cree que	los principales mediadores de la patología son las citoquinas, en especial TNF.	Cuanto más fuerte sea la diferencia del antígeno de trasplante, más
1_m00092-plain	casos poco se aporta al concepto de que	los anticuerpos humorales son el instrumento de destrucción del injerto aunque	, como se verá más adelante, esto no siempre ocurre con
1_m00092-plain	, y por estudios posteriores se determinó que	el principio activo era un anticuerpo. En apariencia, los	anticuerpos circulantes no son capaces de neutralizar la actividad fisiológica del factor
1_m00092-plain	allí se sacaron las conclusiones referidas a que	la lesión en el ser humano es el resultado directo del ataque de la	xxx por estos anticuerpos fijadores de complemento. Las alteraciones pulmonares que
1_m00092-plain	Dr. A Leatham). Dado que	la auto-sensibilización contra xxx es una característica casi universal de la enfermedad	, la mayor parte de las células plasmáticas sinoviales deberían sintetizar anti-globulinas
1_m00092-plain	fig. 15-6j) o como inmunocomplejos (	el factor reumatoideo es un anticuerpo con baja afinidad y sólo	se observa un buen enlace cuando se utiliza xxx multivalente como antígeno
1_m00092-plain	anormal Uno de los acontecimientos más recientes en	el estudio de la artritis reumatoidea ha sido el descubrimiento de que la xxx de	los pacientes presenta glucosilación anormal. Los dos dominios xxx de la
1_m00092-plain	del cartílago y a los osteoclastos para aumentar	la resorción ósea que es una complicación adicional de la enfermedad severa	. Los nódulos subcutáneos son granulomas (fig. 15-6m y n
1_m00201-plain	se hallan físicamente conectados con el citoplasma.	El receptor típico es una proteína, una cadena de aminoácidos	plegada. Comprende al menos tres dominios: la región de acoplamiento
1_m00201-plain	a las tirosinas con fosfato; diríase que	los dominios SH2 y las tirosinas eran una suerte de broches, macho y	hembra, que encajaban entre sí. Llegamos a mediados de los
1_m00201-plain	nucleótidos del ADN de un gen. (	Los nucleótidos son los componentes de los genes, que	determinan la secuencia de aminoácidos de las proteínas). James Darnell
1_m00201-plain	ejemplo, la enzima, única, de	la cadena de señalización es el propio receptor. Cuanto sucede después	de la activación del receptor corre a cargo del reconocimiento de otras
1_m00201-plain	de descubrimientos, la investigación celular demostraba que	el citoplasma distaba de ser una entidad amorfa. Se hallaba repleto	de orgánulos y proteínas, en apretado empaquetamiento. Quedaba, por
1_m00201-plain	constituye un ejemplo paradigmático. En su raíz	el cáncer es el resultado de mutaciones genéticas. Algunas	ejercen su efecto perverso convirtiendo en hiperactivas las proteínas de las vías
1_m00203-plain	los rasgos en diferentes generaciones y llegó a	la conclusión de que cada característica era el producto de múltiples aportaciones de material	hereditario. A principios de siglo, con el redescubrimiento de los
1_m00203-plain	Hall hace unos veinte años. Una de	las conductas que han recibido mayor atención es la que la mosca parece hacer mejor	: el cortejo. Este proceso consta de una serie de acciones
1_m00203-plain	opera también en el proceso de aprendizaje.	El producto proteínico del gen eag es un componente de ciertos canales de membrana	que regulan el flujo de iones potasio hacia el exterior de las
1_m00203-plain	): el lóbulo de la antena;	el otro es el cuerpo pedunculado, situado junto a	la zona de arranque responsable del comienzo del cortejo Se descubrió la
1_m00208-plain	peculiaridades del programa que gobierna dichos procesos.	Las unidades funcionales del manual son los genes. Escogemos uno y cambiamos	su secuencia específica de nucleótidos: alteraremos su función. Para mayor
1_m00208-plain	10 veces esa cifra. Cuanto mayor es	el número de genes tanto mayor es la complejidad, porque aquellos forman redes	interactivas más intrincadas. Averiguar el efecto de cualquiera de esos genes
1_m00208-plain	albergan una inserción aleatoria. Al final,	las únicas células supervivientes vienen a ser las portadoras de la inserción dirigida (	las que poseen el gen «seleccionable positivo» neo r y
1_m00208-plain	portadoras de un vector integrado al azar.	Las únicas células que sobreviven y proliferan son las que portan la inserción dirigida (	verde). Sustitución génica dirigida en ratones 1. Se aíslan
1_m00210-plain	capaces de unirse a los ácidos nucleicos,	los que suscitan una atención mayor son los oligonucleótidos de ADN, conocidos también	por oligómeros: breves trechos de nucleótidos, que son las unidades
1_m00210-plain	práctica de inhibir con oligonucleótidos la traducción.	Los oligonucleótidos antisentido son la primera de las nuevas medicinas genéticas	que han llegado a la etapa de ensayo clínico. De su
1_m00210-plain	que controla la tasa de transcripción, y	el otro es la región que cifra la secuencia de	aminoácidos de la correspondiente proteína. Los genes se transcriben cuando los
1_m00210-plain	aquí las inherentes a los propios fármacos.	La dosis justa es una de ellas: los oligonucleótidos construidos	para inhibir la transcripción dentro de las células sólo resultan eficaces si
1_m00210-plain	es impedir selectivamente su traducción. Figura 2	LOS NUCLEOTIDOS SON LA BASE de las nuevas medicinas genéticas	Estas drogas suelen estar formadas por 15 o 20 nucleótidos, similares
1_m00210-plain	que forman el complejo transcripcional se une a	la región controladora del gen Ese complejo es la señal para que la enzima polimerasa	de ARN (púrpura) copie la información que contiene el gen
1_m00211-plain	identificásemos podrían también utilizarse por otros investigadores.	Lo que estábamos imaginando venía a ser una suerte de anatomía molecular. Teníamos	claro desde el principio el enorme trabajo que supondría identificar todos los
