Reference	LeftContext	Pivot	RightContext
1_m00274-plain	modo similar, 2pq describe la frecuencia de	los heterozigotos Aa y q2 es una medida de la frecuencia de los	homozigotos recesivos (aa). Así, la distribución de los
1_m00274-plain	. Las frecuencias de A y a en	la nueva generación son las mismas que en la generación anterior	. Si se asumen las condiciones de Hardy-Weinberg, se pueden calcular
1_m00274-plain	las frecuencias alélicas del grupo sanguíneo MN en	los aborígenes australianos es un buen ejemplo de esta aplicación de	la ley de Hardy-Weinberg. A partir de los valores de las
1_m00274-plain	, en los machos, la frecuencia de	un alelo ligado al X es la misma que la frecuencia fenotípica.	En Europa occidental se da una forma de daltonismo ligado al X
1_m00278-plain	genética de la respuesta inmunitaria CONCEPTOS DEL CAPÍTULO	El sistema inmunitario de los vertebrados es un mecanismo controlado genéticamente que defiende al	cuerpo de los organismos causantes de enfermedades. Una vasta recombinación genética
1_m00278-plain	agentes «foráneos» (antígenos).	La producción de anticuerpos contra antígenos potenciales es una extraordinaria hazaña genética. A partir	de un grupo de menos de 300 genes, sucesos de recombinación
1_m00278-plain	con más frecuencia. Componentes del sistema inmunitario	El sistema inmunitario es una barrera efectiva contra la invasión de	substancias foráneas potencialmente dañinas. El sistema inmunitario reconoce los virus,
1_m00278-plain	. Las células del sistema inmunitario Una de	las células clave del sistema inmunitario es el fagocito, un glóbulo blanco que	fagocita y destruye las moléculas y los microorganismos foráneos. Un tipo
1_m00278-plain	y las células T8 citotóxicas / supresoras.	Las células T4 cooperadoras son el conmutador general del sistema inmunitario;	activan la respuesta inmunitaria. Las células T8 supresoras son el conmutador
1_m00278-plain	sistema inmunitario; activan la respuesta inmunitaria.	Las células T8 supresoras son el conmutador que desconecta el sistema inmunitario	; detienen o reducen la respuesta inmunitaria (Tabla 22. 1
1_m00278-plain	para formar dos tipos de células hija.	Unas son las células de memoria, y las	otras son las células plasmáticas, que sintetizan y secretan de 2
1_m00278-plain	Unas son las células de memoria, y	las otras son las células plasmáticas, que sintetizan y	secretan de 2. 000 a 20. 000 moléculas de anticuerpo
1_m00278-plain	dura más que la respuesta inmunitaria primaria.	La existencia de respuesta inmunitaria secundaria es la base para la vacunación contra diversas	enfermedades infecciosas. Una vacuna es una preparación diseñada para estimular la
1_m00278-plain	para la vacunación contra diversas enfermedades infecciosas.	Una vacuna es una preparación diseñada para estimular la producción	de células de memoria contra un agente patógeno. En este procedimiento
1_m00278-plain	el desarrollo de las células B y de	las células T es la base de esta diversidad. Los	antígenos de histocompatibilidad, un tercer grupo de proteínas implicadas en la
1_m00278-plain	, representan aproximadamente el 80 por ciento de	los anticuerpos encontrados en sangre y son el tipo de anticuerpos más extensamente caracterizado	. Las IgG están asociadas a la memoria inmunológica. Las inmunoglobulinas
1_m00278-plain	de Y y contiene cuatro cadenas polipeptídicas.	Los brazos largos son las cadenas pesadas y los brazos cortos	son las cadenas ligeras. Cada cadena contiene una región constante y
1_m00278-plain	cuatro cadenas polipeptídicas. Los brazos largos son	las cadenas pesadas y los brazos cortos son las cadenas ligeras. Cada cadena contiene	una región constante y una regían variable. La región variable forma
1_m00279-plain	de las dos copias del cromosoma 7 de	las células del organismo es la causa del síndrome de Williams (	dibujo) La región ausente puede contener 15 o más genes,
1_m00279-plain	Identificación de los genes ausentes Sabedores de que	la ESVA era una condición común en los pacientes con	síndrome de Williams y que los pacientes con sólo ESVA familiar y
1_m00279-plain	revelado también un cociente intelectual bajo, si	una disminución de la elastina hubiera sido la única responsable de todos los síntomas	del síndrome de Williams. Esto indujo a sospechar la posible implicación
1_m00281-plain	. La situación resultaba especialmente decepcionante, pues	los microorganismos fueron los únicos habitantes de la Tierra durante	la primera mitad, si no dos tercios, de la historia
1_m00281-plain	validez. Ahora bien, tal renuencia a	la transferencia es un mero supuesto no demostrado; en	cualquier caso, debemos aceptar que los árboles sólo compendian la historia
1_m00291-plain	servimos del argot transcontinental para identificar y estudiar	las funciones de varios genes que parecen ser los engranajes del reloj biológico que controla	los ciclos de día y noche en una gama amplia de organismos
1_m00293-plain	fijamos en los linajes mitocondriales y maternos.	Los linajes maternos son los más idénticos entre hermanos, porque	su ADN mitocondrial sólo ha tenido una generación para incorporar mutaciones.
1_m00293-plain	población estable el tiempo para esta reducción a	un linaje materno es la duración de una generación multiplicada por	el doble del tamaño de la población. Podemos llamar " Eva
1_m00293-plain	10. 000 personas. Por tanto,	el nombre de Eva puede despistar -no es la fuente última de todos los linajes	ordinarios, como fue la Eva bíblica. Con los datos del
1_m00296-plain	tenía de la biología cambió de repente.	La biología había dejado de ser la ciencia de cosas de un olor	indescifrable que se guardaban en frigoríficos (la idea que conservaba desde
1_m00296-plain	, la reproducción de uno mismo. Para	un reduccionista estricto la vida es la reproducción de ADN por medio de	la ADN polimerasa. La ADN polimerasa constituye una nanomáquina asombrosa,
1_m00296-plain	Lo cual nos lleva a una confesión.	Los biotecnólogos somos una comunidad de ladrones. Robamos de	la célula. Estamos muy lejos de poder crear ex novo máquinas
1_m00296-plain	trata de un algoritmo perfecto. Pero si	la generación de caminos es lo suficientemente aleatoria, y el conjunto	generado bastante grande, el algoritmo presenta grandes probabilidades de suministrar la
1_m00296-plain	Resulta conveniente imaginar que la primera mitad de	la secuencia de ADN es el nombre de pila de la ciudad	, y la segunda, el apellido. Así pues, el
1_m00296-plain	podía tener la seguridad de que al menos	una de las moléculas formadas sería la codificación del camino hamiltoniano. Estremecía	el pensar que la solución de un problema matemático pudiera quedar almacenada
1_m00296-plain	dónde ha de empezar su replicación Watson-Crick.	Los cebadores utilizados fueron el apellido de la ciudad de partida	(GCAG para Valencia) y el complemento Watson-Crick del primer nombre
1_m00296-plain	Una vez efectuados todos los pasos computacionales,	las hebras restantes serán los que codifiquen la solución GCAGTCGGACTGGGCTATGTCCGA.	El problema del camino hamiltoniano Imaginemos un mapa de ciudades conectadas por
1_m00296-plain	). Los nombres complementarios en ADN de	las ciudades son la secuencia complementaria de sus correspondientes nombres	en ADN, en los cuales cada C es reemplazada por una
1_m00298-plain	De qué modo lo regula la insulina?	La glucosa es la divisa oficial del metabolismo. Absorbida	en el intestino y producida por el hígado, este azúcar viaja
1_m00298-plain	Pues bien, la concentración de glucosa a	la cual la velocidad de transporte es la semivelocidad de saturación constituye el criterio	del que se valen los expertos para clasificar los sistemas de transporte
1_m00298-plain	trabajan en ello muchos expertos. Ya que	el transportador de glucosa es una proteína que se encuentra anclada en	la membrana, por la cara interna y por la externa,
1_m00298-plain	en respuesta a la insulina. Una de	las primeras manifestaciones de la DMNID es la resistencia a la hormona: incapacidad	del músculo, tejido adiposo o hígado de responder eficientemente ante elevados
1_m00300-plain	de hormonas sexuales durante el desarrollo. «	El género al que se pertenece sería una construcción frágil y arbitraria»,	concluye Bleier, «si dependiera de la cirugía plástica».
1_m00300-plain	en mujeres. Además, aun suponiendo que	los resultados de Allen fueran los correctos, el mero tamaño de	la comisura anterior no permitiría sacar conclusión alguna sobre la inclinación sexual
1_m00300-plain	de ellos tendían también a la homosexualidad.	La hipótesis genética predice que la proporción sería la misma. Bailey y Pillard observaron	, además, que la incidencia de homosexualidad en los hermanos adoptados
1_m00301-plain	al promotor e inicia la transcripción. Pero	la polimerasa de ARN es una molécula muy promiscua, incapaz de	distinguir entre un promotor y otra secuencia de ADN. Para que
1_m00301-plain	del centro promotor. Para entendernos, si	el centro promotor fuese el encendido de un coche, los	intensificadores serían el acelerador y los silenciadores los frenos. Los genes
1_m00301-plain	promotor fuese el encendido de un coche,	los intensificadores serían el acelerador y los silenciadores los frenos	. Los genes eucariotas pueden contar con varios intensificadores y silenciadores;
1_m00301-plain	de la maquinaria basal. En realidad,	el factor D es el único componente basal capaz de reconocer	ADN. Se une selectivamente a una secuencia denominada bloque TATA,
1_m00301-plain	de la maquinaria basal. Convencidos de que	la proteína TBP era el propio factor D, nos dispusimos	a comprobarlo. Confirmado ello con los experimentos que realizamos, había
1_m00301-plain	de unión a TATA (TBP).	La TBP es el primer factor basal que se asienta	en el centro promotor, zona de la región reguladora de los
1_m00302-plain	y más efectiva. Los componentes fundamentales de	la respuesta inmunológica adaptativa son los linfocitos T (o células T	) y los linfocitos B (o células B). Estas
1_m00302-plain	varios billones de células B v T.	Los linfocitos B son un componente del sistema inmunológico adaptativo;	producen anticuerpos circulantes en respuesta a la infección. Los linfocitos T
1_m00302-plain	y los fagocitos. Otra actividad importante de	la respuesta inmunológica humoral es la creación de células memoria, una	subserie de células B de elevada afinidad, que persisten en el
1_m00302-plain	inmunológico adaptativo, el sistema inmunológico celular.	Un miembro fundamental del sistema inmunológico celular es la molécula MHC de clase I,	localizada en las superficies de casi todas las células del organismo.
1_m00304-plain	. Como se describe en este capítulo,	la etiología del cáncer es una mezcla de componentes genéticos y ambientales	. En la actualidad, gracias a los espectaculares avances en genética
1_m00304-plain	mejores y quizá, de medidas preventivas.	El cáncer es un conjunto de trastornos que comparten la	característica común de un crecimiento celular incontrolado que origina una masa de
1_m00304-plain	la morbididad y mortalidad en la población.	La causa básica del cáncer es una alteración de ciertos genes específicos.	Por lo general, las mutaciones en estos genes se acumulan en
1_m00304-plain	colon. Es probable, pues, que	el riesgo de cáncer sea una combinación de genética y entorno,	con interacción entre ambos componentes. Se sabe que los factores ambientales
1_m00304-plain	dianas al fosforilarlas. La etapa final de	la vía de transducción de señales es la regulación de la transcripción del DNA	en el núcleo. Los componentes de la cascada transducción de señales
1_m00304-plain	y continúan creciendo. Además, parece que	los cánceres suelen ser el resultado de una serie progresiva de	episodios que aumentan el grado de desregulación en una línea celular:
1_m00304-plain	un niño que recibiese el alelo mutante.	La segunda mutación sería un suceso genético inespecífico adicional en una	célula ya alterada. La hipótesis de un segundo episodio era necesaria
1_m00304-plain	los genes heredados en la forma mutante en	los síndromes tumorales familiares son los mismos genes que los del cáncer	generado por una mutación somática. Conociendo la naturaleza de los alelos
1_m00304-plain	serían detectables con marcadores de DNA, si	la segunda posibilidad fuese la correcta. Las pérdidas de marcadores	del DNA junto al gen del retinoblastoma (RB), en
1_m00304-plain	la dieta y el estrés. Uno de	los objetivos actuales de la investigación genética es la identificación y la medición de las	funciones relativas que los genes y el entorno tienen en la etiología
1_m00304-plain	en la futura descendencia. Podría esperarse que	la categoría de mayor riesgo fuese la de los hombres parientes de probandos	mujeres tal y como se demuestra en la tabla 10-1. Se
1_m00305-plain	investigación de Mendel surgieron dos principios fundamentales.	El primero es el principio de segregación, que establece	que los organismos que se reproducen sexualmente poseen genes que se presentan
1_m00305-plain	menos de un alelo (h).	Un ejemplo sería un cruce heterocigoto x heterocigoto, que	se presenta en la figura 4. 2. El principio de
1_m00305-plain	de gran parte de la genética moderna.	Las contribuciones fundamentales de Mendel fueron los principios de segregación y de transmisión	independiente, así como su definición de dominancia y recesividad. Figura
1_m00305-plain	son independientes, entonces la probabilidad de obtener	un resultado determinado en ambos ensayos es el producto de las probabilidades de cada	estudio. Por ejemplo, podemos desear conocer la probabilidad de que
1_m00305-plain	deferente. El problema más importante que afrontan	los pacientes con CF es la obstrucción de los pulmones por moco	espeso y abundante. Dada la imposibilidad de eliminar con eficacia este
1_m00305-plain	los pulmones). Existen pruebas de que	el CFTR es el mismo canal del ion cloro.	La similitud del CFTR con las proteínas transportadoras de membrana, sugiere
1_m00305-plain	mutaciones diferentes en el locus de CF.	La más común es la delación de tres bases que origina	la pérdida de una fenilalanina en la posición 508 de la proteína
1_m00305-plain	génicas y q). Suele asumirse que	las frecuencias génicas son las mismas en hombres que en mujeres	. Concepto de fenotipo Se ha definido el genotipo como la constitución
1_m00305-plain	constitución genética del individuo en un locus.	El fenotipo es lo que en realidad observamos clínicamente o	físicamente. Los genotipos no se corresponden de forma única con los
1_m00305-plain	dominante, pueden presentar el mismo fenotipo.	La fibrosis quística sería un ejemplo. A la inversa,	el mismo genotipo puede producir fenotipos diferentes en entornos distintos. Un
1_m00305-plain	puede producir fenotipos diferentes en entornos distintos.	Un ejemplo de ello es la fenilcetonuria (PKV), una	enfermedad recesiva observada aproximadamente en 1 de cada 10. 000 recién
1_m00305-plain	mediante modificaciones ambientales. Este ejemplo demuestra que	el fenotipo es el resultado de la interacción entre el	genotipo y los factores ambientales. Debe destacarse que el «entorno
1_m00305-plain	médica. Ilustra las relaciones entre miembros de	la familia y muestra quiénes son los familiares afectados por una enfermedad genética	y quiénes son los no afectados. De forma típica, una
1_m00305-plain	y muestra quiénes son los familiares afectados por	una enfermedad genética y quiénes son los no afectados. De forma típica	, una flecha señala el probando, el primer individuo diagnosticado en
1_m00305-plain	o hermanos (hermano y hermana).	Los parientes de segundo grado son los separados por una «etapa»	adicional (p. ej., abuelos y nietos, tíos
1_m00305-plain	y q se denominan así por convención.	Un cariotipo es una presentación de los cromosomas ordenados según	su longitud. Dependiendo de la posición del centrómero, un cromosoma
1_m00305-plain	buscando una anomalía cromosómica específica y sutil.	Un ejemplo sería la delación de las bandas l5qll-13 observada	en el síndrome de Prader-Willi. El bandeo cromosómico contribuye a identificar
1_m00305-plain	, aunque con una frecuencia mucho menor.	Los procesos poliploides observados en humanos son la triploidía (69 cromosomas en el	núcleo de cada célula) y la tetraploidía (92 cromosomas en
1_m00305-plain	las concepciones triploides sufren un aborto espontáneo.	La causa más frecuente de triploidía es la fertilización de un óvulo por dos	espermatozoides (dispermia). El cigoto resultante recibe 23 cromosomas del
1_m00305-plain	facilidad que un déficit de material genético.	La causa más común de aneuploidía es la falta de separación, que ocurre	cuando los cromosomas no se separan normalmente durante la meiosis (fig
1_m00305-plain	pacientes afectados nacen con defectos cardíacos estructurales.	El más frecuente es la persistencia del conducto AV (auriculoventricular	), un defecto en que los tabiques interauricular e interventricular no
1_m00305-plain	con antecedentes positivos de un trastorno genético.	Un ejemplo sería la realización de pruebas encaminadas a averiguar	la presencia de una translocación recíproca equilibrada en las familias en las
1_m00305-plain	(es decir, positivos verdaderos).	La especificidad es la capacidad para identificar correctamente a quienes	no tienen la enfermedad. Se mide como la proporción de individuos
1_m00305-plain	elevada a expensas de la sensibilidad).	Los elementos básicos de la validez son la sensibilidad (proporción de positivos verdaderos	detectados) y la especificidad (proporción de falsos negativos detectados)
1_m00305-plain	sensibilidad, disminuye la especificidad y viceversa.	Un tema fundamental en el marco clínico es la precisión que tiene una prueba de	detección positiva. Es necesario conocer la proporción de personas que presentan
1_m00305-plain	(CAH: congenital adrenal hyperplasia) por	una deficiencia de 21-hidroxilasa es un error congénito de la biosíntesis de	esteroides que puede provocar genitales ambiguos en mujeres y crisis suprarrenales en
1_m00305-plain	tendrán una inteligencia normal si son tratados (	una importante excepción es la del grupo formado por quienes presentan	un defecto en el metabolismo de la biopterina y en quienes se
1_m00305-plain	suele practicarse una detección en recién nacidos.	La detección en recién nacidos es una estrategia efectiva de salud pública para	enfermedades susceptibles de tratamiento, como la fenilcetonuria, el hipotiroidismo,
1_m00305-plain	no afectados de genes causantes de enfermedad.	La población diana es un grupo conocido de riesgo. La	«intervención» consiste en la presentación de cifras de riesgo y
1_m00305-plain	de la enfermedad de Tay-Sachs en Norteamérica.	La enfermedad de Tay-Sachs infantil es un trastorno autosómico recesivo en la que	existe una deficiencia de la enzima lisosomal 3-hexosaminidasa (HEX A)
1_m00305-plain	mutaciones que pueden causar CF en blancos,	un 70 % son una mutación de 3 bases denominada xxx	(v. cap. 4). La detección en portadores
1_m00305-plain	., cap., 4),	la enfermedad de Tay-Sachs es un ejemplo de trastorno de almacenamiento lisosomal	
1_m00306-plain	cubierta externa llamada pared celular. Uno de	los c principales de esta estructura rígida es un polisacárido denominado celulosa. Las células	bacterianas tienen también una pared celular, pero su composición química es
1_m00306-plain	composición de la pared celular vegetal. En	las bacterias el componente principal es una macromolécula compleja denominada peptidoglicano. Como	sugiere su nombre, la molécula consta de péptidos y azúcares.
1_m00306-plain	bases para un importante experimento que confirmó que	el DNA es el material genético. La actividad en	los límites celulares son procesos fisiológicos dinámicos. Tanto el transporte hacia
1_m00306-plain	menudo con consecuencias graves. Por ejemplo,	la enfermedad hereditaria distrofia muscular de Duchenne es el resultado de la pérdida funcional completa	de la distrofina, que se cree actúa en las membranas de
1_m00306-plain	procariotas. En la bacteria E. coli	el material genético es una larga molécula circular de DNA,	compactada en un área que se denomina región nucleoide. Parte del
1_m00306-plain	y por todos los orgánulos celulares asociados.	El citoplasma es una sustancia coloidal, sin partículas,	denominada citosol, que rodea y engloba a numerosos tipos de orgánulos
1_m00306-plain	), una molécula rica en energía.	El cloroplasto es un tipo de plastidio que se encuentra	en vegetales superiores, algas y algunos protozoos. Este orgánulo está
1_m00306-plain	centrómero [2]. Por convención,	el brazo más corto es el que se encuentra por encima del	centrómero y se denomina brazo p (p de «petit»
1_m00306-plain	. La actividad mitótica del zigoto y de	las células hijas posteriores es la base para el crecimiento y desarrollo	del organismo. En organismos adultos, la actividad mitótica asociada con
1_m00306-plain	aprecian brazos. [3] Propiamente,	el cariotipo es el conjunto de cromosomas característico de una	especie, mientras que su disposición ordenada, como en la parte
1_m00306-plain	intentó obtener pruebas experimentales de la herencia,	el trabajo de Mendel es un elegante modelo de diseño experimental y	de análisis. Mendel demostró una B perspicacia en elegir la metodología
1_m00306-plain	Los gametos recombinantes que aparecen por entrecruzamiento aumentan	la variabilidad genética en una especie y son la base para construir mapas de cromosomas	. Ya en 1903, Walter Sutton, que junto con Theodor
1_m00306-plain	ligamiento en cruces genéticos. Debido a que	el cromosoma es la unidad de transmisión en la meiosis	, y no el gen, los genes ligados no son libres
1_m00306-plain	que da lugar a un intercambio reciproco,	el efecto global es el mismo. La información genética se	transfiere de un organismo a otro, dando lugar a un genotipo
1_m00306-plain	el factor F. Esto hizo pensar que	el factor F era un elemento móvil, lo que se	confirmó posteriormente por la observación de que, después de la conjugación
1_m00306-plain	distinto a él, se ha demostrado que	el factor F es una molécula de DNA de doble cadena	, circular. Tiene una cantidad de DNA equivalente al 2 por
1_m00306-plain	F-, convirtiéndola en F +. Queda	la pregunta de cuál es el porcentaje exacto, muy bajo,	de células F- que sufren recombinación. Como discutiremos, la respuesta
1_m00306-plain	). Quizá la característica más significativa de	las cepas Hfr es la naturaleza de la recombinación. En	cualquier cepa dada, ciertos genes recombinan más frecuentemente que otros,
1_m00306-plain	genes próximos a O se transferirán primero.	El mismo factor F es lo último que se transfiere. Aparentemente	, la conjugación raramente dura lo suficiente como para permitir que pase
1_m00306-plain	fenotipo producido por el gen en cuestión.	El caso de los genes supresores es un ejemplo. Genes mutantes, como	suppressor of sable (su-s), suppressor of forked < /
1_m00306-plain	restaurando la función silvestre del producto génico.	La consecuencia es la supresión del fenotipo mutante. También	se ha propuesto que el producto de un gen supresor podría proporcionar
1_m00306-plain	invertir el fenotipo asociado. El caso de	la intolerancia a la lactosa es un ejemplo de los principios generales implicados	. La lactosa es un disacárido que consta de una molécula de
1_m00306-plain	un ejemplo de los principios generales implicados.	La lactosa es un disacárido que consta de una molécula	de glucosa y otra de galactosa. Está presente en un 7
1_m00306-plain	de todas las enfermedades hereditarias humanas respecto de	la edad de inicio es la trágica enfermedad de Huntington. Se	hereda como autosómica dominante y afecta a los lóbulos frontales del córtex
1_m00306-plain	se repite un número variable de veces.	El descubrimiento notable es la correlación entre el tamaño de la	repetición del trinucleótido y tanto la gravedad como la edad de inicio
1_m00306-plain	de CpG (llamadas islas CpG).	La metilación del DNA es un mecanismo razonable para establecer una marca	molecular, ya que hay algunos datos de que un elevado nivel
1_m00306-plain	la biología molecular o de la bioquímica.	Los caracteres poligénicos son el centro de varias disciplinas genéticas,	como la mejora vegetal y animal y la gestión de especies silvestres
1_m00306-plain	the English Language para la palabra imprintig.	El término proviene de la Etología y es la traducción del término alemán utilizado por	vez primera por Konrad Lorenz. Variación cromosómica y determinación del sexo
1_m00306-plain	interrupción del desarrollo del organismo. Ya que	el cromosoma es la unidad de transmisión en la meiosis	, tales variaciones pasan a los descendientes de un modo predecible,
1_m00306-plain	genéticas de las mutaciones génicas. Ya que	el cromosoma es la unidad de transmisión de acuerdo con	las leyes de Mendel, las aberraciones cromosómicas se transmiten a los
1_m00306-plain	papel. Las pruebas que clarifican cuál de	las explicaciones es la correcta tuvieron que esperar al estudio	de las variaciones en la composición de cromosomas sexuales, tanto en
1_m00306-plain	distinto. Tales individuos se denominan mosaicos.	Las dos líneas celulares son el resultado de errores en la mitosis	en las primeras etapas del desarrollo, siendo las combinaciones cromosómicas más
1_m00306-plain	baja que la del síndrome de Klinefelter.	Una explicación de esta diferencia es el hecho de que una proporción importante	de fetos 45, X muere en el útero y se abortan
