Reference	LeftContext	Pivot	RightContext
1_m00324-plain	del ADN de una célula eucariota típica.	El ADN de las células eucariotas es una doble hélice larga y delgada dentro	del núcleo de la célula. En contraste, el ADN bacteriano
1_m00324-plain	necesitamos hacer unas pocas distinciones más allá de	la generalidad de que el cromosoma es una molécula de ADN hecha de genes	que dirige la síntesis de polipéptidos. Para aumentar la complejidad del
1_m00324-plain	de su número telefónico. Su número serían	los exones y todo el resto serían los intrones. Algunos genes no tienen	intrones; otros tienen muchos. Nadie sabe con seguridad por qué
1_m00324-plain	dado y para activarlos cuando son necesarios.	La dilucidación de estos sistemas sigue siendo un área principal de investigación en la	biología molecular. Francamente, los científicos, por ahora, saben
1_m00324-plain	, digamos, un millón de carpetas.	La biblioteca de genes es un recurso valioso de fragmentos de ADN	humano para cartografiar y secuenciar. Una vez establecida, sirve de
1_m00324-plain	de clonación, varias características son deseables.	Una es la capacidad del plásmido para funcionar como	un «plásmido de alto copiado», esto es, con
1_m00324-plain	las inserciones de ADN extraño. Recordemos que	el primero de tales marcadores era la resistencia a un antibiótico. Diversos	factores resistentes a antibióticos han sido producidos en vectores de plásmidos.
1_m00324-plain	Una ventaja importante del clonado de genes en	la levadura es la capacidad de clonar grandes trozos de	ADN. Muchas secuencias de interés del ADN humano son bastante grandes
1_m00324-plain	YAC se reproduce durante la división celular.	El resultado es un clon de ADN dentro de células	de levadura en lugar de células bacterianas. El uso de levadura
1_m00324-plain	niveles de radiación. El Laboratorio Nacional de	Los Alamos del DOE ha sido el hogar del GenBank, la principal	base de datos de secuencias de ADN de los Estados Unidos,
1_m00324-plain	, al «buen salvaje», pero	la vida para la especie humana ha sido una experiencia marcada por el sufrimiento,	prácticamente sin alivio, a manos de agentes invisibles. Cualquier comprensión
1_m00324-plain	Cualquier comprensión del papel de las bacterias y	los virus en las enfermedades es un fenómeno reciente. También lo ha	sido el descubrimiento de que las enfermedades heredables están regidas por los
1_m00324-plain	haya cautivado la imaginación de los científicos?	El PGH es un asalto frontal al destino genético asignado	a cada ser humano. El cartografiado y secuenciamiento de los genes
1_m00324-plain	inicial, quedan detenidas del mismo modo.	Un caso típico sería la situación en la cual el gen	correcto para convertir el aminoácido fenilalanina en tirosina está ausente. El
1_m00324-plain	el aminoácido fenilalanina en tirosina está ausente.	El resultado es la fenilcetonuria (PKU), que	causa daño cerebral y un tamaño reducido de la cabeza. Como
1_m00324-plain	dominante, quedará silencioso y sin expresión.	La persona heterocigótica para ese gen es un «portador». Sólo cuando	dos genes recesivos, uno de cada uno de los dos portadores
1_m00324-plain	la entrada del cloruro en las células.	El resultado es un mucus grueso que obstruye los pasajes	respiratorios en los pulmones y los conductos del páncreas y el hígado
1_m00324-plain	saltos» cromosómicos. «Caminar» a	lo largo de un cromosoma es un término usado para describir una técnica	que a veces nos permite aislar una secuencia génica cuando su localización
1_m00324-plain	referencia de ligamiento genético para otras enfermedades.	La EH es un ejemplo perfecto de lo que se	conoce en genética como el «efecto fundador». Que se
1_m00324-plain	molecular adquieren una nueva importancia para aquellos para	los que son el único medio de aislar y clonar	el gen, que aguarda en su ADN como una bomba de
1_m00327-plain	metástasis La amenaza más seria del cáncer para	la vida es la diseminación inadvertida de las células tumorales	por todo el cuerpo. Una mejor comprensión de cómo estas células
1_m00327-plain	Cuando el tratamiento de un cáncer fracasa,	la metástasis es la causa primaria de muerte. Si	un tumor primario se detecta en una fase precoz y se elimina
1_m00327-plain	una nueva y riquísima información. Uno de	los hallazgos más importantes ha sido el hecho de que, en contra	de algunas de las primeras hipótesis, la metastatización es un proceso
1_m00327-plain	contra de algunas de las primeras hipótesis,	la metastatización es un proceso activo y no una consecuencia	accidental del crecimiento del tumor. Por supuesto, la invasión de
1_m00327-plain	de las ramificaciones del árbol vascular dentro de	la masa tumoral es un lugar en potencia para el vertido	de células a la circulación. Los vasos linfáticos son puertas de
1_m00327-plain	células tumorales circulantes y los tejidos extravasculares.	La primera barrera es la capa de células endoteliales que revisten	el interior de vasos sanguíneos y linfáticos. Los experimentos de Garth
1_m00327-plain	una mayor dosis de ingenio para superarla.	La matriz es un entramado denso de diversas moléculas de	proteínas e hidratos de carbono. En el organismo de los mamíferos
1_m00327-plain	los tejidos en una serie de compartimentos.	Una forma especializada de la matriz es la membrana basal, que recubre vasos	sanguíneos, células musculares y el sistema nervioso. Junto a la
1_m00327-plain	basal seguía un proceso de tres pasos.	El primer paso era la adhesión de la célula tumoral a	la membrana basal. La adhesión está mediada por receptores específicos en
1_m00327-plain	casos, el mecanismo de invasión que utilizan	las células normales probablemente sea el mismo que el de las células	tumorales. Existe, no obstante, una diferencia esencial en la
1_m00327-plain	primero en el desarrollo de un cáncer.	El siguiente paso crítico será la transición del tumor de su fase	de mero crecimiento a la de invasión y metástasis. Durante esa
1_m00327-plain	de las metaloproteinasas podría encerrar interés práctico.	Una posibilidad muy sugestiva es la de que un fármaco que imite	el péptido que lleva la cisteína bloquease la actividad de la metaloproteinasa
1_m00332-plain	información a los ribosomas. Estos orgánulos leían	el ARN mensajero como si fuera una cinta de música, interpretando sus	bases de tres en tres, y engarzando los aminoácidos correctos,
1_m00332-plain	su ADN. Si el huevo sobrevivió,	el resultado pudo ser una mosca con un elemento P procedente	de otra especie. A Houck no le cabe la menor duda
1_m00332-plain	puede ingerir. De acuerdo con Samuelson,	un transposón sería el responsable de esta doble expresión de	la amilasa mediante alteración de la regulación del gen de la enzima
1_m00332-plain	de la Universidad de Emory, descubrieron que	el origen de la enfermedad era una mutación hasta entonces desconocida. En	los individuos normales, el gen FMR-I contiene unas 60 repeticiones en
1_m00332-plain	un cambio de alelo estable a inestable.	El fenómeno de crecimiento es el que nos retrotrae a la genética	humana cuantitativa. La mayoría de las mutaciones alcanzan una frecuencia de
1_m00332-plain	del cuerpo. Charles D. Lairdsostiene que	la clave de la paradoja de Sherman es la impronta del cromosoma X frágil,	y no el crecimiento del gen. Ha desarrollado un modelo para
1_m00332-plain	al propio ARN autocortarse y empalmarse. Quizá	la manera más extraordinaria de maduración sea la revisión de estilo o corrección del	ARN, proceso en el que la información crucial que no está
1_m00332-plain	En el ARN mitocondrial, por ejemplo,	el codón uridina-guanina-adenina es una instrucción para añadir el aminoácido triptófano	a la cadena polipeptídica que se está formando; en el ARN
1_m00334-plain	con mayor éxito pertenecen a esta categoría.	Un ejemplo importante es el hipotiroidismo congénito causado por diversos defectos	(10 a 15 % de los cuales son genéticos) en
1_m00334-plain	de los cánceres. Hoy se reconoce que	la causa de base es la mutación génica y. cuando participan	agentes carcinógenos, operan produciendo mutación. Las mutaciones que provocan cáncer
1_m00334-plain	clónica del cáncer Existen firmes pruebas de que	un tumor es un clon de células derivadas de una	sola célula ancestral, en la que ha ocurrido el evento iniciador
1_m00334-plain	a través de un proceso denominado transducción.	El gen huésped equivalente fue el primer protooncogén que se reconoció.	Ahora, como se mencionó antes, se sabe que muchos protooncogenes
1_m00334-plain	activación de protooncogenes (tabla 16-2).	Las translocaciones cromosómicas son un mecanismo frecuente para la activación de	un protooncogén en diversos cánceres. En la leucemia mieloide crónica (
1_m00334-plain	de leucemia, las translocaciones son frecuentes.	Un aspecto de la investigación del cáncer es la definición citogenética y molecular de estas	anomalías, muchas de las cuales ya se sabe que están relacionadas
1_m00334-plain	expresión de éstos. Otro mecanismo importante para	la sobreexpresión es la amplificación génica, un proceso raro	o inexistente en las células normales, pero que algunas veces resulta
1_m00334-plain	Si bien en cada uno de estos trastornos	la herencia autosómica dominante es la regla o al menos se observa	en cierta proporción de casos, se requiere la pérdida o alteración
1_m00336-plain	existencia Uno de los problemas más fascinantes de	la biología actual es el de averiguar cómo se expresan los	genes. Para que un gen se active, cierto grupo de
1_m00336-plain	de una proteína específica; otras veces,	el propio ARN es el producto final. Pero, ¿	cómo se las arregla un factor de transcripción para reconocer su diana
1_m00336-plain	, de unos 45 pares de bases.	Las bases son los " peldaños " de esa familiar	" escalera " que es el ADN. (El ADN consta
1_m00336-plain	una cantidad aceptable del complejo, comprobó que	el metal que se perdía era el cinc. Cada unidad FTIIIA-ARN SS	incorporaba entre 7 y 11 iones de cinc, una cifra altísima
1_m00336-plain	la forma tridimensional global de la proteína.	Las estructuras secundarias más comunes son las hélices alfa (donde el esqueleto	de la proteína se enrolla en una espiral característica) y la
1_m00336-plain	avidez en el promotor, señal de que	los dedos de cinc eran los únicos responsables de la unión al	ADN. Encontramos también que, para que la proteína SWIS se
1_m00336-plain	, encajándose en el surco mayor. (	El surco mayor es la más ancha de las dos "	vaguadas " paralelas que rodean, en espiral, el eje longitudinal
1_m00336-plain	uno de los dos " largueros " de	la escalera que es el ADN. Estos ligámenes adicionales ayudan	a estabilizar el engarce del dedo de cinc con el ADN.
1_m00336-plain	dos regiones. Evans y Umesono descubrieron que	una parte del segundo motivo es la encargada de medir la longitud del	espaciador. Para explicar cómo se produce el reconocimiento importa conocer la
1_m00336-plain	específicos en el ADN. El conocimiento de	la estructura y función de una molécula es el punto de partida para pensar en	su aplicación médica. En el asunto que nos ocupa, sabemos
1_m00336-plain	parejas, difieren de las supuestas normales.	Un ejemplo insólito es la proteína GAL4 de levaduras. Contiene	seis cisteínas que se pliegan alrededor de dos átomos de cinc.
1_m00336-plain	molécula de ADN (doble hélice).	Los dedos de cinc son el puente entre los factores de transcripción	y sus genes diana. Se unen al ADN por secuencias específicas
1_m00336-plain	de bases: los " peldaños " de	la " escalera " que es el ADN. Se llaman dedos de	cinc porque asen al ADN y porque el cinc (bolas amarillas
1_m00337-plain	este capítulo nos centraremos en sus efectos.	La patología molecular requiere que descubramos cuál es el efecto de una mutación en la	cantidad o en la función del producto génico, y que expliquemos
1_m00337-plain	la actualidad, una ciencia muy imperfecta.	Los síntomas clínicos suelen ser el resultado final de una larga serie	de casualidades, y con demasiada frecuencia somos incapaces de predecirlos e
1_m00337-plain	un producto génico. En las talasemias,	el problema es la existencia de una cantidad no adecuada	de globina, mientras que en otras hemoglobinopatías el problema es una
1_m00337-plain	de globina, mientras que en otras hemoglobinopatías	el problema es una globina anormal. En alguna época	pasada se pensó que esta distinción podía reflejar dos clases fundamentales de
1_m00337-plain	página 288), la única mutación en	el gen HD asociada con HD es la expansión de la repetición del trinucleótido	. No se han encontrado mutaciones sin sentido, ni de sentido
1_m00337-plain	idénticos a los heterozigotos. Sin embargo,	la demostración de que la HD es una enfermedad de ganancia de función requerirá	la demostración bioquímica de la función que se gana. Tabla 1
1_m00337-plain	el mismo resultado clínico, es probable que	la causa del síndrome sea la pérdida de función del gen.	Mutaciones de pérdida de función La pérdida de función puede ser parcial
1_m00337-plain	residuos de manosa de las enzimas glucosiladas.	La fosfomanosa es una señal que canaliza las enzimas a	los lisosomas; si falta los lisosomas se ven desprovistos de un
1_m00337-plain	de función, aunque con diferente grado,	el alelo menos severo es el que dicta la pérdida de función	global, y por tanto es el responsable del efecto clínico.
1_m00337-plain	se inspecciona la secuencia genómica se observa que	el nucleótido cambiado es el último de un axón. Los	nucleótidos de la posición 3'de los exones suelen ser G
1_m00337-plain	las fases iniciales del embrión, afectando a	una célula que es la progenitura de una fracción significativa de	todo el organismo. En este capítulo consideraremos las dos clases de
1_m00337-plain	el interés del organismo completo lo impidan.	El cáncer es el resultado natural de esta selección entre	células somáticas. Probablemente, el cáncer es el estado final normal
1_m00337-plain	esta selección entre células somáticas. Probablemente,	el cáncer es el estado final normal de todo organismo	pluricelular que viva lo suficiente -pero los organismos que triunfan luchan para
1_m00337-plain	perdido. El principal nivel de control entre	los de orden superior es un mecanismo por el cual las células	potencialmente cancerosas se suicidan entrando en un programa de muerte celular programada
1_m00337-plain	se podría imaginar que los oncogenes son como	el acelerador y los genes TS son el freno. Apretar el acelerador a	fondo (una mutación dominante de ganancia de función en un oncogén
1_m00337-plain	confirmó que las células cancerosas contienen oncogenes activados	Un ensayo de transformación celular fue la fuente de una vía completamente independiente	de descubrimiento de oncogenes. La línea celular de ratón NIH-3T3 puede
1_m00337-plain	de plaquetas B. La sobreexpresión incontrolada de	un factor de crecimiento sería una causa obvia de hiperproliferación celular.	En la actualidad se han dilucidado las funciones de muchos oncogenes celulares
1_m00337-plain	metotrexato). En todos los casos,	el resultado es un gran aumento del nivel de la	expresión del gen amplificado. Existe una técnica alternativa, la hibridación
1_m00337-plain	genes implicados en la producción del carácter;	las únicas excepciones son las de caracteres que dependen de mutaciones	somáticas postzigóticas (Capítulo 17). Los gemelos dizigóticos (DZ
1_m00337-plain	poco a la investigación en genética humana.	Los estudios sobre adopción son la manera más poderosa de desenmarañar los	factores genéticos y los ambientales Si los gemelos separados son una vía
1_m00337-plain	más poderosa de desenmarañar los factores genéticos y	los ambientales Si los gemelos separados son una vía no práctica para desenmarañar la	herencia del ambiente familiar, la adopción es mucho más prometedora.
1_m00337-plain	de este estudio. El principal obstáculo en	los estudios de adopción es la falta de información sobre la familia	biológica. Esto se ve agravado porque no es deseable acercarse a
1_m00337-plain	es deseable acercarse a ellos con preguntas.	Un problema secundario es la colocación selectiva, es decir,	que la agencia de adopción, en interés del niño, elige
1_m00337-plain	los determinantes genéticos o ambientales La regresión a	la media es una característica largamente incomprendida, tanto en	relación a los datos biométricos como a la teoría poligénica. A
1_m00337-plain	sus parejas será de 100. Así,	el CI promedio de sus hijos es el promedio del CI de los progenitores	, como sugeriría el sentido común. En el mundo real,
1_m00337-plain	respecto a la media poblacional, incluso si	el CI fuera un carácter exclusivamente genético. El modelo	simplificado de la Figura 18. 2 supone que no hay dominancia
1_m00337-plain	supone que no hay dominancia. Así,	el fenotipo de cada persona es la suma de la contribución de cada	alelo en el locus relevante. Si se introduce dominancia, el
1_m00337-plain	la dominancia en la determinación del fenotipo.	La heredabilidad es la proporción de la varianza debida a	efectos genéticos aditivos Las campanas de Gauss son especificadas sólo por dos
1_m00337-plain	. 3). De esta forma,	la varianza global del fenotipo Vp es la suma de las varianzas debidas a	las causas individuales de la variación -la varianza ambiental, VE Y
1_m00337-plain	dominancia. La heredabilidad (h2) de	un carácter es la proporción de la varianza total que	tiene base genética, es decir, VG / VP. Para
1_m00337-plain	todos serán exactamente iguales. - regresión a	la media es un fenómeno genético. Si un carácter	presenta regresión a la media, debe ser genético. La Figura
1_m00337-plain	. En un modelo genético sencillo: -	La distribución global es la misma entre generaciones. - La	regresión funciona en ambos sentidos: para cada clase de niños,
1_m00337-plain	se desvía el fenotipo del grupo excepcional.	La genética hace que el número sea la mitad, pero no hace el	principio de regresión. Figura 2 Regresión a la media El mismo
1_m00337-plain	hijos. Obsérvese que: (a)	la distribución en los hijos es la misma que en las madres;	(b) para cada clase de madres, la media de
1_m00341-plain	cromosómica, el progreso fue relativamente lento.	La dificultad más importante era la inconveniencia de usar seres humanos para	el mapeo génico, debido al pequeño tamaño de las familias.
1_m00341-plain	vivos. Dentro de este amplio campo,	la genética humana es la ciencia de la variación y la	herencia en los seres humanos, y la genética médica estudia la
1_m00341-plain	en que se ha desarrollado la genética.	Las áreas de especialización más importantes son el estudio de cromosomas (citogenética)	, el estudio de la estructura y función de genes individuales (
1_m00341-plain	cama (del griego klinikos), y	un genetista clínico es un médico genetista apropiadamente cualificado y directamente	implicado en el diagnóstico de enfermedades genéticas y en el cuidado de
1_m00341-plain	cromosomas del par. En cada caso,	la causa es un error único en la información genética	. Por lo regular, dichos trastornos muestran patrones genealógicos obvios y
1_m00341-plain	. Desde un punto de vista amplio.	el producto del gen normal a menudo es una proteína estructural no enzimática, como	el colágeno, o bien un componente proteico de una membrana o
1_m00341-plain	, así como mediante otros métodos, entre	los cuales el más directo es la demostración de un defecto puntual a	nivel del producto génico o a nivel del DNA que se corresponde
1_m00341-plain	(McKusick, 1990). Heterogeneidad Cuando	un trastorno genético que parece ser una entidad única se analiza meticulosamente,	es frecuente hallar que resulta genéticamente heterogéneo; esto es, el
1_m00341-plain	, tabla 4-1 para los ejemplos).	La heterogeneidad quizá sea el resultado de diferentes mutaciones en el	mismo locus (heterogeneidad alélica), de mutaciones en diferentes loci
1_m00341-plain	gen de la B-globina producen el fenotipo.	La heterogeneidad alélica es una importante causa de variación clínica.	Muchos loci poseen más de un alelo mutante; de hecho,
1_m00341-plain	congénita; de las anomalías, alrededor de	una de cada 30 pareció ser un trastorno monogénico y alrededor de uno	de cada cuatro de éstos se pensó que constituía una nueva mutación
1_m00341-plain	hermanos son primos en segundo grado, y	un niño es el sobrino en segundo grado del primo	hermano de sus padres. Los miembros de las parejas relacionados por
1_m00341-plain	generar copias casi infinitas (clones) de	una secuencia particular es la base de la tecnología de DNA	recombinante y de su aplicación a la genética humana y médica.
1_m00341-plain	de restricción Uno de los avances clave en	el desarrollo de la clonación molecular fue el descubrimiento, a principios de los	años 70, de las endonucleasas de restricción bacterianas, enzimas que
1_m00341-plain	DNA-ligasa puede unir incluso estas moléculas. Vectores	Un vector es una molécula de DNA que puede replicarse	de manera autónoma en un huésped, como las celarlas bacterianas o
1_m00341-plain	un cromosoma entero casi siempre es letal (	una excepción importante es la monosomía para el cromosoma X que	se describe en el cap., 10). Las causas
1_m00341-plain	cualquiera que sea el mecanismo molecular subyacente,	el mecanismo cromosómico más común es la no disyunción meiótica, el fallo	de la separación normal de un par de cromosomas durante una de
1_m00341-plain	normal del varón. El siguiente paso en	la comprensión de los cromosomas sexuales humanos fue la explicación de la cromatina sexual en	términos de inactivación del X. A medida que se iban identificando
1_m00341-plain	una mujer 47, XXX (derecha)	Las regiones cromosómicas brillantes teñidas son las que se replican en etapa tardía	de la fase S. Los cromosomas X activos (flecha pequeña
1_m00341-plain	regula la expresión génica. Inicialmente se aceptó	la posibilidad de que la secuencia ZFY fuera el principal gen determinante del testículo,	largo tiempo buscado, el TDF. Sin embargo, estudios más
1_m00344-plain	física. El tema del libro es que	los genes son los componentes clave de las células vivientes	y que para comprender qué es la vida debemos saber cómo actúan
1_m00344-plain	Rutherford todavía se encontraba allí. Ahora,	el Cavendish sería la escena de otra revolución científica extraordinaria	. ya había liberado la sorprendente energía encerrada dentro del átomo.
1_m00344-plain	para seguir donde él se había detenido.	La historia de Rosalind Franklin es un capítulo complejo y oscuro en la	historia del ADN. Rosalind Franklin, una mujer de treinta años
1_m00344-plain	años cuarenta los científicos habían pensado erróneamente que	el ADN era una molécula pequeña y relativamente simple.	El experto principal en ácidos nucleicos en la década de los veinte
1_m00344-plain	? Sin importar las posibilidades teóricas, sólo	una disposición sería la correcta. Irwin Chargaff, un	refugiado austríaco y más tarde químico en la Universidad de Columbia,
1_m00344-plain	carbono, hidrógeno, oxígeno y nitrógeno.	Las otras dos bases eran las pirimidinas citosina (C) y	timina (T), ambas anillos de seis lados. Más
1_m00344-plain	bases era regular, como ATGCATGCATGC, entonces	la molécula de ADN sería una serie homogénea de nucleótidos sin nada	para distinguir un gen (fuera lo que fuere) de otro
1_m00344-plain	Chase habían establecido que la característica fundamental de	la infección de bacterias por virus era la inyección del ADN del virus en	la bacteria. El ADN dominaba las operaciones de la célula bacteriana
1_m00344-plain	, haciendo que construyera nuevos virus. Era	una demostración poderosa de que el ADN era el material genético principal. No mucho	después, un químico norteamericano se detuvo en Cavendish para una breve
1_m00344-plain	los dos desconocidos que proclamaban haber estado en	la carrera por ser los primeros en comprender la estructura tridimensional	del ADN. Quedó doblemente desconcertado al hallar que Crick había olvidado
1_m00344-plain	un «donante de hidrógeno» hacía que	la molécula de ADN fuese un ácido. Increíblemente, Pauling había	dibujado el grupo fosfato en la espiral de tres miembros con los
1_m00344-plain	Tenían ya los nuevos hechos críticos necesarios.	La forma B del ADN era una hélice que tenía un intervalo regular	de repetición de 34 angstroms de distancia entre cada espira (un
1_m00344-plain	34 angstroms de distancia entre cada espira (	un angstrom es un diez mil millonésimo de metro)	. Esto era precisamente 10 veces la distancia de 3, 4
1_m00344-plain	angstroms entre un nucleótido y el siguiente.	La propia espiral era un cilindro regular de 20 angstroms de	ancho. Watson ya era consciente de algunas de estas medidas.
1_m00344-plain	calles individuales se requiere aún más datos.	El cartografiado de cromosomas es el proceso de determinar la posición relativa	de los genes u otros hitos reconocibles sobre los cromosomas, y
1_m00344-plain	plausible, no es válida. Recuérdese que	el genoma humano es un cordón de ADN, de dos	metros de largo en su estado no enroscado, que comprende de
1_m00344-plain	los genes nos lo dirán. Finalmente,	los mapas son un sine qua non para determinar la	secuencia de bases nitrogenadas del genoma, el código que detalla las
1_m00344-plain	5 % del tamaño de un cromosoma.	Una limitación del cartografiado genético es la necesidad de tener que rastrear genes	específicos u otros fragmentos de ADN en varias generaciones de familias humanas
