Reference	LeftContext	Pivot	RightContext
1_m00306-plain	Los estudios de este caso, en donde	la única desviación de la diploidía es la presencia de un cromosoma Y adicional	en un cariotipo masculino, por otra parte normal, ha dado
1_m00306-plain	Una vez que los investigadores establecieron que en	la especie humana es el cromosoma Y el que alberga la	información genética necesaria para la masculinidad, se realizaron esfuerzos para identificar
1_m00306-plain	el sexo) que codifica a TDF.	Las pruebas de que SRY es el gen responsable se apoyan en la	habilidad de los genéticos moleculares en identificar la presencia o ausencia de
1_m00306-plain	papel del SRY en el desarrollo masculino.	La prueba final de que este gen es el responsable de la masculinidad proviene de	un experimento utilizando ratones transgénicos. Tales animales se producen a partir
1_m00306-plain	normales y de un único cromosoma X en	los varones normales es un caso singular cuando se compara con	el número igual de autosomas presentes en las células de ambos sexos
1_m00306-plain	RNA CONCEPTOS DEL CAPÍTULO Salvo algunas excepciones,	el DNA es el material genético de todos los seres	vivos. La estructura del DNA proporciona las bases químicas para almacenar
1_m00306-plain	general fue correcta. Este capitulo repasa inicialmente	las pruebas de que el DNA es el material genético y luego se discute	la interpretación de su estructura. Características del material genético El material
1_m00306-plain	esta información, y variación por mutación.	La «replicación» del material genético es una de las facetas del ciclo celular	, una propiedad fundamental de todos los organismos vivos. Una vez
1_m00306-plain	organismos descendientes. La «expresión» de	la información genética almacenada es un proceso complejo y la base para	el concepto de flujo de información en la célula. La Figura
1_m00306-plain	muestra un esquema simplificado de este concepto.	El suceso inicial es la transcripción del DNA, cuyo resultado	es la síntesis de tres tipos de moléculas de RNA: RNA
1_m00306-plain	pudiesen tener la función de material genético.	El segundo factor fue la propuesta aceptada a principios y mediados	del siglo XX sobre la estructura química de los ácidos nucleicos.
1_m00306-plain	la estructura química de los ácidos nucleicos.	El químico suizo Friedrick Miescher fue el primero en estudiar el DNA,	en 1868. Tras separar los núcleos del citoplasma celular, aisló
1_m00306-plain	la atención de los ácidos nucleicos, reforzando	las especulaciones de que las proteínas eran el material genético. El tercer factor	que contribuyó a estas creencias fue simplemente un asunto de las áreas
1_m00306-plain	que servía de material genético. Así,	las proteínas eran los candidatos más prometedores y fueron aceptados	de manera más bien pasiva. Entre 1910 y 1930 se hicieron
1_m00306-plain	en bacteriófagos El suceso inicial que condujo a	la aceptación del DNA como material genético fue la publicación en 1944 de Oswald Avery	, Colín MacLeod y Maclyn McCarty sobre la naturaleza química de un
1_m00306-plain	números romanos. En los Estados Unidos,	los tipos I y II son la causa más común de neumonía.	En los experimentos esenciales que condujeron a los nuevos conceptos sobre el
1_m00306-plain	No obstante, las pruebas experimentales de que	una substancia química era la responsable de la transformación eran convincentes	. Posteriormente, en 1944, y tras 10 años de trabajo
1_m00306-plain	, más allá de cualquier duda razonable,	el DNA era la molécula responsable de la transformación.	La Figura 10. 4 presenta, en esquema, los detalles
1_m00306-plain	más allá de cualquier duda razonable, que	el DNA era el principio transformante. Inicialmente se analizó	la proporción nitrógeno / fósforo de la masa fibrosa, coincidiendo ésta
1_m00306-plain	. ¡ Pocas dudas podía haber de que	el principio activo transformante fuese el DNA! La gran cantidad de	trabajo, las comprobaciones de las conclusiones, y la lógica inequívoca
1_m00306-plain	La prueba presentada apoya el hecho de que	un ácido nucleico de tipo desoxirribosa es la unidad fundamental del principio transformante del	Pneumococcus Tipo III». Avery y sus colaboradores reconocieron las implicaciones
1_m00306-plain	trabajo de Rollin Hotchkiss contribuyó a confirmar que	el DNA es el factor esencial de la transformación,	y no las proteínas. En 1949, en un estudio distinto
1_m00306-plain	Avery, MacLeod y McCarthy que demuestra que	el DNA es el principio transformante [0] Actualmente	, este organismo recibe el nombre de Streptoroccus pneumoniae. Replicación y
1_m00306-plain	molde para la producción de su complementaria.	La síntesis de DNA es un proceso complejo y ordenado, orquestado	por una miríada de encimas y de otras moléculas. Todas ellas
1_m00306-plain	fidelidad para polimerizar nucleótidos en cadenas polinucleotídicas.	La recombinación genética es un proceso. Tras la propuesta de	Watson y Crick de la estructura del DNA, los científicos centraron
1_m00306-plain	en cada ciclo de replicación del genoma,	lo que obviamente es un número excesivo. Aunque no está	exento de error, en todos los organismos ha evolucionado un sistema
1_m00306-plain	nucleótidos se uniesen covalentemente en cadenas polinucleotídicas,	el resultado sería la producción de dos dobles cadenas de	DNA idénticas. Cada molécula de DNA replicada consistiría en una cadena
1_m00306-plain	un experimento que proporcionaba sólidas pruebas de que	la replicación semiconservativa es la forma que utilizan las células para	producir nuevas moléculas de DNA. Se hizo crecer células de E
1_m00306-plain	el 15NH4Cl (cloruro de amonio) era	la única fuente de nitrógeno 15N es un isótopo «pesado» del nitrógeno	que tiene un neutrón más que el isótopo natural 14N. A
1_m00306-plain	] de haba (Vicia faba).	Las puntas de raíz son una fuente excelente de células en división	. Estos investigadores examinaron los cromosomas de estas células tras la replicación
1_m00306-plain	vuelve negra en el punto de emisión.	El resultado final es la presencia de manchas oscuras o «	granos» en la superficie de la sección, identificando así al
1_m00306-plain	la conocemos. En capítulos anteriores establecimos que	el DNA es el material genético y examinamos su estructura	y su replicación. En este capítulo examinaremos dos aspectos más de
1_m00306-plain	B del locas rII del fago T4.	El cistrón B es una de las dos zonas funcionales de	este locas que, en los mutantes, causa una lisis rápida
1_m00306-plain	de un codón especifica el mismo aminoácido.	El razonamiento que conduce a esta conclusión es el siguiente. En los casos en	que se restablece la función silvestre, por ejemplo (+)
1_m00306-plain	CAPÍTULO Los productos finales de la expresión de	la mayoría de los genes son las cadenas polipeptídicas. Estas adquieren una	conformación tridimensional basada en la secuencia primaria de aminoácidos, y a
1_m00306-plain	el código genético. En este capítulo revisaremos	los experimentos que confirmaron que las proteínas son los productos finales de los genes,	y trataremos brevemente los diversos niveles estructurales de las proteínas, su
1_m00306-plain	controla las reacciones químicas del organismo y que	las enfermedades hereditarias que estudió son el resultado de formas alternativas del metabolismo	. Como los términos gen y enzima no eran comunes en la
1_m00306-plain	proporcionó la primera prueba experimental convincente de que	los genes son los responsables directos de la síntesis de	las enzimas. La primera investigación, dirigida con la colaboración de
1_m00306-plain	muestra en la Figura 13. 3,	el pigmento marrón es un derivado del aminoácido triptófano. Se	ha identificado la enzima especifica que controla las reacciones que están alteradas
1_m00306-plain	esta ruta, como scarlet y cardinal.	Lo más importante para nuestra exposición fue la confirmación, en 1940, de	que genes mutantes que controlan diferentes fenotipos morfológicos están ligados directamente a
1_m00306-plain	el crecimiento. Beadle y Tatum razonaron que	el suplemento que restablecía el crecimiento era la molécula que la cepa mutante no	podía sintetizar. La primera cepa mutante aislada precisaba vitamina B-6 en
1_m00306-plain	que Avery, MacLeod y McCarthy mostraron que	el DNA era el factor transformante, y no fue	hasta principios de la década de los 50 que la mayoría de
1_m00306-plain	estrechamente relacionados, es la variación genética.	El origen de dicha variación es la mutación génica, por la que	se alteran las secuencias codificantes como consecuencia de la sustitución adición o
1_m00306-plain	reparar diversos errores y lesiones del DNA.	Las mutaciones génicas son las herramientas de trabajo de los genéticos	y son la materia prima de la evolución. En la exposición
1_m00306-plain	mutaciones génicas son las herramientas de trabajo de	los genéticos y son la materia prima de la evolución.	En la exposición previa del DNA como material genético (Capitulo 10
1_m00306-plain	la variación por mutación. De hecho,	la mutación es un error en el almacenaje de la	información genética. Si se produce un cambio en la información almacenada
1_m00306-plain	las denominadas mutaciones génicas. Como veremos,	el cambio puede ser la sustitución de un solo nucleótido,	o puede implicar la adición o delación de uno o más nucleótidos
1_m00306-plain	de mutación, pronto se hizo evidente que	las mutaciones génicas son el origen de la mayoría de los	alelos, y por lo tanto de mucha de la variación existente
1_m00306-plain	el número de colonias resistentes, ya que	las células mutantes eran las únicas que no se habían lisado	, y por lo tanto las únicas que habían sobrevivido. Para
1_m00306-plain	1 Experimento de Luria-Delbruck, que demuestra que	las mutaciones espontáneas son la fuente de la resistencia a fagos	en bacterias N° de nuestras. Número de bacterias resistentes a
1_m00306-plain	característica de resistencia al fugo T1, en	la que las únicas células que sobreviven son las que han mutado, Cairns utilizó	en su experimento una cepa de bacterias que contenían una mutación que
1_m00306-plain	estas dos categorías tienen un cierto solapamiento,	las mutaciones espontáneas son las que se producen en la naturaleza	. No hay ningún agente específico asociado a ellas y se supone
1_m00306-plain	Una característica constante compartida por los virus,	las bacterias y las celarlas eucarióticas es la capacidad de empaquetar una molécula de	DNA extremadamente larga en un volumen relativamente pequeño. En & bsol
1_m00306-plain	empaquetamiento. Rara vez el espacio disponible en	la cápside del virus es el doble que el volumen del cromosoma	. En muchos casos se llena casi todo el espacio, lo
1_m00306-plain	emparejamiento de bases normal. Vinograd propuso que	la forma superenrollada es la que provoca un empaquetamiento más compacto	, lo que incrementa la velocidad de sedimentación. Las transiciones descritas
1_m00306-plain	en la Figura 17. 1. Considere	una molécula lineal de doble cadena que sea una hélice dextrógira normal de Watson-Crick [	Figura 17. 1 (a)]. Esta hélice contiene
1_m00306-plain	por definición, los superenrollamientos son levógiros.	El resultado final es la formación de una estructura más compacta	con una mayor estabilidad física. En la mayoría de moléculas de
1_m00306-plain	varios obstáculos que los procariotas no encuentran.	El más importante es la manera en la que el DNA	está empaquetado en las estructuras denominadas nucleosomas. En la mayoría de
1_m00306-plain	herencia biparental característicos de los genes nucleares.	Lo que se observa es un modo de herencia uniparental, en	el que las características pasan de la madre [2] a
1_m00306-plain	genes. En la mayoría de eucariotas,	el mtDNA es un dúplex circular que se replica de	manera semiconservativa y que no está asociado con las proteínas cromosómicas características
1_m00306-plain	del DNA circular, como se describe en	el texto L es el número de unión. [11	] Se ha propuesto un modelo por el que estas proteínas organizarían
1_m00306-plain	también se conocen casos de herencia uniparental en	los que es el «padre» (el progenitor	masculino) quien contribuye a este tipo de herencia, como la
1_m00306-plain	celulares sean eficientes en diferentes condiciones ambientales,	lo importante son los niveles de las proteínas presentes o	ausentes en la célula. Que los microorganismos regulen la síntesis de
1_m00306-plain	muestra en la Figura 18. 4.	El descubrimiento de que estas moléculas existen es una prueba sólida de que la inducción	inicial no depende de la interacción entre el inductor y la enzima
1_m00306-plain	distinto a él. Como veremos pronto,	el gen lacI es un gen represor. Hay un segundo	conjunto de mutaciones que producen los mismos efectos y que está situado
1_m00306-plain	estructurales produciendo una molécula represora. Hipotetizaron que	el represor era una molécula alostérica; esto significa que	es una molécula que puede interaccionar con otra de manera reversible,
1_m00306-plain	no puede unir la molécula represora normal.	El resultado es el mismo: los genes estructurales se	transcriben continuamente. En la Figura 18. 5 (d)
1_m00306-plain	el operón. [13] Técnicamente,	el inductor es la alolactosa, un isómero de la	lactosa. En el proceso inicial del metabolismo de la lactosa,
1_m00306-plain	retina producen insulina. En estos organismos,	la regulación diferencial de la expresión génica es la base de la diferenciación y de	la función celular. La pregunta es, pues, ¿ cómo
1_m00306-plain	la mayoría de genes contiene varios elementos.	El primero es una secuencia denominada caja TATA (Figura	19. 3). Esta secuencia se localiza a unas 25-30
1_m00306-plain	no sucede con los promotores. Además,	los intensificadores son los responsables de la expresión génica específica	de tejido. Como grupo, los promotores contienen módulos (la
1_m00306-plain	de transcripción presentes en concentraciones muy bajas.	El resultado ha sido una virtual explosión de información de los	factores de transcripción eucarióticos. Esta sección expondrá algunas de estas nuevas
1_m00306-plain	gen GAL4 codifica un factor de transcripción.	El producto del gen GAL4 es una proteína de 881 aminoácidos que incluye	un dominio de unión a DNA que reconoce y se une a
1_m00306-plain	encontró que una región del extremo N-terminal de	la proteína es el dominio de unión a DNA (	Figura 19. 7). Las proteínas con delaciones que abarcan
1_m00306-plain	mutaciones. Obsérvese que las mutaciones dentro de	los elementos del promotor son las que tienen el mayor efecto sobre	el nivel de la transcripción. Figura 19. 5 Organización corriente
1_m00306-plain	6 Secuencia de DNA del intensificador de SV40	Las secuencias rastreadas son las necesarias para que el efecto intensificador	sea máximo. Los corchetes que hay debajo de la secuencia indican
1_m00310-plain	T, A y G. Una de	las contribuciones de Watson y Crick fue la demostración del modo en que los	tres componentes se unen físicamente para formar el DNA. Estos investigadores
1_m00310-plain	nucleótidas, la adenina, la timina,	la citosina y la guanina son las constituyentes más importantes del DNA.	El DNA tiene una estructura en doble hélice. Figura 2-2 Estructura
1_m00310-plain	tengan las bases TAACGA. Se dice que	el filamento único es un molde sobre el cual se construye	un filamento complementario. Cuando finaliza la replicación se ha formado una
1_m00310-plain	filamentos y otras enzimas efectúan funciones diferentes.	La DNA-polimerasa es una de las enzimas fundamentales del proceso	de replicación. Recorre el trayecto del filamento aislado de DNA añadiendo
1_m00310-plain	humanos poseen incluso 250 millones de nucleótidos,	la replicación seria un proceso extraordinariamente lento si procediese de	forma lineal de un extremo al otro del cromosoma (para un
1_m00310-plain	del genoma no suelen provocar consecuencias clínicas.	Un tipo importante de mutación monogénica es la sustitución de un par de bases	, en la que un par de bases es reemplazado por otro
1_m00310-plain	en una proteína a menudo son patológicas.	Un ejemplo de este tipo de mutación es la delación de 3 xxx que provoca	la mayoría de casos de fibrosis quísticas diagnosticados en individuos de raza
1_m00310-plain	una disminución de la producción de RNAm.	El resultado final es la reducción de la producción de una	proteína determinada. Las mutaciones del potenciador también pueden presentar efectos similares
1_m00310-plain	el capítulo 4 hay una exposición adicional.	Las mutaciones son la fuente original de la variación genética	. Algunas mutaciones provocan enfermedades genéticas mientras que otras no tienen efectos
1_m00310-plain	. Consecuencias clínicas de la mutación: hemoglobinopatías	Los trastornos genéticos de la hemoglobina humana son el grupo más común de enfermedades monogénicas	: se calcula que el 5 % por de la población mundial
1_m00310-plain	de las consecuencias clínicas de la mutación.	La molécula de hemoglobina es un tetrámero compuesto por cuatro cadenas polipeptídicas	dos denominadas alfa y dos denominadas beta. Las cadenas beta están
1_m00310-plain	identificado una amplia gama de hemoglobinopatías diferentes.	La discusión que sigue es una presentación muy simplificada de las principales	formas de estos trastornos. En la tabla 3-1 se resumen los
1_m00310-plain	sus principales características. La más importante de	las anomalías estructurales de la hemoglobina es la anemia de células falciformes. Un	trastorno que afecta aproximadamente a 1 de cada 400- (100 afroamericanos
1_m00310-plain	cadenas de betaglobina normales y otras anormales.	El resultado suele ser la aparición de una talasemia beta +	. Las talasemias beta pueden estar causadas por muchos tipos diferentes de
1_m00310-plain	la base biológica de la patología genética.	El trazado del mapa genético es una etapa fundamental para el conocimiento,	el diagnóstico y el eventual tratamiento de una enfermedad genética. Cuando
1_m00310-plain	como se muestra en la figura 7-7.	La máxima puntuación LOD en la gráfica es la máxima estimación de probabilidad de 9	. Es decir, es la distancia más probable entre los loci
1_m00310-plain	dividida por la probabilidad de no ligamiento.	El logaritmo de esta relación de probabilidades es una puntuación LOD. Las puntuaciones LOD	superiores a 3, 0 se toman como evidencia de ligamiento,
1_m00310-plain	Specialties reconoció esta nueva especialidad. Mientras que	la genética médica es el estudio de la naturaleza hereditaria de	la enfermedad humana, la genética clínica trata del cuidado clínico directo
1_m00310-plain	el capítulo 1, las enfermedades genéticas forman	un grupo común y son una causa significativa de la mortalidad y	morbididad humanas. De forma característica. Los trastornos genéticos son complejos
1_m00310-plain	en todos los campos de la medicina,	el diagnóstico preciso es la primera etapa más importante en el	cuidado del paciente. El proceso diagnóstico de un trastorno genético es
1_m00310-plain	más importante en el cuidado del paciente.	El proceso diagnóstico de un trastorno genético es una secuencia compleja de episodios. Depende	de la toma de decisiones diagnósticas y de las pruebas bioquímicas,
1_m00310-plain	de unas normas para emitir el diagnóstico.	Un ejemplo de estos criterios serían los recomendados por el National Institute of	Health Consensus Development Conference para el diagnóstico de la neurofibromatosis de tipo
1_m00310-plain	a todas las preguntas sobre el paciente.	El síndrome de Wiedemann-Beckwith es un trastorno autosómico recesivo con expresión variable	y penetrancia incompleta. Además, se cree que el gen exhibe
1_m00310-plain	que ha resistido el paso del tiempo:	El consejo genético es un proceso de comunicación que trata de	los problemas humanos asociados con la ocurrencia, o riesgo de ocurrencia
1_m00310-plain	de la medicina preventiva, que sugiere que	el principal objetivo del consejo genético sería la reducción de la incidencia de las	enfermedades genéticas. Si la prevención o la reducción de la ocurrencia
1_m00310-plain	las enfermedades genéticas. Si la prevención o	la reducción de la ocurrencia es el principal objetivo, entonces el enfoque	debería ser más directivo. Sin embargo, el principal objetivo del
1_m00310-plain	embarazos cuando existe un aumento del riesgo.	Los más evidentes son la magnitud de La cifra del riesgo	y la carga o el impacto de la enfermedad. Sin embargo
1_m00310-plain	negativo Una de las discusiones más frecuentes en	las visitas hospitalarias es la anotación de que los antecedentes familiares	de una persona son «negativos, o no «cooperantes»
1_m00310-plain	progenitores tiene el gen, la existencia de	un mosaicismo de la línea germinal seria la explicación más probable. 4.	Diagnostico incorrecto. Uno de los supuestos y principios básicos de la
1_m00310-plain	Uno de los supuestos y principios básicos de	la genética médica es un diagnóstico preciso. Este paciente cumple	los criterios NIH establecidos para la NF1 (v. cap.
1_m00310-plain	siendo del 50 % ya que sabemos que	la madre de la generación 11 es una portadora. Supongamos ahora que la	mujer de la generación III tiene tres hijos (generación IV)
1_m00310-plain	. Comenzamos con la probabilidad previa de que	la mujer de la generación III sea una portadora. Como su nombre sugiere	, la probabilidad previa indica la probabilidad de que sea una portadora
1_m00310-plain	su nombre sugiere, la probabilidad previa indica	la probabilidad de que sea una portadora antes de que expliquemos que	ha tenido tres hijos varones normales. Puesto a que sabemos que
1_m00310-plain	hijos normales, calculando la probabilidad de que	los tres sean normales dado que ella es una portadora. Ya que esta probabilidad	está condicionada por su estado de portadora, se denomina probabilidad condicional
1_m00310-plain	próxima a 1. A continuación queremos averiguar	la probabilidad de que la mujer sea una portadora y de que sea una	portadora con tres hijos normales. Para obtener la probabilidad de la
1_m00310-plain	averiguar la probabilidad de que la mujer sea	una portadora y de que sea una portadora con tres hijos normales.	Para obtener la probabilidad de la coocurrencia de estos dos sucesos,
1_m00310-plain	concepto descrito en el capítulo 4).	La probabilidad conjunta de que sea una portadora es de 1 / 2	x 1 / 8 = 1 / 16. De modo similar
1_m00310-plain	enfermedad crónica y / o discapacidad. Posiblemente	lo único excepcional sea la percepción que la familia tiene sobre	el significado de un trastorno genético. En muchos procesos adquiridos,
1_m00324-plain	; más adelante continuaremos discutiendo el tema.	La historia de la ciencia es un rico mosaico de líneas individuales de	investigación, a menudo sin ningún fin evidente más allá del conocimiento
1_m00324-plain	», los virus que atacan bacterias.	Los más intensamente estudiados de éstos habían sido los fagos que infectan a la Escherichia	coli. Esta humilde bacteria, aislada por primera vez de las
1_m00324-plain	Hacer que las células no sean hospitalarias con	los virus dañinos es la base de muchas vacunas. Un	ejemplo espectacular es el de la vacuna para el virus de la
1_m00324-plain	dañinos es la base de muchas vacunas.	Un ejemplo espectacular es el de la vacuna para el virus	de la viruela. Como resultado de un esfuerzo mundial por erradicar
1_m00324-plain	contacto con todo paciente de viruela conocido.	Los humanos son los únicos anfitriones conocidos de este virus	. En octubre de 1975 se informó del último caso de viruela
1_m00324-plain	del ADN y el ARN en soluciones mediante	la trituración de células en el laboratorio era un fenómeno conocido. La destrucción de	estos ácidos nucleicos fue rastreada en las «nucleasas», enzimas
1_m00324-plain	de bases nitrogenadas, AT o GC.	Los laterales son los «espinazos» de azúcar desoxirribosa	(S) y fosfato (P) de la hélice:
1_m00324-plain	por el fugo bacteriano «lambda».	El enzima era una «exonucleasa», así llamado	debido a que funciona cortando nucleótidos del extremo de una molécula de
1_m00324-plain	replicarse y funcionar en una célula particular.	La célula de elección ha sido la célula bacteriana, por varias razones	. Primero, las bacterias pueden ser cultivadas bajo condiciones controladas,
1_m00324-plain	célula bacteriana típica existe en dos formas.	Una es el cromosoma bacteriano individual que, a	diferencia de los cromosomas de nuestras células, tiene la forma de
1_m00324-plain	célula bajo ciertas condiciones. Por ejemplo,	el veneno fatal del tétanos es un producto de genes que hay en	los plásmidos de la bacteria del tétanos. La E. coli
1_m00324-plain	del viajante». Probablemente los genes de	los plásmidos más ampliamente estudiados sean los que confieren resistencia a antibióticos específicos	. Ciertas bacterias pueden producir enzimas, codificados en los genes plásmidos
1_m00324-plain	aislar plásmidos es que uno puede bautizarlos.	El plásmido xxx era el plásmido (p) centésimo primero	(101) aislado por Stanley Cohen (SC). Aun
1_m00324-plain	mancha es una «colonia», y	una colonia es un clon, una población de células	derivadas de una sola. Todas las células en este clon son
1_m00324-plain	el Proyecto Genoma Humano se propone hacer.	El resultado de dicho análisis sería una cadena de 3. 000 millones	de letras A, T, G 0 C, cada una
1_m00324-plain	sin función conocida actualmente. Aun así,	la posesión de semejante secuencia sólo sería el comienzo. Conocer la secuencia no	nos diría por sí misma la localización de todos nuestros genes.
