Reference	LeftContext	Pivot	RightContext
1_m00678-plain	de crecimiento pueden a veces modular sus mensajes mutuamente, enviando señales	allá_ADV_allá donde_ADV_donde las_ART_el rutas_NC_ruta convergen_VLfin_converger|convergir o_CC_o se_SE_se cruzan_VLfin_cruzar._FS_. Otras_QU_otro moléculas_NC_molécula de_PREP_de	adhesión focal que se activan por integrinas (quinasas de adhesión focal
1_m00678-plain	una propiedad que sugiere que ellas también coadyuvan a transmitir mensajes desde	las_ART_el integrinas_NC_integrina a_PREP_a los_ART_el genes_NC_gen|genes y_CC_y a_PREP_a otras_QU_otro partes_NC_parte de_PREP_de	la célula. Lo que no está tan claro es cómo las
1_m00678-plain	bases moleculares del desarrollo lo que fomentó las investigaciones que han llevado	al_PAL_al descubrimiento_NC_descubrimiento de_PREP_de las_ART_el integrinas_NC_integrina y_CC_y otras_QU_otro moléculas_NC_molécula de_PREP_de	adhesión. Tenemos pruebas, no obstante, de que el desarrollo
1_m00678-plain	aprestan a investigar la eficacia anticancerígena de los inhibidores de xxx.	Esos_DM_ese agentes_NC_agente u_CC_o otros_QU_otro del_PDEL_del mismo_ADJ_mismo	tenor pueden acudir en auxilio de las personas que padecen retinopatía proliferativa
1_m00678-plain	los aspectos básicos de la investigación: averiguar los mecanismos en virtud	de_PREP_de los_ART_el cuales_REL_cual las_ART_el integrinas_NC_integrina y_CC_y otras_QU_otro moléculas_NC_molécula de_PREP_de	adhesión gobiernan el desarrollo y la fisiología. Independientemente de nuestra óptica
1_m00678-plain	de un problema ceñido ha terminado por llevarnos al inmenso campo de	los_ART_el efectos_NC_efecto producidos_VLadj_producir por_PREP_por las_ART_el integrinas_NC_integrina y_CC_y otras_QU_otro moléculas_NC_molécula de_PREP_de	adhesión. Los progresos obtenidos ponen una vez más de manifiesto la
1_m00680-plain	, ahora entran a raudales. Otra señal es la inflamación:	los_ART_el macrófagos_NC_macrófago circulantes_ADJ_circulante y_CC_y otros_QU_otro glóbulos_NC_glóbulo blancos_ADJ_blanco	del sistema inmunitario convergen en las células necróticas y las ingieren.
1_m00680-plain	de su ciclo vital. Las células T son protagonistas estelares de	la_ART_el respuesta_NC_respuesta inmunitaria_ADJ_inmunitario contra_PREP_contra virus_NC_virus y_CC_y otros_QU_otro microorganismos_NC_microorganismo invasores_ADJ_invasor	. Las células T se producen a partir de precursores, en
1_m00680-plain	celular. Uno de los extremos de la proteína se proyecta hacia	el_ART_el exterior_NC_exterior de_PREP_de la_ART_el célula_NC_célula y_CC_y el_ART_el otro_QU_otro hacia_PREP_hacia dentro_ADV_dentro	, pudiendo así transmitir señales al interior celular. Cuando las células
1_m00680-plain	de Fas presente en las células activadas se une al Fas que	hay_VHfin_haber en_PREP_en la_ART_el misma_ADJ_mismo célula_NC_célula o_CC_o en_PREP_en otra_QU_otro célula_NC_célula T_ACRNM_T	activada, en el sitio donde se ha desencadenado la infección.
1_m00680-plain	erradicar la infección), muriéndose después. Hemos dicho ya que	la_ART_el sensibilidad_NC_sensibilidad de_PREP_de los_ART_el linfocitos_NC_linfocito T_ACRNM_T y_CC_y otras_QU_otro células_NC_célula a_PREP_a	diferentes inductores de la apoptosis puede depender del estado de las células
1_m00680-plain	, poniendo en marcha la maquinaria apoptósica en las células infectadas.	Esta_DM_este actividad_NC_actividad es_VSfin_ser útil_ADJ_útil y_CC_y aumenta_VLfin_aumentar la_ART_el eficacia_NC_eficacia de_PREP_de otras_QU_otro tácticas_NC_táctica inmunitarias_ADJ_inmunitario	para combatir las infecciones. Pero el ligando de Fas presente en
1_m00689-plain	en su propio interés. Se espera que los fármacos del futuro	destinados_VLadj_destinar a_PREP_a remediar_VLinf_remediar el_ART_el cáncer_NC_cáncer y_CC_y otras_QU_otro patologías_NC_patología similares_ADJ_similar	consistan en compuestos químicos que actúen sobre los proteosomas y las vías
1_m00689-plain	enzimas responsables. Por último, en 1988, dos grupos -	dirigido_VLadj_dirigir uno_CARD_uno por_PREP_por Goldberg_NP_Goldberg y_CC_y el_ART_el otro_QU_otro por_PREP_por Martin_NP_Martin	C. Rechsteiner, de la Universidad de Utah- observaron que de
1_m00689-plain	antes de que alcancen la membrana celular. El moco pegajoso que	se_SE_se acumula_VLfin_acumular en_PREP_en los_ART_el pulmones_NC_pulmón y_CC_y en_PREP_en otros_QU_otro órganos_NC_órgano de_PREP_de	las personas con fibrosis quística obedece a la falta de transportadores de
1_m00690-plain	virus del tipo de varicela, en el que se han insertado	genes_NC_gen|genes determinantes_ADJ_determinante de_PREP_de la_ART_el xxx_NP_xxx y_CC_y de_PREP_de otras_QU_otro dos_CARD_dos proteínas_NC_proteína	, una que interviene en la fabricación del núcleo del VIH y
1_m00695-plain	vancomicina, podemos reforzar la fuerza del fármaco. Una molécula de	vancomicina_NC_vancomicina se_SE_se une_VLfin_unir al_PAL_al peptidoglicano_ADJ_peptidoglicano y_CC_y arrastra_VLfin_arrastrar la_ART_el aproximación_NC_aproximación de_PREP_de la_ART_el otra_QU_otro mitad_NC_mitad del_PDEL_del	par, la otra molécula de vancomicina. Aumenta así la eficacia
1_m00697-plain	Fármacos contra virus En la lucha contra los virus disponemos ya de	un_ART_un buen_ADJ_bueno armamentario_NC_armamentario de_PREP_de medicinas_NC_medicina eficaces_ADJ_eficaz y_CC_y de_PREP_de otras_QU_otro en_PREP_en fase_NC_fase	de desarrollo. La investigación en genomas víricos acelera el progreso.
1_m00697-plain	de fármacos antivíricos, espero ofrecer una idea de los avances extraordinarios	que_CQUE_que debemos_VLfin_deber a_PREP_a la_ART_el genómica_ADJ_genómica y_CC_y otras_QU_otro técnicas_NC_técnica refinadas_ADJ_refinado	. Búsqueda de fármacos Los primeros fármacos antivíricos (contra el herpes
1_m00697-plain	escaso parecido con los del hombre, y evitar así un posible	daño_NC_daño en_PREP_en las_ART_el células_NC_célula sanas_ADJ_sano y_CC_y otros_QU_otro efectos_NC_efecto secundarios_ADJ_secundario	intolerables. No desdeñan los dominios proteicos que compartan básicamente todas las
1_m00697-plain	y usarla después en el desarrollo de un fármaco. Se inserta	el_ART_el gen_NC_gen correspondiente_ADJ_correspondiente en_PREP_en bacterias_NC_bacteria u_CC_o otros_QU_otro tipos_NC_tipo de_PREP_de	células, que sintetizan copias innúmeras de la proteína codificada. Las
1_m00697-plain	bloqueo del CCR5 podría conseguirlo. De los cuatro antigripales iniciales,	la_ART_el amantidina_NC_amantidina y_CC_y la_ART_el rimantidina_NC_rimantidina interrumpen_VLfin_interrumpir otras_QU_otro partes_NC_parte del_PDEL_del	proceso de entrada. Los farmacólogos hallaron los compuestos al realizar un
1_m00697-plain	interferones, por ejemplo, que participan en esa batalla inmunitaria,	inhiben_VLfin_inhibir la_ART_el síntesis_NC_síntesis proteica_ADJ_proteico y_CC_y otros_QU_otro aspectos_NC_aspecto de_PREP_de	la replicación vírica en las células infectadas. En concreto, el
1_m00697-plain	, ha de permitirnos descubrir un grupo nuevo de proteínas que estimulen	la_ART_el producción_NC_producción de_PREP_de anticuerpos_NC_anticuerpo antivíricos_ADJ_antivírico o_CC_o que_CQUE_que potencien_VLfin_potenciar otras_QU_otro partes_NC_parte del_PDEL_del	sistema inmunitario contra los virus.
1_m00699-plain	hidratos de carbono para reconocer e interaccionar con sus células huésped.	Algunos_QU_alguno fármacos_NC_fármaco existentes_ADJ_existente y_CC_y otros_QU_otro en_PREP_en elaboración_NC_elaboración	contienen glúcidos o moléculas que remedan a aquéllos con el fin de
1_m00699-plain	normales y malignas, pueden potenciar o limitar el crecimiento canceroso;	depende_VLfin_depender que_CQUE_que ocurra_VLfin_ocurrir lo_ART_el uno_CARD_uno o_CC_o lo_ART_el otro_QU_otro de_PREP_de la_ART_el	forma en que dichos glúcidos se degraden o eliminen por las enzimas
1_m00703-plain	de los organismos, la síntesis in vitro de la vida,	la_ART_el terapia_NC_terapia de_PREP_de múltiples_QU_múltiple patologías_NC_patología y_CC_y otras_QU_otro cuestiones_NC_cuestión de_PREP_de	parejo tenor. En el marco del Proyecto Genoma Humano se están
1_m00703-plain	lugar, de los genes y sus productos; es decir,	aclarar_VLinf_aclarar su_PPO_suyo conducta_NC_conducta en_PREP_en una_ART_un u_CC_o otra_QU_otro región_NC_región del_PDEL_del	organismo y en un cuerpo que además cambia a lo largo de
1_m00703-plain	de un mismo árbol. En numerosas ocasiones, según qué genes	miremos_VLfin_mirar trenzaremos_VLfin_trenzar una_ART_un historia_NC_historia familiar_ADJ_familiar u_CC_o otra_QU_otro para_PREP_para los_ART_el	mismos organismos. Ello se debe a que el ADN no se
1_m00707-plain	cargo de funciones cruciales que correspondían a las lesionadas o perdidas,	pueden_VMfin_poder suministrar_VLinf_suministrar analgésicos_ADJ_analgésico y_CC_y otros_QU_otro elementos_NC_elemento "_QT_"	extra " e incluso facilitar la terapia génica, segregando las proteínas
1_m00707-plain	de un implante funcionan mal o mueren si distan más de 500	micrometros_NC_micrometros de_PREP_de los_ART_el vasos_NC_vaso sanguíneos_ADJ_sanguíneo u_CC_o otras_QU_otro fuentes_NC_fuente de_PREP_de	alimentación. Los diseños vasculares (o de paso de flujo)
1_m00708-plain	que el autismo se origina en las primeras semanas del embarazo,	cuando_CSUBX_cuando el_ART_el cerebro_NC_cerebro del_PDEL_del embrión_NC_embrión y_CC_y el_ART_el resto_NC_resto de_PREP_de su_PPO_suyo sistema_NC_sistema	nervioso comienzan a desarrollarse. El trabajo de Miller y Strömland me
1_m00708-plain	pura lógica había que preguntarse entonces si los casos de autismo debidos	a_PREP_a la_ART_el talidomida_NC_talidomida se_SE_se parecían_VLfin_parecer o_CC_o no_NEG_no a_PREP_a aquellos_DM_aquel otros_QU_otro cuya_REL_cuyo causa_NC_causa	se desconocía. Salvo en su comportamiento, los autistas acostumbran tener
1_m00708-plain	en el autismo. Conocidas las alteraciones cerebrales de los autistas,	podrían_VMfin_poder sugerirse_VLinf_sugerirse medicamentos_NC_medicamento y_CC_y otros_QU_otro medios_NC_medio terapéuticos_ADJ_terapéutico	para aliviar los efectos de las lesiones. El diseño de un
1_m00708-plain	, el estudio del comportamiento, la aplicación de las técnicas de	formación_NC_formación de_PREP_de imágenes_NC_imagen al_PAL_al cerebro_NC_cerebro y_CC_y otros_QU_otro medios_NC_medio nos_PPX_nosotros	traerán, cabe esperar, nuevas ráfagas de luz, que redundarán
1_m00710-plain	de acción se sustenta en mecanismos distintos, presentan graves inconvenientes.	Pueden_VMfin_poder causar_VLinf_causar confusión_NC_confusión y_CC_y otros_QU_otro efectos_NC_efecto secundarios_ADJ_secundario	neurológicos y no son eficaces contra una de las dos clases principales
1_m00710-plain	. Los virus de tipo B, mucho más uniformes, portan	una_ART_un sola_ADJ_solo variante_NC_variante de_PREP_de hemaglutinina_NC_hemaglutinina y_CC_y otra_QU_otro de_PREP_de neuraminidasa_NC_neuraminidasa	, si bien la secuencia de aminoácidos también varía de una cepa
1_m00710-plain	de algo más profundo de lo que sugiere a simple vista.	La_ART_el fatiga_NC_fatiga y_CC_y otras_QU_otro incomodidades_NC_incomodidad que_CQUE_que	se sufren durante los últimos días de la gripe resultan, sobre
1_m00712-plain	o compresiones. Así, un cartílago bioartificial aumenta de tamaño y	contiene_VLfin_contener más_ADV_más cantidad_NC_cantidad de_PREP_de colágeno_NC_colágeno y_CC_y de_PREP_de las_ART_el demás_QU_demás proteínas_NC_proteína que_CQUE_que	forman la matriz extracelular si se cultiva en recipientes rotatorios, que
1_m00712-plain	los principales objetivos de la ingeniería de tejidos- los expertos deberán comprender	mejor_ADJ_bueno|mejor cómo_ADV_cómo hacer_VLinf_hacer cultivar_VLinf_cultivar hepatocitos_NC_hepatocito y_CC_y otras_QU_otro células_NC_célula del_PDEL_del	hígado en condiciones que maximicen su capacidad de desempeñar funciones fisiológicas normales
1_m00715-plain	escasean hígados y riñones que podrían salvar vidas, como insuficiente es	la_ART_el piel_NC_piel para_PREP_para los_ART_el quemados_VLadj_quemar y_CC_y otros_QU_otro cuyas_REL_cuyo heridas_NC_herida	no sanan debidamente. A menudo es más fácil reparar el coche
1_m00715-plain	la cadera bien vascularizado. Algunos biomateriales, como el colágeno,	están_VEfin_estar disponibles_ADJ_disponible en_PREP_en la_ART_el naturaleza_NC_naturaleza o_CC_o pueden_VMfin_poder adaptarse_VCLIinf_adaptarse desde_PREP_desde otros_QU_otro usos_NC_uso biomédicos_ADJ_biomédico	. Nosotros nos contamos entre quienes preparan nuevos materiales poliméricos biodegradables.
1_m00725-plain	con el tratamiento de soporte solo con respecto a la supervivencia,	calidad_NC_calidad de_PREP_de vida_NC_vida y_CC_y otras_QU_otro variables_NC_variable clínicas_ADJ_clínico	. Los participantes fueron pacientes con cáncer colorrectal metastásico en los que
1_m00725-plain	. El tratamiento de soporte incluyó antibióticos, analgésicos, transfusiones,	corticoides_NC_corticoide o_CC_o cualquier_QU_cualquier otro_QU_otro tratamiento_NC_tratamiento sintomático_ADJ_sintomático	(excepto irinotecan u otro inhibidor de la topoisomerasa I) y
1_m00725-plain	, analgésicos, transfusiones, corticoides o cualquier otro tratamiento sintomático (	excepto_PREP_excepto irinotecan_VLfin_irinotecan u_CC_o otro_QU_otro inhibidor_ADJ_inhibidor de_PREP_de	la topoisomerasa I) y / o la asistencia de un psicoterapeuta
1_m00725-plain	. El valor del irinotecan se confirmó en términos de supervivencia,	calidad_NC_calidad de_PREP_de vida_NC_vida y_CC_y otras_QU_otro variables_NC_variable clínicas_ADJ_clínico	. Por consiguiente, el irinotecan puede recomendarse como tratamiento estándar de
1_m00731-plain	que el segundo cebador de cada reacción presenta versiones sutilmente diferentes,	una_ART_un específica_ADJ_específico para_PREP_para la_ART_el secuencia_NC_secuencia normal_ADJ_normal y_CC_y la_ART_el otra_QU_otro específica_ADJ_específico para_PREP_para	la secuencia mutante. Normalmente se incluye un par de cebadores de
1_m00731-plain	lugares de poliadenilación y las fronteras entre intrones y exones. Posteriormente	pueden_VMfin_poder hacerse_VCLIinf_hacerse intentos_NC_intento de_CSUBI_de identificar_VLinf_identificar y_CC_y caracterizar_VLinf_caracterizar elementos_NC_elemento del_PDEL_del promotor_NC_promotor y_CC_y otros_QU_otro elementos_NC_elemento reguladores_NC_regulador	en la secuencia adyacente por 5 ', y definir el lugar
1_m00731-plain	permitirá captar de una mezcla compleja a la proteína de interés.	Terapia_NC_terapia génica_ADJ_génico y_CC_y otras_QU_otro estrategias_NC_estrategia terapéuticas_ADJ_terapéutico	basadas en genética molecular Principios básicos de las estrategias de tratamiento de
1_m00735-plain	de Karnofsky de más de 70. Los criterios de exclusión fueron	la_ART_el participación_NC_participación previa_ADJ_previo en_PREP_en este_DM_este estudio_NC_estudio o_CC_o en_PREP_en otro_QU_otro estudio_NC_estudio sobre_PREP_sobre	un inhibidor de la proteasa del VIH-1, la enfermedad aguda,
1_m00735-plain	en la práctica clínica. Serán necesarios nuevos estudios para evaluar si	el_ART_el tratamiento_NC_tratamiento combinado_VLadj_combinar inicial_ADJ_inicial de_CSUBI_de ritonavir_VLinf_ritonavir y_CC_y otros_QU_otro fármacos_NC_fármaco antirretrovirales_ADJ_antirretrovirales	o el cambio simultáneo de dos o más fármacos anti-VIH-1 confiere un
1_m00898-plain	materna. - Identificar la mutación exclusivamente en familias afectas y no	en_PREP_en sujetos_NC_sujeto sanos_ADJ_sano o_CC_o control_NC_control o_CC_o con_PREP_con otro_QU_otro tipo_NC_tipo de_PREP_de	neuropatía óptica. - La mutación no debe coexistir con otras mutaciones
1_m00898-plain	afectos presenten mutaciones frescas, lo cual es sugerido por la ausencia	de_PREP_de mutación_NC_mutación en_PREP_en la_ART_el madre_NC_madre u_CC_o otros_QU_otro parientes_NC_pariente de_PREP_de	esta línea, esto solo ha sido descrito para una mutación reciente
1_m00898-plain	familias estudiadas en Canadá a la mutación 14484 en las que se	utilizó_VLfin_utilizar inicialmente_ADV_inicial un_ART_un procedimiento_NC_procedimiento rutinario_ADJ_rutinario y_CC_y posteriormente_ADV_posterior|posteriormente otros_QU_otro de_PREP_de los_ART_el	referidos más específicos. Se han propuesto numerosas hipótesis que tratan de
