id,presence,candidate_term_left,candidate_term_right,occurrence,full_context
H24_economy_1,none,[None],[None], refiere el artículo,"de la investigación que se especifican en las medidas a que se refiere el artículo130 J. Considerando que en la ejecución del presente programa,"
H24_economy_2,none,[None],[None], refiere el apartado,parte de la evaluación global de las actividades comunitarias a que se refiere el apartado2 del artículo 4 de la Decisión por la que se adopta
H24_economy_3,none,[None],[None], llamado exocitosis,"Cuando la célula secreta sus productos, se sirve de un proceso llamado exocitosis(exo, «fuera»; cyto, «célula»"
H24_economy_4,none,[None],[None], llama duramadre,"es gruesa, dura y flexible, pero no maleable; se llama duramadre. La capa intermedia de las meninges, la membrana aracnoides,"
H24_economy_5,none,[None],[None], llamado masa,las áreas circundantes en mitades simétricas. Un puente de tejido neural llamado masaintermedia atraviesa la línea media del tercer ventrículo y sirve como un
H24_economy_6,none,[None],[None], llamado el plexo,"se forma en un tejido especial con un riego sanguíneo especialmente rico llamado el plexocoroideo, situado en los cuatro ventrículos. La circulación de LCR"
H24_economy_7,none,[None],[None], denomina con frecuencia,"el lóbulo occipital posterior y medial. La corteza visual primaria se denomina con frecuenciacorteza estriada, porque tiene una capa de células que se tiñe"
H24_economy_8,none,[None],[None], llamados órganos,"receptores de extensión se localizan también en los tendones, en los llamados órganostendinosos de Golgi (OTG). Estos receptores detectan la cantidad"
H24_economy_9,none,[None],[None], llamado SRY,que controla su desarrollo parece ser un único gen del cromosoma Y llamado SRY. Este gen produce un enzima llamado factor determinante de los testículos
H24_economy_10,none,[None],[None], llamado factor,"gen del cromosoma Y llamado SRY. Este gen produce un enzima llamado factordeterminante de los testículos, responsable de que las gónadas indiferenciadas se"
H24_economy_11,none,[None],[None], llama sistema,"el útero y los dos tercios internos de la vagina, se llama sistemade Müller. El precursor de los órganos sexuales masculinos, que"
H24_economy_12,none,[None],[None], llama sistema,"el conducto deferente, las vesículas seminales y la próstata, se llama sistemade Wolff (estos sistemas se denominan así en honor a sus"
H24_economy_13,none,[None],[None], llamado hormona,"testículos segregan dos tipos de hormonas. La primera, un péptido llamado hormonainhibidora del sistema de Muller, hace exactamente lo que indica su"
H24_economy_14,none,[None],[None], llama efecto,"ciclo estrogénico se lentifica y acaba por detenerse. Este fenómeno se llama efectoLee-Boot (van der Lee y Boot, 1955). Si"
H24_economy_15,none,[None],[None], llamado homeostasis,regulación del fluido que baña nuestras células forma parte de un proceso llamado homeostasis(«situación similar»). Este capítulo trata de los
H24_economy_16,none,[None],[None], llamado renina,"el flujo sanguíneo hacia los riñones disminuye, éstas secretan un enzima llamado renina. Este enzima entra en la sangre, donde cataliza la conversión"
H24_economy_17,none,[None],[None], designan con la letra,"enzimático de la siguiente. Algunos de los componentes del complemento se designan con la letra"" C "" seguida por un número que se relaciona más con"
H24_economy_18,none,[None],[None], representa con el símbolo,la porción de la cadena pesada en el fragmento xxx se la representa con el símboloxxx. Las secuencias de aminoácidos revelan variaciones en la estructura de
H24_economy_19,none,[None],[None], refieren el aislamiento,"T, aún no se han identificado antígenos convencionales. Ciertos informes refieren el aislamientode líneas de linfocitos T provenientes de las articulaciones que son conducidos"
H24_economy_20,none,[None],[None], llama una fosfotirosina,"suavemente sobre una tirosina portadora de un fosfato, lo que se llama una fosfotirosina. Pero cada dominio abarca también una segunda región, que difiere"
H24_economy_21,none,[None],[None], llamarían genes,"multitud de esas unidades hereditarias que, andando el tiempo, se llamarían genes. En cambio, Charles B., Davenport, genético de"
H24_economy_22,none,[None],[None], llama genoma,"las claves del comportamiento que nos individualizan. Manual tan extraordinario se llama genoma. Está escrito en forma de nucleótidos, con un alfabeto de"
H24_economy_23,none,[None],[None], llamado G418,un medio que contenga dos drogas: un análogo de la neomicina llamado G418y el antiherpético ganciclovir. El G418 mata a las células que
H24_economy_24,none,[None],[None], llaman quimeras,células ME han sobrevivido y proliferado en el animal. (Se llaman quimerasporque contienen células procedentes de dos estirpes de ratón.) Un
H24_economy_25,none,[None],[None], designado como purga,"de Hayward. Se proponen comprobar, a través de un procedimiento designado como purga«ex vivo» de médula ósea, si un oligonucleótido antisentido"
H24_economy_26,none,[None],[None], llama la prueba,"superior. Pero esa tarea de reconocimiento de objetos, así se llama la prueba, valora sólo un tipo de memoria. Para averiguar si los"
H24_economy_27,none,[None],[None], llamar la atención,"humano y el de los primates, tema antaño tabú, consigue llamar la atenciónde nadie. Todo el mundo ha oído hablar de que los"
H24_economy_28,none,[None],[None], Llama la atención,"máquinas de memes. Esta nueva visión es notable e inquietante. Llama la atenciónque una simple teoría abarque cultura, creatividad de la mente y"
H24_economy_29,none,[None],[None], llaman ale,"de un marcador, igual que las de un gen, se llaman alelos. Puesto que las personas por tan dos copias de cada"
H24_economy_30,none,[None],[None], llaman liposomas,"hemos mencionado, de los objetivos particulares de la terapia. Se llaman liposomasunas perlas pequeñas de grasa. En ellos se viene investigando desde"
H24_economy_31,none,[None],[None], Llama la atención,"tipo de isoforma dominante. La miosina es una proteína insólita. Llama la atenciónque, tras la comparación entre las isoformas de distintos mamíferos,"
H24_economy_32,none,[None],[None], llama traducción,"con las especificaciones del ARNm. A este último proceso se le llama traducción. Por "" expresión "" del gen se entiende el mecanismo entero"
H24_economy_33,none,[None],[None], llaman enfermedades,. Muchas de estas muertes se debieron a lo que los médicos llaman enfermedadescon pérdida de sal: diarrea deshidratación y ciertas infecciones. La
H24_economy_34,none,[None],[None], llaman ciclinas,"proteínas implicadas en el control de la continuación del ciclo celular se llaman ciclinas. Estas proteínas, que se identificaron en embriones de invertebrados en"
H24_economy_35,none,[None],[None], llamados genes,"que normalmente funcionan promoviendo la división celular. La primera clase, llamados genessupresores de tumores, inactiva o reprima el progreso a través del"
H24_economy_36,none,[None],[None], llamados protooncogenes,"de un modo incontrolado. Los genes de la segunda clase, llamados protooncogenes, funcionan normalmente promoviendo la división celular. Estos genes pueden """
H24_economy_37,none,[None],[None], representar de manera,orejas puntiagudas se asocian a menudo con estos personajes míticos y pueden representar de manerasimbólica la sensibilidad de estos individuos- en común con los enfermos de
H24_economy_38,none,[None],[None], llama el método,"para trazar parentescos y dependencias. La filogenia molecular, así se llama el método, resulta ser de una lógica implacable. Los genes, constituidos"
H24_economy_39,none,[None],[None], llamamos timeless,"cromosoma X. Supimos entonces que teníamos un gen nuevo; lo llamamos timeless, o tim. ¿ Qué relación guardaba el nuevo gen con"
H24_economy_40,none,[None],[None], llamar linajes,"los que el padre contribuye, se propagan en lo que podemos llamar linajescorrientes, que son por supuesto importantes para la transmisión de rasgos"
H24_economy_41,none,[None],[None], Representemos por flechas,"en un recuadro particular, al que nos referiremos de continuo. Representemos por flechas(lados orientados) los vuelos directos entre las ciudades (vértices"
H24_economy_42,none,[None],[None], representadas por las letras,"con sus secuencias de adenina, timina, citosina y guanina ( representadas por las letrasA, T, C y G), pueden servir para"
H24_economy_43,none,[None],[None], representado por GCAGTCGGACTGGGCTATGTCCGA,", en ese orden. En la computación, el camino está representado por GCAGTCGGACTGGGCTATGTCCGA, una secuencia de ADN de longitud xxx. Podemos ver a"
H24_economy_44,none,[None],[None], llamamos SP1,factor transcripcional humano capaz de reconocer una secuencia reguladora específica. Lo llamamos SP1(specific protein 1). Nos pusimos a purificar la molécula
H24_economy_45,none,[None],[None], llamados factores,"habían ensamblado en el centro promotor otros factores de transcripción, ahora llamados factoresbasales. Durante ese decenio, el laboratorio de Roeder y otros"
H24_economy_46,none,[None],[None], designan de acuerdo,zona de la región reguladora de los genes. Los coactivadores se designan de acuerdocon sus pesos moleculares (en kilodalton). ACTIVADORES Estas proteínas
H24_economy_47,none,[None],[None], refieren los grados,"Cuando se examina el parentesco en las familias, a menudo se refieren los gradosde relación. Los familiares de primer grado están relacionados como padres-descendencia"
H24_economy_48,none,[None],[None], designan por comas,"tercera región del brazo largo del cromosoma 14. Las subbandas se designan por comasdecimales después de la banda (p. ej., 14q32"
H24_economy_49,none,[None],[None], designarían como 69XXX,cada núcleo celular). Los cariotipos de estas dos entidades se designarían como 69XXXy 92XXX respectivamente (suponiendo que todos los cromosomas sexuales fueran X
H24_economy_50,none,[None],[None], llamados cromosomas,", el material genético se condensa, formando estructura visibles y discretos llamados cromosomas. Estas estructuras adquieren diversas formas y apariencias y su estudio ha"
H24_economy_51,none,[None],[None], llamado número,una misma especie tienen el mismo número de cromosomas. Es el llamado númerodiploide (2n). Cuando se examina la longitud de tales
H24_economy_52,none,[None],[None], llamados cromosomas,"en transfusiones sanguíneas. [2] Existe un cuarto tipo los llamados cromosomaspuntuales, de muy pequeño tamaño, en los que no se"
H24_economy_53,none,[None],[None], llamados genes,"DEL CAPÍTULO Las características se heredan bajo el control de factores discretos llamados genes, que se transmiten de generación en generación a través de los"
H24_economy_54,none,[None],[None], llama entrecruzamiento,"intercambio recíproco de fragmentos de cromosomas. Este fenómeno, que se llama entrecruzamiento, da lugar a una mezcla o recombinación de los alelos entre"
H24_economy_55,none,[None],[None], designaremos como la proporción,"ambos loci, aparece una proporción fenotípica única en F "" que designaremos como la proporciónde ligamiento. Para ilustrar esta proporción, consideremos un cruce entre"
H24_economy_56,none,[None],[None], llamado la fase,"el crecimiento es lento. Luego sigue un periodo de crecimiento rápido llamado la faselog. En esta fase la célula se divide muchas veces,"
H24_economy_57,none,[None],[None], llamado factor,"de que las células F + tenían un factor de fertilidad ( llamado factorF), que les confiere capacidad para donar parte de su"
H24_economy_58,none,[None],[None], llamado la técnica,"asegurar la recuperación de sólo las células receptoras. Este proceso, llamado la técnicade conjugación interrumpida, demostró que genes concretos de una cepa dada"
H24_economy_59,none,[None],[None], designaron como los cromosomas,en su aspecto entre varones y mujeres. Estos dos cromosomas se designaron como los cromosomassexuales X e Y. La mujer tiene dos cromosomas X y
H24_economy_60,none,[None],[None], llamado el factor,"un gen, que es responsable de la codificación de un producto llamado el factorde la determinación testicular (TDF), un producto génico que"
H24_economy_61,none,[None],[None], llamado SRY,que en una pequeña parte del cromosoma Y se encuentra el gen llamado SRY(región del Y que determina el sexo) que codifica a
H24_economy_62,none,[None],[None], llama la proporción,y hembras en los descendientes permite el cálculo de lo que se llama la proporciónde sexos. Se puede estimar de dos maneras. La proporción
H24_economy_63,none,[None],[None], llamó nucleína,"celular, aisló una substancia ácida de los núcleos a la que llamó nucleína. Miescher demostró que la nucleína contenía grandes cantidades de fósforo pero"
H24_economy_64,none,[None],[None], llamados nucleótidos,", incluyendo el DNA, estaban formados por cuatro bloques moleculares similares llamados nucleótidos. Hacia 1910, Phoebus A. Levene propuso la hipótesis del"
H24_economy_65,none,[None],[None], llamado desoxicolato,"por calor. Tras homogeneizar y extraer varias veces con un detergente llamado desoxicolato(DOC), obtuvieron un filtrado soluble que, una vez"
H24_economy_66,none,[None],[None], denominan de cambio,la secuencia de aminoácidos de la proteína codificada. Estas mutaciones se denominan de cambiode fase (o de cambio de pauta de lectura).
H24_economy_67,none,[None],[None], designan como A1B1,"genotipo haploide»). Los dos haplotipos de este individuo se designan como A1B1/ A2B2. Como se muestra en la figura 7-3 A,"
H24_economy_68,none,[None],[None], llamado ADN,"básicos del clonado de genes. En ese proceso, el así llamado ADNextraño, el ADN que hemos tomado de un organismo 'es"
H24_economy_69,none,[None],[None], llamados códigos,"de eucariotas con frecuencia están dispuestos en trozos, separados por los llamados códigos«sin sentido». Walter Gilbert, de la Universidad de"
H24_economy_70,none,[None],[None], llamaron G8,"él, tuvieron éxito. Encontraron una sonda de hibridación, que llamaron G8, entre la primera docena de las que probaron. Esta sonda"
H24_economy_71,none,[None],[None], representada por la membrana,"de colágeno de tipo IV, constituye el esqueleto de la barrera representada por la membranabasal. Otros tipos de colágeno son característicos de otros tejidos."
H24_economy_72,none,[None],[None], llamó dedo,formando un minidominio de unión a ADN. Más tarde se le llamó dedode cinc por su función: la de aferrarse a la doble
H24_economy_73,none,[None],[None], llaman dedos,""" de la "" escalera "" que es el ADN. Se llaman dedosde cinc porque asen al ADN y porque el cinc (bolas"
H24_economy_74,none,[None],[None], llamar protooncogenes,"dilucidado las funciones de muchos oncogenes celulares (que en rigor deberíamos llamar protooncogenes, Tabla 17. 2). Todos ellos controlan exactamente el"
H24_economy_75,none,[None],[None], designado como TDF,"a menos que un gen del brazo corto del cromosoma Y, designado como TDF(factor determinante del testículo), actúe como un interruptor y"
H24_economy_76,none,[None],[None], denominado de Müller,"mesonéfrico (anteriormente llamado de Wolff) y el paramesonéfrico (antes denominado de Müller). En el varón, las células de Leydig de los"
H24_economy_77,none,[None],[None], llamados nucleótidos,"molécula de ADN como una serie regularmente repetida de bloques de construcción llamados nucleótidos, cada uno compuesto por azúcar, fosfato y una base nitrogenada"
H24_economy_78,none,[None],[None], llamados alelos,"exposición de la genética básica, estos pares de genes, también llamados alelos, no siempre son genes idénticos. Ambos genes pueden ser dominantes"
H24_economy_79,none,[None],[None], llamados alelos,genes cartografiados. Figura 1 Los genes-representados aquí por letras-vienen en pares llamados alelosEstos alelos están en la misma posición (locus) sobre un
H24_economy_80,none,[None],[None], llamado factor,"poder detener las hemorragias debido a la imposibilidad de sintetizar un polipéptido llamado factorVIII de la coagulación de la sangre humana, el cual se"
H24_economy_81,none,[None],[None], llamado vector,"clonar. 2 Inserción del gen en otro fragmento de DNA, llamado vector, que hará posible que el DNA se incorpore a la bacteria"
H24_economy_82,none,[None],[None], llamado el Proyecto,"se examinará a nivel molecular como parte de lo que se ha llamado el ProyectoGenoma Humano, un esfuerzo internacional para mapear y secuenciar todo el"
H24_economy_83,none,[None],[None], llamados cromómeros,asas pueden constituir el inicio de los engrosamientos semejantes a nudos ( llamados cromómeros) que se observan al microscopio en cromosomas de la profase temprana
H24_economy_84,none,[None],[None], llamados orígenes,"celular. Los puntos de inicio de la síntesis de DNA, llamados orígenes, pueden ser secuencias específicas de DNA que se ubican en intervalos"
H24_economy_85,none,[None],[None], llamados segmentos,"grupos de cromosomas no homólogos pero relacionados, que representan los también llamados segmentoscromosómicos parálogos (ver Recuadro 9. 1). Probablemente la"
H24_economy_86,none,[None],[None], designan con un número,""" beta "", unas ocho. Las cadenas, que se designan con un númeroo una letra, se combinan para crear al menos 20 integrinas"
H24_economy_87,none,[None],[None], llama el proceso,inflamaciones pueden ser también muy destructivas durante la reperfusión; así se llama el procesode restauración de flujo sanguíneo a los tejidos que han quedado desprovistos
H24_economy_88,none,[None],[None], llamados aminoácidos,"proteínas, por el contrario, están formadas por 20 bloques constructivos llamados aminoácidos. Los genes especifican qué aminoácidos han de agruparse para constituir una"
H24_economy_89,none,[None],[None], llamados clados,"VIH reside en la variedad de los subtipos de VIH. También llamados clados, afectan a distintas zonas del mundo. Hay cinco clados o"
H24_economy_90,none,[None],[None], llama la proteína,"enlazada a un hidrato de carbono. La galectina-3, así se llama la proteína, fomenta además las metástasis con su participación en la angiogénesis ("
H24_economy_91,none,[None],[None], llama HOXA1,la enfermedad. Apuntando al HOXA1 El gen correspondiente en humanos se llama HOXA1y reside en el cromosoma 7. Bastante pequeño en su tamaño
H24_economy_92,none,[None],[None], referir un ejemplo,"órgano vital. Muchas morirán al faltar donaciones de trasplantes. Por referir un ejemplo, sólo en los Estados Unidos, durante el año 1997,"
H24_economy_93,none,[None],[None], llamados neoórganos,"vitales nuevas: la creación de tejidos u órganos artificiales, los llamados neoórganos. Un ingeniero de tejidos inyecta o deposita en una herida o"
H24_economy_94,none,[None],[None], representado por una banda,"de (CA). En la autorradiografía, cada alelo queda representado por una bandasuperior más intensa y dos bandas "" sombra "" inferiores menos intensas"
H24_economy_95,none,[None],[None], llamada un bloque,"son oligonucleótidos degenerados derivados de una sola región conservada (algunas veces llamada un bloque, o una ACR, de ancient conserved region, o región"
H24_economy_96,none,[None],[None], llama Heteroplasmia,una célula pueden coexistir mitocondrias normales y mutantes. Esta condición se llama Heteroplasmiay permite que persista una mutación que de otra manera sería letal
