id,presence,candidate_term_left,candidate_term_right,occurrence,full_context
H31_economy_1,none,[None],[None], nombre de transporte,"decir, el citoplasma del axón). Este sistema recibe el nombre de transporteaxoplasmático, proceso activo por el cual los materiales son propulsados a"
H31_economy_2,right,[None],['vasopresina'], nombre de vasopresina,"antidiurética reduce la producción de orina). No obstante, el nombre de vasopresinaes el que los fisiólogos utilizan con más frecuencia. La vasopresina"
H31_economy_3,none,[None],[None], nombre de 95,"moléculas de señalización. Redes y andamios La proteína que responde al nombre de 95, bien estudiada, opera fundamentalmente en las neuronas implicadas en el"
H31_economy_4,none,[None],[None], nombre de Doogie,generar estos ratones listos - una cepa a la que dimos el nombre de Doogie- confirmábamos una vieja teoría de más de 50 años sobre los
H31_economy_5,right,[None],['depresión'], nombre de depresión,"en ese lugar. La reducción, también duradera, recibe el nombre de depresióna largo plazo (DLP); no hemos de confundirla con"
H31_economy_6,right,[None],['oncogenes'], nombre de oncogenes,tumor. Las formas mutantes de los protooncogenes se conocen con el nombre de oncogenes. Consideraremos algunos ejemplos de cómo las mutaciones en genes supresores de
H31_economy_7,none,[None],[None], nombre de Eva,"vivir entonces hasta 10. 000 personas. Por tanto, el nombre de Evapuede despistar -no es la fuente última de todos los linajes ordinarios"
H31_economy_8,right,[None],['pila'], nombre de pila,"imaginar que la primera mitad de la secuencia de ADN es el nombre de pilade la ciudad, y la segunda, el apellido. Así"
H31_economy_9,none,[None],[None], nombre de Barcelona,"pues, el apellido de Valencia es GCAG, mientras que el nombre de Barcelonaes TCGG. A continuación, le asigné a cada vuelo directo"
H31_economy_10,none,[None],[None], nombre de la ciudad,"obtenido por concatenación del apellido de la ciudad de origen con el nombre de la ciudadde destino. En el ejemplo del recuadro ilustrado, el número"
H31_economy_11,none,[None],[None], nombre de la ciudad,partida (GCAG para Valencia) y el complemento Watson-Crick del primer nombre de la ciudadfinal (GGCT para Zaragoza). Los dos cebadores actuaban concertadamente
H31_economy_12,none,[None],[None], nombre de la ciudad,que favorecían el emparejamiento Watson-Crick. Sólo las moléculas que incluyeran el nombre de la ciudaddeseada (Barcelona) se trabarían con las sondas. Coloqué después
H31_economy_13,none,[None],[None], nombre de la ciudad,", mientras vertía fuera la fase líquida cuyas moléculas no contenían el nombre de la ciudaddeseada. Añadí después nuevo disolvente y retiré el imán, para"
H31_economy_14,none,[None],[None], nombre de Zaragoza,"«cebador» - la ristra GGCT, representativa del complemento del nombre de Zaragoza- se engarza en el extremo derecho de una hebra de ADN"
H31_economy_15,none,[None],[None], nombre de Barcelona,"afinidad Watson-Crick, las sondas capturan hebras de ADN que contienen el nombre de Barcelona(TCGGACTC). Acto seguido, se procede a eliminar las"
H31_economy_16,none,[None],[None], nombre de Barcelona,se procede a eliminar las hebras de ADN que no contengan el nombre de Barcelona. El proceso se repite con moléculas sonda que codifiquen el complementario
H31_economy_17,none,[None],[None], nombre de la ciudad,"después por concatenación del apellido de la ciudad de origen con el nombre de la ciudadde destino (a la derecha, abajo). Los nombres"
H31_economy_18,right,[None],['cariotipo'], designaciones del cariotipo,". [1] Por razones de brevedad, el resto de designaciones del cariotipopara las anomalías que no afectan los cromosomas sexuales indicarán hombre afectado"
H31_economy_19,none,[None],[None], nombre de Gregor,"de Santo Tomas de Brno, en 1843. Allí tomó el nombre de Gregory recibió apoyo en sus estudios e investigaciones durante el resto de"
H31_economy_20,right,[None],['heterocromatina'], nombre de heterocromatina,"áreas de los cromosomas que son genéticamente inertes, que reciben el nombre de heterocromatina. Un ejemplo de tal efecto de posición se da en hembras"
H31_economy_21,none,[None],[None], nombre de condición,esencial es necesario y entonces se detiene; esta temperatura recibe el nombre de condiciónrestrictiva. Si se cultiva en una condición permisiva a 25°
H31_economy_22,right,[None],['información'], nombre de información,y en las características de los descendientes; esta información recibe el nombre de informacióngenética. También podríamos concluir que esta misma información debe de dirigir
H31_economy_23,right,[None],['meiosis'], nombre de meiosis,de la cantidad original de material genético. Este proceso recibe el nombre de meiosis. Aunque los productos de la mitosis y de la meiosis son
H31_economy_24,none,[None],[None], nombre de Streptoroccus,"el principio transformante [0] Actualmente, este organismo recibe el nombre de Streptoroccuspneumoniae. Replicación y recombinación del DNA CONCEPTOS DEL CAPÍTULO La continuidad"
H31_economy_25,none,[None],[None], nombre de oriC,". coli se ha cartografiado esta región específica, que recibe el nombre de oriC. Esta consiste en 245 pares de bases, pero sólo un"
H31_economy_26,none,[None],[None], nombre de DNA,"células (in vitro). Actualmente, esta enzima recibe el nombre de DNApolimerasa I, ya que fue la primera en aislarse. Kornberg"
H31_economy_27,right,[None],['angiogénesis'], nombre de angiogénesis,provocan la formación de nuevos vasos sanguíneos (proceso que recibe el nombre de angiogénesis) para nutrir la masa de rápido crecimiento expansivo. Los vasos
H31_economy_28,none,[None],[None], nombre de borde,que dan lugar a una zona difusa que se conoce con el nombre de bordede invasión y es precisamente ahí donde las células abandonan de manera
H31_economy_29,right,[None],['colágeno'], nombre de colágeno,". Una de sus variedades, la que se conoce con el nombre de colágenode tipo IV, constituye el esqueleto de la barrera representada por"
H31_economy_30,none,[None],[None], nombre de nm23,siempre en las células tumorales no metastáticas. Esa proteína recibió el nombre de nm23(no metastática 23). Los estudios clínicos realizados por nuestro
H31_economy_31,right,[None],['cáncer'], nombre de cáncer,neoplasia o tumor) que invade tejidos vecinos (de ahí el nombre de cáncerque significa cangrejo) y puede producir también metástasis en layares más
H31_economy_32,right,[None],['locus'], nombre del locus,"ver página 66) y se numeran en serie, empleando el nombre del locusseguido de un asterisco y un número de serie, por ejemplo"
H31_economy_33,none,[None],[None], nombres de cadherinas,"tipo de adhesión célula-célula pertenecen a grupos que se conocen con los nombres de cadherinas, selectinas o inmunoglobulinas. Hallamos, asimismo, que las integrinas"
H31_economy_34,right,[None],['proteosomas'], nombre de proteosomas,"multienzimáticos. A esas macroestructuras el grupo de Goldberg les dio el nombre de proteosomas. Se les llamó así porque contienen muchas proteasas, enzimas que"
H31_economy_35,none,[None],[None], nombre de Aranesp,"habituales en la eritropoyetina. La nueva versión, comercializada con el nombre de Aranesp, permanece en la sangre mucho más tiempo que el fármaco primitivo"
H31_economy_36,none,[None],[None], nombres de Tamiflu,"el azúcar y queden liberados. Dos fármacos, comercializados con los nombres de Tamifluy Relenza, acortan la duración de la gripe al unirse fuertemente"
H31_economy_37,right,[None],['amplímeros'], nombre de amplímeros,inglés primers) en la reacción. Estos oligos reciben también el nombre de amplímeros. Cuando se mezclan con DNA genómico desnaturalizado los amplímeros se unen
H31_economy_38,none,[None],[None], nombre de PCR,". Esta versión de la reacción estándar sobre DNA genómico recibe el nombre de PCR(acrónimo del inglés Reverse Transcriptase PCR, o transcriptasa inversa PCR"
H31_economy_39,none,[None],[None], nombre del hecho,", frecuentemente asociada a la 13708 o la 14484. Recibe su nombre del hechode que en diversos estudios se ve asociada a alguna de las"
