id,presence,candidate_term_left,candidate_term_right,occurrence,full_context
H34_economy_189,left,"['arriba', 'abajo']",[None], la de arriba abajo Julia,"; el pasado verano, los que aparecen en la fotografía de la de arriba abajo JuliaTuttle, Brian Johnson y Gloria Lenhoff (hija de Howard M"
H34_economy_190,both,"['personajes', 'personajes fantásticos']",['elfos'], una pléyade de personajes fantásticos elfos,"Lenhoff) se desprende que los enfermos inspiraron historias en que intervenían una pléyade de personajes fantásticos elfos, gnomos, duendes y otros. Pero, por lo que"
H34_economy_191,both,"['comportamiento', 'signo', 'frecuente']",['concentraciones'], un comportamiento causado por otro signo frecuente concentraciones,"estreñimiento y hernias. Duermen mal y pueden ser muy irritables, un comportamiento causado por otro signo frecuente concentracioneselevadas de calcio en la sangre. A medida que crecen,"
H34_economy_192,both,"['descubrimiento', 'descubrimiento reciente']",['gen'], un descubrimiento reciente el gen,sólo han podido identificarse algunos. Una prueba diagnóstica se basa en un descubrimiento reciente el gende la elastina se encuentra entre los que se han perdido.
H34_economy_193,both,"['individuos', 'pequeñitos', 'individuos pequeñitos']",['gnomos'], individuos pequeñitos con poderes mágicos gnomos,"de gnomos? En las narraciones populares de muchas culturas aparecen « individuos pequeñitos con poderes mágicos gnomos, elfos, duendes, geniecillos y hadas. Un buen número"
H34_economy_194,both,"['células', 'mostraban', 'estructura', 'compleja']",['eucariotas'], células mostraban una estructura más compleja los eucariotas,"Más tarde, a partir de las arqueas surgieron unos organismos cuyas células mostraban una estructura más compleja los eucariotas. En el transcurso de su proceso evolutivo, los eucariotas adquirieron"
H34_economy_195,left,"['distancias', 'evolutivas']",[None], parámetro de distancias evolutivas el ARN,"de la Universidad de Illinois, fijó la atención en un nuevo parámetro de distancias evolutivas el ARNribosómico microsubunitario («small subunit ribosomal RNA», SSU rRNA"
H34_economy_196,both,"['biología', 'celular', 'evolutiva', 'biología celular']",['hipótesis'], la biología celular evolutiva la hipótesis,"molécula otorgaron también credibilidad a uno de los temas más interesantes de la biología celular evolutiva la hipótesisdel endosimbionte, avanzada para explicar el mecanismo en cuya virtud las"
H34_economy_197,left,['eucariotas'],[None], los eucariotas el ADN,núcleo diferenciado bajo ciertas condiciones experimentales sus cromosomas recuerdan a los de los eucariotas el ADNforma complejos con unas proteínas muy parecidas a las histonas de éstos
H34_economy_198,both,"['genes', 'bacterianos', 'metabolismo', 'genes bacterianos']",['eucariotas'], genes bacterianos decisivos para el metabolismo los eucariotas,"de transferencia lateral, los eucariotas evolucionados de una célula arquea obtuvieron genes bacterianos decisivos para el metabolismo los eucariotasrecabaron de las bacterias genes y retuvieron los que demostraron su utilidad"
H34_economy_199,none,[None],[None], interés la dirección,la mosca en cuestión de minutos. Y lo que revestía mayor interés la direcciónen que «viajaban» las moscas afectaba a los niveles de
H34_economy_200,both,"['estructura', 'árboles', 'genealógicos', 'árboles genealógicos']",['genes'], la estructura de los árboles genealógicos los genes,"poblaciones. Pero la primera goza de ventaja decisiva al poder determinar la estructura de los árboles genealógicos los genesvivos deben tener antecesores, mientras que los muertos fósiles pueden no"
H34_economy_201,right,[None],['distribución'], la patria humana más remota la distribución,". Teniendo en cuenta las consideraciones geográficas, concluyó que Africa era la patria humana más remota la distribuciónglobal de los tipos de ADN mitocondrial que vio podían explicarse,"
H34_economy_202,both,['genética'],['variabilidad'], homogeneidad genética entre humanos la variabilidad,las humanas. Los datos de los chimpancés ilustraron también la notable homogeneidad genética entre humanos la variabilidadgenética de los chimpancés decuplica la observada en humanos. Dato que
H34_economy_203,both,"['individuos', 'menos']",['linajes'], individuos de menos partes de Africa los linajes,", estudiaron de modo análogo muestras que incluían muchos más asiáticos e individuos de menos partes de Africa los linajesmitocondriales reconducían, de nuevo, a Africa. La probabilidad,"
H34_economy_204,both,"['modelo', 'evolución', 'modelo de evolución multirregional']",['cambios'], modelo de evolución multirregional cambios,anatómicos que los hizo más parecidos a los humanos modernos condujeron al modelo de evolución multirregional cambiosevolutivos semejantes en diversas regiones geográficas convirtieron a los habitantes arcaicos microencefálicos
H34_economy_205,left,['siguiente'],[None], esencia de lo siguiente Emparejamiento,"que recurrir a los instrumentos disponibles. Este instrumental consta, en esencia de lo siguiente EmparejamientoWatson-Crick Cada hebra de ADN tiene su complemento Watson-Crick. Ocurre que"
H34_economy_206,both,"['cebador', 'señal']",['iniciador'], Un cebador aporta la señal iniciador,le diga dónde ha de empezar a realizar la copia complementaria. Un cebador aporta la señal iniciadorque consiste en un fragmento (posiblemente corto) de ADN enroscado
H34_economy_207,both,['polo positivo'],['hebras'], el polo positivo o ánodo las hebras,"moléculas de ADN, dotadas de carga negativa, se mueven hacia el polo positivo o ánodo las hebrascortas cursan más rápidas que las largas. El proceso separa,"
H34_economy_208,right,[None],['computación'], los años treinta nos han enseñado la computación,Pero no se debe olvidar otro hecho importante que los lógicos de los años treinta nos han enseñado la computaciónes sencilla. Para construir una computadora bastan un método para almacenar
H34_economy_209,none,[None],[None], las ciudades en este orden Valencia,"ver que existe sólo un camino hamiltoniano, la ruta que recorre las ciudades en este orden Valencia, Barcelona, Madrid, Zaragoza. Si cambiamos el orden,"
H34_economy_210,both,"['polimerasa', 'replicación']",['temperaturas'], la ADN polimerasa empiece la replicación las temperaturas,contenida en el tubo de ensayo. Las temperaturas moderadas promueven que la ADN polimerasa empiece la replicación las temperaturasmás elevadas provocan que las hebras encestadas resultantes se escindan de su
H34_economy_211,both,"['paciente', 'diabetes', 'diabetes mellitus']",['cardiopatías'], el paciente de diabetes mellitus cardiopatías,"contribuye, probablemente, a ciertas complicaciones a largo plazo que sufre el paciente de diabetes mellitus cardiopatías, parálisis cerebral, ceguera, pérdida de la capacidad funcional del"
H34_economy_212,both,['directas'],['proteína'], estrategias más directas la proteína,de forma tan tortuosa el transportador? A uno se le ocurren estrategias más directas la proteínatransportadora podría mantener permanentemente abierto un poro o podría haber oscilado entre
H34_economy_213,both,['iones'],['células'], filtración de iones sería insignificante las células,"algún ion sodio hacia el interior de la célula; pero esta filtración de iones sería insignificante las célulasposeen canales transmembrana especiales por donde, cuando se abren, pasan"
H34_economy_214,left,['forma'],[None], forma DMNID,"la diabetes mellitus dependiente de insulina; sí importan a la segunda forma DMNID. La predisposición a adquirir la DMNID es genética habrá, pues"
H34_economy_215,left,"['resistencia', 'hormona']",[None], la resistencia a la hormona incapacidad,"la insulina. Una de las primeras manifestaciones de la DMNID es la resistencia a la hormona incapacidaddel músculo, tejido adiposo o hígado de responder eficientemente ante elevados"
H34_economy_216,both,"['inclinación', 'rasgo', 'sexualmente', 'dimórfico']",['varones'], inclinación un rasgo sexualmente dimórfico los varones,"ésta. Muchos investigadores, Simón LeVay en particular, consideran dicha inclinación un rasgo sexualmente dimórfico los varonesestán normalmente «programados» para sentir atracción por las mujeres,"
H34_economy_217,both,['cerebro'],['tamaño'], cerebro sólo una puede corroborarse el tamaño,"en razón del sexo, se atribuían en el siglo pasado al cerebro sólo una puede corroborarse el tamaño, que varía con el tamaño corporal. Así, los varones"
H34_economy_218,both,['reflejo'],['rata'], un reflejo la rata,"); la lordosis, sin embargo, es poco más que un reflejo la ratamacho adoptará la misma postura al rozarle el lomo. Consideran heterosexual"
H34_economy_219,both,"['varones', 'homosexuales', 'varones homosexuales']",['respuestas'], los varones homosexuales se sigue este corolario las respuestas,la hipótesis de feminización de las respuestas a la hormona luteinizante en los varones homosexuales se sigue este corolario las respuestasdeberían estar «masculinizadas» en las mujeres lesbianas. De ocurrir
H34_economy_220,both,['nacer'],['varones'], claridad al nacer varones,posible que el sexo de los individuos afectados no se manifieste con claridad al nacer varonescon genitales de aspecto femenino y mujeres con genitales de apariencia masculina
H34_economy_221,left,['resultados'],[None], embargo resultados contradictorios el grupo,"equipos que han medido también estos núcleos, han obtenido, sin embargo resultados contradictorios el grupode Dick Swaab, del Instituto holandés de investigación del cerebro en"
H34_economy_222,both,"['síntesis', 'proteínas', 'síntesis de proteínas']",['transcripción'], la síntesis de proteínas la transcripción,"y la manipulación de la maquinaria que regula un paso esencial en la síntesis de proteínas la transcripciónde los genes. Para sintetizar una proteína, el gen que"
H34_economy_223,both,"['base', 'nitrogenada', 'base nitrogenada']",['adenina'], la base nitrogenada que portan adenina,"hélice de ADN. Los nucleótidos se distinguen unos de otros por la base nitrogenada que portan adenina(A), timina (T), citosina (C"
H34_economy_224,both,['característica'],['factores'], una dificultad característica los factores,). Nos pusimos a purificar la molécula. Había que vencer una dificultad característica los factoresde transcripción se dan en pequeñísimas cantidades dentro de la célula;
H34_economy_225,left,['factores'],[None], factores esenciales xxx,"laboratorio de Roeder y otros habían identificado al menos seis de esos factores esenciales xxx. En el tubo de ensayo, esta colección de factores permitía"
H34_economy_226,none,[None],[None], la viabilidad de la idea Michael,"limpiar la sangre de LDL. Esperamos que muy pronto se compruebe la viabilidad de la idea MichaelS., Brown y Joseph L., Goldstein están estudiando"
H34_economy_227,both,['invasores'],['virus'], serie de invasores virus,"Inmunogenética Cada día nuestro organismo se enfrenta a una formidable serie de invasores virus, bacterias y muchos otros microorganismos patológicos cuyo objetivo es superar nuestras"
H34_economy_228,none,[None],[None], RESPUESTA INMUNOLÓGICA CONCEPTOS,"autoinmune y se estudian algunos de los principales trastornos por inmunodeficiencia. RESPUESTA INMUNOLÓGICA CONCEPTOSBÁSICOS Sistema inmunológico innato Cuando se detecta un microorganismo extraño, la"
H34_economy_229,both,['células'],['sistema'], Respuesta de las células B sistema,ayudando a su vez a la respuesta de las células B. Respuesta de las células B sistemainmunológico humoral Uno de los principales elementos de la respuesta inmunológica adaptativa
H34_economy_230,none,[None],[None], ACP antigen,"a las células dendríticas, se denominan células presentadoras de antígenos ( ACP antigenpresentig cell). Las células B también son capaces de presentar"
H34_economy_231,none,[None],[None], MHC major,de las APC por una molécula del complejo mayor de histocompatibilidad ( MHC majorhistocompatibility complex) de clase II (fig. 8-1).
H34_economy_232,none,[None],[None], PROTEÍNAS DE LA RESPUESTA INMUNOLÓGICA BASES,T citotóxicas secretan unas sustancias químicas que matan la célula infectada. PROTEÍNAS DE LA RESPUESTA INMUNOLÓGICA BASESGENÉTICAS DE LA ESTRUCTURA Y LA DIVERSIDAD Genes y estructura de las
H34_economy_233,both,['cadenas'],['par'], cadenas un par,", cada molécula de anticuerpo (o inmunoglobulina) consta de cuatro cadenas un paridéntico de cadenas pesadas, más largas, y un par idéntico"
H34_economy_234,both,"['tipos', 'regiones']",['variables'], tipos de regiones variables,"idénticas y dos cadenas pesadas idénticas. La cadena ligera incluye tres tipos de regiones variables, de unión y constantes; la cadena pesada, además de"
H34_economy_235,both,"['diferencias', 'predisposición', 'genética', 'predisposición genética']",['genes'], las diferencias en la predisposición genética genes,"p. ej., variación dietética), así como a las diferencias en la predisposición genética genesheredados que aumentan la probabilidad de que un individuo presente el cáncer"
H34_economy_236,both,"['características', 'regulación', 'celular', 'regulación celular']",['factores'], características de la regulación celular los factores,"finalmente una célula cuya descendencia formará un tumor. Figura 3 Principales características de la regulación celular los factoresde crecimiento externos (proteínas y hormonas esteroideas, como el factor"
H34_economy_237,both,['inversa'],['conocimiento'], La afirmación inversa también es cierta el conocimiento,también nuestro conocimiento acerca de la vía somática del cáncer común. La afirmación inversa también es cierta el conocimientode la naturaleza de los genes mutantes somáticamente puede ayudarnos a comprender
H34_economy_238,both,"['clase', 'genes', 'genes cancerígenos', 'clase de genes']",['oncogenes'], clase de genes cancerígenos oncogenes,médicas más eficaces de prevención y tratamiento de los tumores. Otra clase de genes cancerígenos oncogenesUna segunda clase específica de genes que pueden provocar cáncer es la
H34_economy_239,both,"['herencia', 'multifactorial', 'herencia multifactorial']",['riesgo'], criterios para definir la herencia multifactorial El riesgo,buenos datos epidemiológicos para efectuar la diferenciación. Se suelen utilizar varios criterios para definir la herencia multifactorial El riesgode recurrencia aumenta si existe más de un miembro de la familia
H34_economy_240,left,"['riesgo', 'familia']",[None], riesgo de la familia puesto,"hecho'significa que ahora disponemos de más información acerca del verdadero riesgo de la familia puestoque han resultado afectados dos niños, es probable que se localicen"
H34_economy_241,both,"['anencefalia', 'vivos']",['embarazos'], los casos de anencefalia nacen vivos los embarazos,craneal y de los hemisferios cerebrales. Al menos dos tercios de los casos de anencefalia nacen vivos los embarazosa término no sobreviven más de unas horas o días. El
H34_economy_242,left,"['conceptos', 'probabilidad']",[None], conceptos fundamentales de la probabilidad la norma,reproductor al siguiente. El principio de independencia nos permite deducir dos conceptos fundamentales de la probabilidad la normade multiplicación y la norma de adición. La norma de multiplicación
H34_economy_243,left,"['distribución', 'genotipos', 'distribución de genotipos']",[None], distribución de genotipos MM,"tipificación en todas las personas de nuestra muestra, encontramos la siguiente distribución de genotipos MM, 64; MN, 126, y NN, 16."
H34_economy_244,none,[None],[None], CF Custic,recuento directo. Comentario clínico 4-1 Fibrosis quística La fibrosis quística ( CF CusticFibrosis) es uno de los trastornos por un único gen más
H34_economy_245,left,"['producto', 'frecuencias', 'genes', 'frecuencias de genes']",[None], el producto de las frecuencias de genes xxx,A se una a un óvulo portador de A está determinada por el producto de las frecuencias de genes xxx(norma de multiplicación). Ésta es la probabilidad de engendrar
H34_economy_246,both,"['árbol', 'genealógico', 'básico', 'clínica', 'árbol genealógico', 'árbol genealógico básico']",['bases'], árbol genealógico básico Citogenética clínica bases,"y los sobrinos nietos, entre otros. Figura 4-4 Notación del árbol genealógico básico Citogenética clínica basescromosómicas de la enfermedad en el ser humano En los dos capítulos"
H34_economy_247,both,"['monosomías', 'ilustra']",['organismo'], las monosomías ilustra un principio importante el organismo,. El hecho de que las trisomías provocan consecuencias menos graves que las monosomías ilustra un principio importante el organismopuede tolerar un exceso de material genético con más facilidad que un
H34_economy_248,both,['componentes'],['sensibilidad'], componentes sensibilidad,la enfermedad y los que no la tienen. Ello implica dos componentes sensibilidady especificidad. Se define la sensibilidad como la capacidad para identificar
H34_economy_249,left,"['ejemplo', 'ilustra']",[None], ejemplo ilustra un importante principio el valor,24 / (24 + 100) = 19 %. Este ejemplo ilustra un importante principio el valorpredictivo positivo de una prueba se incrementa cuando aumenta la prevalencia de
H34_economy_250,right,[None],['hemoglobinopatías'], estados de Estados Unidos d Otros hemoglobinopatías,"Galactosemia, todos los estados de Estados Unidos c Hipotiroidismo, 45 estados de Estados Unidos d Otros hemoglobinopatías, fibrosis quística 2 Orina: aminoacidopatías 1 Enfermedad de Tay-Sachs,"
H34_economy_251,both,"['eucariotas', 'procesos']",['mitosis'], los eucariotas hay dos procesos muy importantes la mitosis,"y organismos, consideraremos cuan exactamente se realiza tal transmisión. En los eucariotas hay dos procesos muy importantes la mitosisy la meiosis. Aunque el mecanismo de ambos procesos es similar"
H34_economy_252,both,"['producción', 'células', 'producción de células']",['gametos'], la producción de células sexuales los gametos,parte de un tipo especial de división celular que da lugar a la producción de células sexuales los gametosy las esporas. Este proceso es un paso esencial en la
H34_economy_253,both,"['estructuras', 'citoplásmicas']",['mitocondrias'], estructuras citoplásmicas muy importantes las mitocondrias,"proteínas. Para la actividad de las células eucariotas hay otras tres estructuras citoplásmicas muy importantes las mitocondrias, los cloroplastos y los centriolos. Las mitocondrias se encuentran tanto"
H34_economy_254,left,"['fenotipo', 'individuo']",[None], el fenotipo de un individuo EE,"sea haploide o diploide. Leyendo el genotipo, es posible saber el fenotipo de un individuo EEy Ee son altos, y ee es enano. Cuando hay"
H34_economy_255,both,"['cruzamiento', 'prueba', 'cruzamiento prueba']",['carácter'], El cruzamiento prueba un carácter,1 de la generación F2 en la Figura 3. 3. El cruzamiento prueba un carácterSe predice que las plantas altas que se producen en F2 presentan
H34_economy_256,both,"['animales', 'vegetales']",['cruzamiento'], animales y vegetales el cruzamiento,"método bastante simple que todavía se utiliza en experiencias de cría de animales y vegetales el cruzamientoprueba. El organismo de fenotipo dominante, pero de genotipo desconocido"
H34_economy_257,both,"['genética', 'bacterias']",['conjugación'], Recombinación genética en bacterias conjugación,inicial de bacterias se estima en 15 x 10 por mililitro. Recombinación genética en bacterias conjugaciónEl desarrollo de técnicas que permitieron la identificación y el estudio de
H34_economy_258,left,['genético'],[None], Fondo genético supresión,"el fondo genético como los factores ambientales influyen en su expresión. Fondo genético supresióny efectos de posición Con sólo ciertas excepciones, es difícil estimar"
H34_economy_259,both,"['enfermedades', 'anticipación', 'genética', 'enfermedades humanas', 'anticipación genética']",['distrofia'], enfermedades humanas demuestran claramente anticipación genética la distrofia,"un aumento de la gravedad de la anomalía. Al menos tres enfermedades humanas demuestran claramente anticipación genética la distrofiamiotónica (DM), el retraso mental del X frágil y"
H34_economy_260,both,"['número', 'cromosomas', 'número de cromosomas']",['generalidades'], Variación en el número de cromosomas generalidades,otros temas relacionados con la función genética de los cromosomas sexuales. Variación en el número de cromosomas generalidadesAntes de embarcarnos en la discusión de las variaciones que implican al
H34_economy_261,both,"['material', 'genético', 'características', 'material genético']",['replicación'], El material genético presenta varias características replicación,"se discute la interpretación de su estructura. Características del material genético El material genético presenta varias características replicación, almacenaje de la información, expresión de esta información, y"
H34_economy_262,left,"['tipos', 'tipos de moléculas']",[None], tipos de moléculas de RNA RNA,"la transcripción del DNA, cuyo resultado es la síntesis de tres tipos de moléculas de RNA RNAmensajero (mRNA), RNA transferente (tRNA) y RNA"
H34_economy_263,both,"['bases', 'nitrogenadas', 'bases nitrogenadas']",['adenina'], bases nitrogenadas adenina,"uno de ellos contiene una molécula de cada una de las cuatro bases nitrogenadas adenina(A), citosina (C), guanina (G"
H34_economy_264,right,[None],['investigaciones'], Descodificación investigaciones,"es degenerado. Como veremos, este razonamiento demostró ser correcto. Descodificación investigacionesiniciales En 1961, Marshall Nirenberg y J. Heinrich Matthaei publicaron"
H34_economy_265,both,['herramientas'],['sistema'], la utilización de dos herramientas experimentales un sistema,para el análisis completo del código genético. Su éxito estribó en la utilización de dos herramientas experimentales un sistemade síntesis proteica in vitro (exento de células) y una
H34_economy_266,both,"['síntesis', 'proteica', 'célula', 'síntesis proteica']",['ribosomas'], la síntesis proteica en la célula ribosomas,"vitro, como podría esperarse, debe contener los factores necesarios para la síntesis proteica en la célula ribosomas, tRNA, aminoácidos y otras moléculas esenciales para la traducción."
H34_economy_267,both,['proteínas'],['producto'], Las proteínas el producto,"lectura, o marco de lectura indistintamente, siendo todas ellas sinónimas Las proteínas el productofinal de la expresión genética CONCEPTOS DEL CAPÍTULO Los productos finales de"
H34_economy_268,none,[None],[None], Garrod y Bateson errores,", puede producir los diversos efectos fenotípicos observados en los organismos. Garrod y Bateson errorescongénitos del metabolismo La primera idea de la función de las proteínas"
H34_economy_269,both,"['hipótesis', 'gen']",['enzima'], La hipótesis de un gen una enzima,"está incrementando e incluye a todos los tipos de biomoléculas orgánicas. La hipótesis de un gen una enzimaEn dos investigaciones diferentes iniciadas en 1933, George Beadle proporcionó la"
H34_economy_270,both,"['hipótesis', 'gen']",['enzima'], la hipótesis de un gen una enzima,del moho rosa del pan Neurospora crassa. Esta investigación condujo a la hipótesis de un gen una enzima. Beadle y Ephrussi: los pigmentos oculares de Drosophila Los estudios
H34_economy_271,right,[None],['pigmentos'], Beadle y Ephrussi los pigmentos,investigación condujo a la hipótesis de un gen: una enzima. Beadle y Ephrussi los pigmentosoculares de Drosophila Los estudios de Beadle y Ephrussi se refirieron a
H34_economy_272,right,[None],['mutantes'], Beadle y Tatum mutantes,"» bioquímicos, probablemente debido a la falta de función enzimática. Beadle y Tatum mutantesde Neurospora A principios de la década de los 40, Beadle"
H34_economy_273,both,['enzimas'],['análisis'], Genes y enzimas análisis,este concepto se convirtió en un importante principio de la genética. Genes y enzimas análisisde rutas metabólicas El concepto de un gen: una enzima y
H34_economy_274,both,['gen'],['enzima'], El concepto de un gen una enzima,de la genética. Genes y enzimas: análisis de rutas metabólicas El concepto de un gen una enzimay los métodos que lo acompañan se han utilizado para resolver muchos
H34_economy_275,both,['gen'],['enzima'], el concepto de un gen una enzima,se muestra la ruta metabólica. No todos los genéticos aceptaron inmediatamente el concepto de un gen una enzimadesarrollado a principios de la década de los 40. Esto no
H34_economy_276,both,"['funciones', 'información', 'genética', 'información genética']",['replicación'], funciones adscritas a la información genética la replicación,"como material genético (Capitulo 10) definimos las cuatro características o funciones adscritas a la información genética la replicación, el almacenaje, la expresión y la variación por mutación."
H34_economy_277,right,[None],['reparación'], la atención hacia dos temas relacionados la reparación,". Una vez hayamos completado la exposición de la mutación, dirigiremos la atención hacia dos temas relacionados la reparacióndel DNA y los elementos genéticos transponibles. Estos temas son extensiones"
H34_economy_278,none,[None],[None], Congress of Genetics en Cromosomas,"su visión del futuro durante su alocución presidencial en el IX International Congress of Genetics en Cromosomasvíricos y bacterianos Comparados con los cromosomas eucarióticos, los cromosomas de"
