id,presence,candidate_term_left,candidate_term_right,occurrence,full_context
H34_economy_94,both,"['centros', 'siguientes', 'centros cerebrales']",['lóbulo'], centros cerebrales siguientes el lóbulo,discriminación sexual se alteraba cuando poseía características femeninas alguno de los dos centros cerebrales siguientes el lóbulode la antena o el cuerpo pedunculado (mush-room body).
H34_economy_95,both,['melanogaster'],['ciclos'], melanogaster ciclos,"ya que ese gen respondía de los ritmos circadianos de D. melanogaster ciclosrepetitivos, como el de sueño y vigilia, que son característicos"
H34_economy_96,both,"['alfabeto', 'letras']",['adenilato'], un alfabeto de cuatro letras adenilato,"se llama genoma. Está escrito en forma de nucleótidos, con un alfabeto de cuatro letras adenilato(A), citidilato (C), guanilato (G"
H34_economy_97,both,['entero'],['copia'], entero una copia,"encierra la información. En cada división celular se replica el manual entero una copiapor cada célula resultante. En humanos y ratones, el genoma"
H34_economy_98,both,"['ratones', 'modelos', 'enfermedades', 'enfermedades humanas', 'modelos de enfermedades']",['fibrosis'], ratones modelos de enfermedades humanas fibrosis,"de esto último, se está aplicando la técnica para provocar en ratones modelos de enfermedades humanas fibrosisquística, cáncer y aterosclerosis, por citar algunas. El entusiasmo"
H34_economy_99,both,['células'],['actividad'], las células actividad,"su vez, importantes pistas sobre el papel que ésta desempeña en las células actividadenzimática, componente estructural o molécula transmisora de señales. Pero la"
H34_economy_100,left,"['genética', 'mamíferos']",[None], manera de hacer genética de mamíferos la posibilidad,genes y sus proteínas. La sustitución génica nos ofrece una nueva manera de hacer genética de mamíferos la posibilidadde ver cómo intervienen los genes en los procesos biológicos. Los
H34_economy_101,both,"['mutación', 'homocigotos']",['animales'], mutación produce homocigotos animales,cruzamiento de estos heterocigotos con hermanos o hermanas portadores de la misma mutación produce homocigotos animalescon la mutación dirigida en las dos copias del gen. Estos
H34_economy_102,both,['quimeras'],['ratones'], quimeras ratones,"los tejidos del ratón. Por consiguiente, los recién nacidos son quimeras ratonescompuestos por células derivadas de las ME extrañas y de las células"
H34_economy_103,both,['investigación'],['descubrimientos'], el valor de la investigación básica los descubrimientos,que acabará proporcionando pistas para su tratamiento. Este imprevisto beneficio resalta el valor de la investigación básica los descubrimientosnacidos de la curiosidad suelen llevar a aplicaciones muy prácticas. Los
H34_economy_104,both,"['células', 'organismo']",['linfocitos'], células defensoras del organismo linfocitos,en el desarrollo y el funcionamiento de las dos clases principales de células defensoras del organismo linfocitosB y linfocitos T. Los oncólogas acuden también a ella.
H34_economy_105,both,['marcador'],['gen'], marcador el gen,"cromosoma. En un extremo del vector se ha introducido un segundo marcador el gentk., de herpes (rojo). 2. Vector"
H34_economy_106,both,"['configuración', 'siguiente']",['oligonucleótidos'], la configuración siguiente los oligonucleótidos,", aplicado a una estrategia bloqueadora de la transcripción, proviene de la configuración siguiente los oligonucleótidosque se emplean para detener la transcripción se «abrazan» a"
H34_economy_107,both,"['bases', 'nitrogenadas', 'bases nitrogenadas']",['adenina'], bases nitrogenadas adenina,", un grupo fosfato (PO4) y una de las cuatro bases nitrogenadas adenina(A), guanina (G), citosina (C"
H34_economy_108,left,['unidades'],[None], unidades sin carga los metilfosfonatos,metilo (CH3). Convertían así los fosfatos cargados negativamente en unidades sin carga los metilfosfonatos. De esa manera los oligonucleótidos entraban mejor en las células y
H34_economy_109,both,['cadenas'],['extremo'], las cadenas son antiparalelas el extremo,"y el otro 3 '. En una doble hélice clásica, las cadenas son antiparalelas el extremo5'de una de las cadenas queda junto al extremo 3"
H34_economy_110,both,['dosis'],['oligonucleótidos'], La dosis justa es una de ellas los oligonucleótidos,", hay que añadir aquí las inherentes a los propios fármacos. La dosis justa es una de ellas los oligonucleótidosconstruidos para inhibir la transcripción dentro de las células sólo resultan eficaces"
H34_economy_111,left,"['especies', 'reputaron']",[None], las especies se reputaron irrelevantes el concepto,". Este proceso se consideró tan universal, que las diferencias entre las especies se reputaron irrelevantes el conceptode aprendizaje se aplicó a todos los animales, hombre incluido."
H34_economy_112,both,"['selección', 'natural', 'selección natural']",['aves'], la selección natural las aves,. La remoción de los restos constituye una respuesta automática primada por la selección natural las avesque practican este comportamiento cuentan con una progenie superviviente más numerosa.
H34_economy_113,left,"['resultados', 'efecto']",[None], los resultados respaldaban el efecto Westermarck la convivencia,", respectivamente, de la felicidad matrimonial y de la actividad sexual los resultados respaldaban el efecto Westermarck la convivenciadesde los primeros años de vida comprometía manifiestamente la compatibilidad matrimonial en"
H34_economy_114,left,['genes'],[None], vehículo liberador de genes potencia,"rodea a los genes antigénicos consiste en algo más que un mero vehículo liberador de genes potenciala respuesta inmunitaria evocada por los antígenos. Este efecto procede,"
H34_economy_115,both,['bases'],['adenina'], las bases que contienen adenina,"de ADN está constituida por unidades denominadas nucleótidos que se distinguen por las bases que contienen adenina(A), citosina (C), guanina (G"
H34_economy_116,both,"['ramas', 'sistema', 'inmunitario', 'sistema inmunitario', 'ramas del sistema']",['rama'], ramas del sistema inmunitario la rama,"protectora contra un agente infeccioso, o patógeno, fundamentalmente activando dos ramas del sistema inmunitario la ramahumoral, que los ataca fuera de las células, y la"
H34_economy_117,right,[None],['genes'], la disposición primitiva los genes,los humanos conservan en un rincón de su sistema inmunitario algo de la disposición primitiva los genesque controlan la síntesis de la cadena ligera lambda de las inmunoglobulinas
H34_economy_118,none,[None],[None], préstamo un instrumento de los economistas la creación,"respalden las investigaciones sobre la evolución, los inmunólogos han tomado en préstamo un instrumento de los economistas la creaciónde modelos por ordenador. Franco Celada, del Hospital metropolitano de"
H34_economy_119,both,['fenómeno'],['proceso'], el fenómeno contrario un proceso,en favor de respuestas inmunitarias frente a los parásitos. Acontece también el fenómeno contrario un procesovigoroso crea con toda probabilidad una rica variedad de genes cuyos productos
H34_economy_120,both,"['ejemplo', 'artritis', 'reumatoide', 'artritis reumatoide']",['estudios'], ejemplo la artritis reumatoide los estudios,"factores genéticos destructivos, mejor situados estaremos para desbaratarlos. Tomemos como ejemplo la artritis reumatoide los estudiosrealizados entre hermanos gemelos sugieren que los factores genéticos aportan hasta un"
H34_economy_121,left,"['receptor', 'artificial', 'receptor artificial']",[None], El receptor artificial FNTRs Fc,autoinmune. Los primeros resultados han sido satisfactorios (derecha). El receptor artificial FNTRs Fcinhibe la respuesta en células cultivadas a concentraciones muy inferiores a aquellas
H34_economy_122,both,"['genes', 'información']",['instrucciones'], Los genes son también información instrucciones,", resulta más apropiado entenderlos como una vía de información. ( Los genes son también información instruccionesescritas en el ADN para sintetizar proteínas.) Así, el"
H34_economy_123,both,"['función', 'procesos']",['replicación'], función de tres procesos generales la replicación,"egoísta, donde describía el principio básico de la teoría darwinista en función de tres procesos generales la replicaciónde una información, las variaciones surgidas y la selección de unas"
H34_economy_124,both,"['proceso', 'evolución', 'darwinista']",['replicación'], proceso de evolución darwinista replicación,"replicadores, dotados de las tres propiedades necesarias para engendrar un nuevo proceso de evolución darwinista replicación, variación y selección. Dawkins cuenta que abrigaba intenciones más modestas"
H34_economy_125,none,[None],[None], Respuestas condicionadas temor,"- Conductas innatas aunque contagiosas: bostezar, toser, reír - Respuestas condicionadas temorante el sonido del torno del dentista - Mapas cognitivos: conocimiento"
H34_economy_126,both,['cognitivos'],['conocimiento'], Mapas cognitivos conocimiento,Respuestas condicionadas: temor ante el sonido del torno del dentista - Mapas cognitivos conocimientodel trazado del propio barrio - Asociaciones con sonidos y olores Figura
H34_economy_127,left,['siguiente'],[None], la acción siguiente un mirlo,"de la Universidad de Bochum, montaron un escenario donde se desarrollaba la acción siguiente un mirlopodía ver a otro que batía alas y agitaba la cola ante"
H34_economy_128,both,"['guía', 'memética', 'guía memética']",['memes'], guía memética los memes,"través del cual los memes controlan la selección genética lo llamo "" guía memética los memescompiten entre sí y evolucionan con rapidez en una dirección, en"
H34_economy_129,both,"['selección', 'natural', 'selección natural']",['genes'], la intervención de la selección natural los genes,dirigen el funcionamiento de los seres vivos. Esta fiel transmisión posibilita la intervención de la selección natural los genesque ofrecen a sus portadores una mejor supervivencia o que éstos puedan
H34_economy_130,left,"['esquema', 'clásico']",[None], un restaurante responden a un esquema clásico lugares,"universo, denominadas a menudo esquemas. Las reglas que operan en un restaurante responden a un esquema clásico lugaresdonde se prepara la comida, se sirve en la mesa y"
H34_economy_131,right,[None],['naturaleza'], parte por una explicación más equilibrada naturaleza,Pero hace ya algún tiempo que los psicólogos optan en su mayor parte por una explicación más equilibrada naturalezay crianza se imbrican en el desarrollo cognitivo. A lo largo
H34_economy_132,left,['experimentos'],[None], experimentos la gemelaridad,"o al entorno. Para resolverlo, se recurre a dos "" experimentos la gemelaridad(un experimento de la naturaleza) y la adopción (un"
H34_economy_133,left,['conocimiento'],[None], reas de conocimiento lengua,"guardaban un parecido mayor que los de gemelos no idénticos en cuatro reas de conocimiento lengua, matemáticas, ciencias sociales y ciencias naturales. A tenor de"
H34_economy_134,right,[None],['efectos'], interés los efectos,mayor grado que de la capacidad. Y lo que reviste mayor interés los efectosgenéticos se solapan entre diferentes categorías de rendimiento y estos genes solapados
H34_economy_135,both,"['identificación', 'diferencial', 'marcadores']",['segmentos'], la identificación diferencial de marcadores del ADN segmentos,"otras técnicas de genética molecular, el ligamiento QTL se basa en la identificación diferencial de marcadores del ADN segmentosde ADN de los que se sabe que ocupan un sitio determinado"
H34_economy_136,right,[None],['evolución'], una razón comprensible la evolución,han sido los vectores potenciales que han recabado mayor atención. Por una razón comprensible la evoluciónlos ha diseñado específicamente para que entren en las células y expresen
H34_economy_137,both,"['factor', 'fisiológico', 'determinante']",['fibras'], el factor fisiológico resulta determinante las fibras,"Pero en las carreras cortas, al depender de la potencia, el factor fisiológico resulta determinante las fibrasmusculares de las piernas de Greene, en particular sus muslos,"
H34_economy_138,right,[None],['filamentos'], un telescopio retráctil los filamentos,"provoca la contracción. Durante la contracción un sarcómero se acorta como un telescopio retráctil los filamentosde actina, situados en los extremos de un filamento de miosina"
H34_economy_139,both,['estructuras'],['microfilamentos'], estructuras diversas microfilamentos,"de mitocondrias (centrales celulares de energía), así como de estructuras diversas microfilamentos, microtúbulos y centrosomas (involucrados en el mantenimiento de la arquitectura"
H34_economy_140,right,[None],['alteración'], interés la alteración,"que regulan la formación del nucléolo. Y lo que revestía mayor interés la alteraciónpersistía en la progenie de esas células, ya que todas ellas"
H34_economy_141,none,[None],[None], Nd YAG,"a partir de un granate de neodimio, itrio y aluminio ( Nd YAG) que opere a una longitud de onda de 532 nanómetros puede"
H34_economy_142,left,"['láser', 'láser infrarrojo']",[None], el láser infrarrojo de Nd YAG,"primero con un láser verde-azul de iones de argón y después con el láser infrarrojo de Nd YAG, al que las células son más transparentes) que podían atrapar"
H34_economy_143,left,"['pinzas', 'láser', 'láser infrarrojo', 'pinzas de láser']",[None], pinzas de láser infrarrojo de Nd YAG,"realizada por Romy Wiegand-Steubing, en mi laboratorio. Se sirvió de pinzas de láser infrarrojo de Nd YAGpara juntar dos células de mieloma humanas; con tijeras de láser"
H34_economy_144,left,"['tipo', 'singular', 'estrés']",[None], un tipo singular de estrés la discriminación,"embargo, que los negros de Norteamérica y Europa se enfrentan a un tipo singular de estrés la discriminaciónracial. Se desconocen los efectos a largo plazo del racismo sobre"
H34_economy_145,left,['resultados'],[None], un esfigmomanómetro que proporciona dos resultados la presión,significa la lectura de la presión La presión sanguínea se mide con un esfigmomanómetro que proporciona dos resultados la presiónsistólica y la diastólica. La sistólica indica la presión máxima ejercida
H34_economy_146,both,"['enfermedades', 'pérdida', 'sal', 'pérdida de sal']",['diarrea'], enfermedades con pérdida de sal diarrea,Muchas de estas muertes se debieron a lo que los médicos llaman enfermedades con pérdida de sal diarreadeshidratación y ciertas infecciones. La capacidad para retener sal podría haber
H34_economy_147,left,"['historia', 'genética']",[None], la historia de la genética el desarrollo,"estamos experimentando otra y, quizás, la más profunda transición en la historia de la genética el desarrolloy la aplicación de la tecnología del DNA recombinante. Esta tecnología"
H34_economy_148,both,"['tipos', 'principales', 'vectores', 'tipos principales']",['plásmidos'], tipos principales de vectores los plásmidos,"célula huésped debería ser fácil de recuperar. Actualmente se utilizan tres tipos principales de vectores los plásmidos, los bacteriófagos y los cósmidos. Los plásmidos Los plásmidos son"
H34_economy_149,both,['capas'],['banda'], capas una banda,"determinadas condiciones, el ácido nucleico se disponía en dos o más capas una bandao estrato principal, que contenía los genes, y bandas secundarias"
H34_economy_150,both,"['tasa', 'mutación', 'tasa de mutación']",['probabilidad'], tasa de mutación la probabilidad,". Debe su interés especial en los procesos evolutivos a una altísima tasa de mutación la probabilidadde que un microsatélite adquiera o pierda, de una generación a"
H34_economy_151,left,['frecuente'],[None], un error frecuente el desajuste,a su proclividad a equivocarse en la replicación del ADN; cometen un error frecuente el desajustepor deslizamiento entre secuencias complementarias. Antes de que una célula -
H34_economy_152,right,[None],['diseño'], Limitaciones Ejemplo el diseño,el reconocimiento de la biología evolutiva como una ciencia médica básica. Limitaciones Ejemplo el diseñodel ojo humano comporta la existencia de una mancha ciega y permite
H34_economy_153,right,[None],['tos'], Defensas Ejemplo la tos,"se desprenda. El ojo del calamar no presenta estos problemas. Defensas Ejemplo la toso la fiebre no son alteraciones, sino expresión de las defensas"
H34_economy_154,right,[None],['diseño'], Compromisos Ejemplo el diseño,"no son alteraciones, sino expresión de las defensas del cuerpo. Compromisos Ejemplo el diseñoexagerado de cualquier sistema, como un par de brazos irrompibles,"
H34_economy_155,none,[None],[None], Conflictos Ejemplo los humanos,"un par de brazos irrompibles, desorganizaría el funcionamiento del cuerpo. Conflictos Ejemplo los humanosse hallan en lucha constante con otros organismos que están bien ajustados"
H34_economy_156,right,[None],['exposición'], Ejemplo la exposición,otros organismos que están bien ajustados por la evolución. Nuevo ambiente Ejemplo la exposicióndel cuerpo humano a un medio donde abunda lo que antes era
H34_economy_157,none,[None],[None], Sexo sin protección promiscuidad,"la salud, suministros de agua potable con deficiente higiene) - Sexo sin protección promiscuidad- (estornudo, tos, contacto cutáneo) - Sexo con"
H34_economy_158,left,"['enfermedad', 'evolutivo']",[None], la enfermedad en un contexto evolutivo Tabla,Los principios siguientes dan fundamento a la consideración de la salud y la enfermedad en un contexto evolutivo Tabla1 Las DEFENSAS y las ALTERACIONES son dos manifestaciones de enfermedad fundamentalmente
H34_economy_159,left,"['sangre', 'efectos', 'colaterales', 'efectos colaterales']",[None], sangre produce efectos colaterales indeseables irritabilidad,". Ahora bien, la presencia de niveles altos de andrógenos en sangre produce efectos colaterales indeseables irritabilidad, reducción de los niveles de lipoproteínas de alta densidad -el colesterol"
H34_economy_160,left,"['maduración', 'esperma', 'epidídimo', 'maduración del esperma']",[None], la maduración del esperma en el epidídimo cámara,que interrumpieran directamente la producción de esperma en los testículos o impidieran la maduración del esperma en el epidídimo cámaraacompañante conectada a los testículos donde el esperma adquiere su movilidad.
H34_economy_161,both,"['métodos', 'hormonales']",['anticonceptivos'], métodos hormonales anticonceptivos,"nuevos, muchos de ellos hormonales. Cuentan ellas hoy con varios métodos hormonales anticonceptivosorales, inyección mensual, inyección trimestral y sistema Norplant pentanual:"
H34_economy_162,both,"['túbulos', 'testículos', 'túbulos seminíferos']",['sistema'], los túbulos seminíferos de los testículos el sistema,. Se investiga la posibilidad de trasplantar células precursoras de espermatozoides en los túbulos seminíferos de los testículos el sistemade tubos en los que de ordinario se forma el esperma.
H34_economy_163,both,"['biopsia', 'diagnóstico']",['cáncer'], La biopsia solicitada confirma el diagnóstico cáncer,El médico palpa el bulto. Comienza una historia harto repetida. La biopsia solicitada confirma el diagnóstico cáncerde mama. Se prescribe la cirugía y quizá radiaciones o quimioterapia
H34_economy_164,both,"['detección', 'precoz', 'detección precoz']",['descubrimiento'], estrategias de detección precoz descubrimiento,inherentes a los ensayos de susceptibilidad subrayan la necesidad de desarrollar mejores estrategias de detección precoz descubrimientode los tumores cuando son muy pequeños o cuando comienzan a tornarse
H34_economy_165,left,['técnica'],[None], la técnica puede automatizarse en su totalidad un técnico,"mutaciones genéticas específicas, como la de ras. De hecho, la técnica puede automatizarse en su totalidad un técnicode laboratorio necesita sólo una gota de orina y una de sangre"
H34_economy_166,both,['término'],['determinación'], el término inglés staging determinación,tumor. Esta evaluación o proceso de estadificación (neologismo que traduce el término inglés staging determinacióndel estadio particular que ha alcanzado una condición o enfermedad progresiva)
H34_economy_167,both,"['marcador', 'susceptibilidad', 'cáncer']",['mutación'], marcador de la susceptibilidad al cáncer la mutación,"la comunidad médica. En los años ochenta se identificó el primer marcador de la susceptibilidad al cáncer la mutacióngenética causante del retinoblastoma, una tumoración ocular. Pero fue a"
H34_economy_168,left,"['rastreo', 'demostrarse']",[None], Un rastreo más insistente puede demostrarse inadecuado la mamografía,. Tampoco el resultado positivo de una prueba resuelve la cuestión. Un rastreo más insistente puede demostrarse inadecuado la mamografíapuede pasar por alto un tumor. Una extirpación preventiva de ambos
H34_economy_169,both,['mutación'],['nucleótido'], una mutación en un punto un nucleótido,ADN) en una porción del gen p53. La secuenciación reveló una mutación en un punto un nucleótido(timina) habría reemplazado a otro (adenina). A
H34_economy_170,left,"['ciclos', 'secuenciales']",[None], ciclos de tres pasos secuenciales supresión,"a adquirir rasgos muy peculiares a medida que sufrieron uno o más ciclos de tres pasos secuenciales supresiónde la recombinación, degeneración de las regiones no recombinantes del cromosoma"
H34_economy_171,none,[None],[None], PDGF cifra,descifrar las funciones específicas de muchos genes supresores de tumores. - PDGF cifrael factor de crecimiento derivado de plaquetas. Implicado en los gliomas
H34_economy_172,none,[None],[None], B cifra,. Implicado en los gliomas (un cáncer de cerebro) - B cifrael receptor del factor de crecimiento epidérmico. Implicado en el glioblastoma
H34_economy_173,none,[None],[None], RET cifra,". Implicado en cánceres de mama, glándulas salivales y ovario - RET cifraun receptor de factor de crecimiento. Implicado en el cáncer de"
H34_economy_174,none,[None],[None], 2 cifra,"y glioblastomas - L-myc: implicado en el cáncer de pulmón - 2 cifrauna proteína que, en situación de normalidad, bloquea el suicidio"
H34_economy_175,none,[None],[None], MDM2 cifra,". Implicado en cánceres de mama, cabeza y garganta. - MDM2 cifraun antagonista de la proteína supresora de tumores p53. Implicado en"
H34_economy_176,none,[None],[None], DPC4 cifra,. - APC: implicado en cánceres de colon y estómago - DPC4 cifrauna molécula transmisora de un cascada de señales que inhiben la división
H34_economy_177,none,[None],[None], MTS1 cifra,"schwannomas (afectan a los revestimientos de los nervios periféricos) - MTS1 cifrala proteína p16, uno de los componentes-freno del reloj del ciclo"
H34_economy_178,none,[None],[None], RB cifra,"componentes-freno del reloj del ciclo celular. Implicado en muchos cánceres - RB cifrala proteína pRB, uno de los frenos principales del ciclo celular"
H34_economy_179,both,"['tipo', 'estudios', 'distinto', 'estudios distinto']",['búsqueda'], un tipo de estudios distinto la búsqueda,La primera gira en torno a observaciones realizadas en el curso de un tipo de estudios distinto la búsquedade posibles diferencias físicas entre el cerebro del varón y el cerebro
H34_economy_180,both,"['estudio', 'principal']",['volumen'], el estudio principal el volumen,"» con otras procedentes de varones heterosexuales de edad similar, confirmó el estudio principal el volumendel NIHA3 del varón homosexual era menos de la mitad que el"
H34_economy_181,right,[None],['diferencias'], Primera las diferencias,"entre orientación sexual y estructura cerebral? Caben tres posibilidades lógicas. Primera las diferenciasestructurales están presentes desde un principio, quizás incluso antes del nacimiento"
H34_economy_182,right,[None],['diferencias'], posibilidad las diferencias,"lo que contribuiría a establecer la orientación sexual del varón. Segunda posibilidad las diferenciasse producen en la madurez, como resultado de las inclinaciones sexuales"
H34_economy_183,both,['principales'],['estudios'], caminos principales estudios,"determinarla. En la búsqueda de esos genes se han tomado dos caminos principales estudiosde gemelos y familias, y análisis de ligamiento en el ADN"
H34_economy_184,both,['características'],['frecuencias'], las características de la LHW las frecuencias,"q = q2. Advierta que estos términos también describen una de las características de la LHW las frecuenciasalélicas determinan las frecuencias genotípicas. En otras palabras, mientras que"
H34_economy_185,left,['población'],[None], la población está en equilibrio Frecuencia,"de los tipos sanguíneos M, MN y N para determinar si la población está en equilibrio Frecuenciaesperada del tipo M = p2 = (0, 178)"
H34_economy_186,both,['fases'],['respuesta'], fases una respuesta,"microorganismos en el cuerpo. Estas respuestas son específicas e implican dos fases una respuestaprimaria ante la exposición inicial, y una respuesta secundaria ante posteriores"
H34_economy_187,both,"['tipos', 'células']",['células'], tipos generales de células T las células,sola célula T forma un grupo familiar o clon. Hay dos tipos generales de células T las célulasT4 cooperadoras / inductoras y las células T8 citotóxicas / supresoras.
H34_economy_188,both,"['tipos', 'cadenas', 'ligeras', 'cadenas ligeras', 'tipos de cadenas', 'tipos de cadenas ligeras']",['cadenas'], tipos de cadenas ligeras las cadenas,"región constante (CL) de la cadena ligera. Hay dos tipos de cadenas ligeras las cadenaskappa, codificadas por genes localizados en el cromosoma humano, y"
