id,subid,topic,relational_semantic_type,presence,candidate_term_left,candidate_term_right,Pivot,occurrence,full_context,annotation,tags,global_freq
H01,H01_71,economy,hyp_attributif,right,[None],['aumento'],xxx_NP_xxx es_VSfin_ser el_ART_el aumento_NC_aumento, xxx es el aumento,"también incorpora los costes marginales futuros de producir cantidades crecientes de xxx es el aumentode la producción de xxx, el coste marginal de producir la",« NON »,NP VSfin ART NC,24
H01,H01_72,economy,hyp_attributif,right,[None],['multiplicador'],xxx_NP_xxx es_VSfin_ser el_ART_el multiplicador_NC_multiplicador, xxx es el multiplicador,"de plantear el Hamiltoniano de este problema xxx en el cual xxx es el multiplicadordinámico y xxx ha sido reemplazado por su valor, tal como",« NON »,NP VSfin ART NC,24
H01,H01_73,economy,hyp_attributif,right,[None],['función'],xxx_NP_xxx es_VSfin_ser una_ART_un función_NC_función, xxx es una función,"Un aspecto interesante de (9. 10) es que xxx es una funciónde una serie de parámetros y de xxx, el tipo de",« NON »,NP VSfin ART NC,24
H01,H01_74,economy,hyp_attributif,none,[None],[None],activos_NC_activo es_VSfin_ser un_ART_un margen_NC_margen, activos es un margen,"11) indica, pues, que el precio de tales activos es un margenconstante sobre el coste marginal, siendo el margen una función de",« NON »,NC VSfin ART NC,27
H01,H01_75,economy,hyp_attributif,both,['tecnología'],['bien'],la_ART_el tecnología_NC_tecnología es_VSfin_ser un_ART_un bien_NC_bien, la tecnología es un bien,", presenta un efecto de escala. El motivo es que la tecnología es un bienno rival: el coste de desarrollar un nuevo producto es independiente",« NON »,ART NC VSfin ART NC,16
H01,H01_76,economy,hyp_attributif,left,['resultado'],[None],resultado_NC_resultado es_VSfin_ser fruto_NC_fruto, resultado es fruto,puede desaparecer con una cierta probabilidad. [4] Este resultado es frutode la ausencia de depreciación. Si la hubiéramos introducido en el,« NON »,NC VSfin NC,9
H01,H01_77,economy,hyp_attributif,right,[None],['función'],oferta_NC_oferta sea_VSfin_ser función_NC_función, oferta sea función,"con cada movimiento de los precios, a menos que tal oferta sea funcióndependiente sólo del salario real. De este modo, su método",« NON »,NC VSfin NC,9
H01,H01_78,economy,hyp_attributif,none,[None],[None],la_ART_el Economía_NP_Economía Política_ADJ_político es_VSfin_ser una_ART_un investigación_NC_investigación, la Economía Política es una investigación,"9 de octubre de 1820: "" Ud. supone que la Economía Política es una investigaciónde la naturaleza y causas de la riqueza -y yo estimo que",« OUI »,ART NP ADJ VSfin ART NC,1
H01,H01_79,economy,hyp_attributif,both,"['costo', 'uso', 'costo de uso']",['ganancia'],el_ART_el costo_NC_costo de_PREP_de uso_NC_uso es_VSfin_ser la_ART_el ganancia_NC_ganancia, el costo de uso es la ganancia,"la producción resultante sobre la suma del costo de factores y el costo de uso es la ganancia, o, como lo llamaremos, el ingreso del empresario.",« NON »,ART NC PREP NC VSfin ART NC,10
H01,H01_80,economy,hyp_attributif,none,[None],[None],exposición_NC_exposición es_VSfin_ser el_ART_el objeto_NC_objeto, exposición es el objeto,"la esencia de la teoría general de la ocupación, cuya exposición es el objetoque nos proponemos, los capítulos siguientes se ocuparán extensamente de examinar",« NON »,NC VSfin ART NC,27
H01,H01_81,economy,hyp_attributif,left,['factores'],[None],factores_NC_factor son_VSfin_ser constantes_NC_constante, factores son constantes,"supondremos que el salario nominal y el costo de los otros factores son constantespor unidad de trabajo empleado; pero esta simplificación, de la",« NON »,NC VSfin NC,9
H01,H01_82,economy,hyp_attributif,both,['ocupación'],['caso'],ocupación_NC_ocupación es_VSfin_ser un_ART_un caso_NC_caso, ocupación es un caso,ocupación plena. La demanda efectiva que trae consigo la plena ocupación es un casoespecial que sólo se realiza cuando la propensión a consumir y el,« NON »,NC VSfin ART NC,27
H01,H01_83,economy,hyp_attributif,left,"['salarios', 'nominales', 'salarios nominales']",[None],los_ART_el salarios_NC_salario nominales_ADJ_nominal son_VSfin_ser constantes_NC_constante, los salarios nominales son constantes,"cambios en D son compatibles con nuestro supuesto provisional de que los salarios nominales son constantes. Por esta razón será necesario, para realizar una exposición más",« NON »,ART NC ADJ VSfin NC,4
H01,H01_84,economy,hyp_attributif,none,[None],[None],optimismo_NC_optimismo es_VSfin_ser el_ART_el causante_NC_causante, optimismo es el causante,"realidad lo hace así es eliminar graciosamente nuestras dificultades. Tal optimismo es el causantede que se mire a los economistas como Cándidos que, habiéndose",« NON »,NC VSfin ART NC,27
H01,H01_85,economy,hyp_attributif,left,['definición'],[None],definición_NC_definición precisa_ADJ_preciso es_VSfin_ser una_ART_un tarea_NC_tarea, definición precisa es una tarea,el correcto y apropiado para el análisis económico; pero su definición precisa es una tareaimposible hasta que se haya adoptado un sistema satisfactorio de unidades.,« NON »,NC ADJ VSfin ART NC,13
H01,H01_86,economy,hyp_attributif,both,['casos'],['suposición'],la_ART_el mayoría_NC_mayoría de_PREP_de los_ART_el casos_NC_caso es_VSfin_ser la_ART_el suposición_NC_suposición, la mayoría de los casos es la suposición,"a su eficacia en el empleo específico real (que en la mayoría de los casos es la suposiciónrealista que debe hacerse), la eficacia descendente del trabajo empleado",« NON »,ART NC PREP ART NC VSfin ART NC,6
H01,H01_87,economy,hyp_attributif,both,['ahorro'],['excedente'],ahorro_NC_ahorro es_VSfin_ser el_ART_el excedente_NC_excedente, ahorro es el excedente,"yo sepa, todo el mundo está de acuerdo en que ahorro es el excedentedel ingreso sobre lo que se gasta en consumo; y no",« NON »,NC VSfin ART NC,27
H01,H01_88,economy,hyp_attributif,left,['ahorro'],[None],el_ART_el ahorro_NC_ahorro era_VSfin_ser la_ART_el fuerza_NC_fuerza, el ahorro era la fuerza,allí que el cambio en el excedente de la inversión sobre el ahorro era la fuerzamotora que regia las modificaciones en el volumen de la producción.,« NON »,ART NC VSfin ART NC,16
H01,H01_89,economy,hyp_attributif,both,['ahorro'],['excedente'],ahorro_NC_ahorro forzado_ADJ_forzado es_VSfin_ser el_ART_el excedente_NC_excedente, ahorro forzado es el excedente,"ocupación plena, la definición anterior se expresaría así: "" ahorro forzado es el excedentedel ahorro real sobre lo que se ahorraría si hubiera ocupación plena",« NON »,NC ADJ VSfin ART NC,13
H01,H01_90,economy,hyp_attributif,both,['ahorro'],['fenómeno'],ahorro_NC_ahorro sería_VSfin_ser un_ART_un fenómeno_NC_fenómeno, ahorro sería un fenómeno,"definición tendría sentido, pero significaría que un excedente forzado de ahorro sería un fenómenomuy raro e inestable, y una deficiencia forzada de ahorro el",« NON »,NC VSfin ART NC,27
H01,H01_91,economy,hyp_attributif,both,"['tasa', 'interés', 'tasa de interés']",['factor'],la_ART_el tasa_NC_tasa de_PREP_de interés_NC_interés era_VSfin_ser el_ART_el factor_NC_factor, la tasa de interés era el factor,"de interés, que se basó en la idea de que la tasa de interés era el factorque ponía en equilibrio la oferta y la demanda de ahorros,",« OUI »,ART NC PREP NC VSfin ART NC,10
H01,H01_92,economy,hyp_attributif,both,['ocupación'],['función'],la_ART_el ocupación_NC_ocupación es_VSfin_ser función_NC_función, la ocupación es función,"la importancia del hecho ya mencionado antes de que, mientras la ocupación es funcióndel consumo y la inversión previstos, el consumo es, ceteris",« OUI »,ART NC VSfin NC,9
H01,H01_93,economy,hyp_attributif,both,"['valor', 'inversiones']",['consecuencia'],el_ART_el valor_NC_valor de_PREP_de las_ART_el inversiones_NC_inversión fueran_VSfin_ser consecuencia_NC_consecuencia, el valor de las inversiones fueran consecuencia,y procederemos en las secciones siguientes como si los cambios en el valor de las inversiones fueran consecuenciasolamente de cambios de la expectativa de sus rendimientos probables y de,« NON »,ART NC PREP ART NC VSfin NC,1
H01,H01_94,economy,hyp_attributif,right,[None],['propiedad'],las_ART_el empresas_NC_empresa eran_VSfin_ser propiedad_NC_propiedad, las empresas eran propiedad,"gobierna el mercado. En otros tiempos, cuando casi todas las empresas eran propiedadde los empresarios o de sus amigos y asociados, la inversión",« NON »,ART NC VSfin NC,9
H01,H01_95,economy,hyp_attributif,none,[None],[None],realidad_NC_realidad es_VSfin_ser una_ART_un convención_NC_convención, realidad es una convención,", por regla general, en referirnos a lo que en realidad es una convención. La esencia de ésta -aunque desde luego no funciona con tanta",« NON »,NC VSfin ART NC,27
H01,H01_96,economy,hyp_attributif,both,['tendencias'],['consecuencia'],tendencias_NC_tendencia son_VSfin_ser una_ART_un consecuencia_NC_consecuencia, tendencias son una consecuencia,"se han orientado de hecho hacia un fin diferente. Estas tendencias son una consecuenciadifícilmente eludible de que hayamos logrado organizar mercados de inversiones "" líquidos",« NON »,NC VSfin ART NC,27
H01,H01_97,economy,hyp_attributif,both,"['salarios', 'nominales', 'salarios nominales']",['reducción'],los_ART_el salarios_NC_salario nominales_ADJ_nominal es_VSfin_ser una_ART_un reducción_NC_reducción, los salarios nominales es una reducción,"referimos a un sistema no cerrado, y la baja de los salarios nominales es una reducciónrelativamente a los salarios nominales en el exterior cuando ambos se convierten",« OUI »,ART NC ADJ VSfin ART NC,14
H01,H01_98,economy,hyp_attributif,none,[None],[None],país_NC_país es_VSfin_ser un_ART_un sistema_NC_sistema, país es un sistema,"Unidos, se debe, probablemente, a que este último país es un sistemacerrado en comparación con el inglés. 3 En el caso de",« NON »,NC VSfin ART NC,27
H01,H01_99,economy,hyp_attributif,both,"['salarios', 'nominales', 'salarios nominales']",['reducción'],los_ART_el salarios_NC_salario nominales_ADJ_nominal sea_VSfin_ser una_ART_un reducción_NC_reducción, los salarios nominales sea una reducción,"a consumir. 4 Si se espera que la baja de los salarios nominales sea una reducciónrelativamente a los salarios nominales en el futuro, el cambio será",« NON »,ART NC ADJ VSfin ART NC,14
H01,H01_100,economy,hyp_attributif,both,['caso'],['efecto'],caso_NC_caso es_VSfin_ser el_ART_el efecto_NC_efecto, caso es el efecto,"pero la variación más importante de la que no hemos hecho caso es el efecto, tanto sobre los costos como sobre el volumen, de los",« NON »,NC VSfin ART NC,27
H01,H01_101,economy,hyp_attributif,both,['resultado'],['consecuencia'],resultado_NC_resultado es_VSfin_ser consecuencia_NC_consecuencia, resultado es consecuencia,"efecto de aumentarla en términos de unidades de costo. Este resultado es consecuenciadel supuesto de que los factores de la producción, y en",« NON »,NC VSfin NC,9
H01,H01_102,economy,hyp_attributif,both,"['dinero', 'excedente']",['proporción'],dinero_NC_dinero excedente_ADJ_excedente es_VSfin_ser una_ART_un proporción_NC_proporción, dinero excedente es una proporción,". Entrarán en juego las tendencias opuestas si la cantidad de dinero excedente es una proporciónanormalmente baja del ingreso nacional. Así, el efecto neto de",« NON »,NC ADJ VSfin ART NC,13
H01,H01_103,economy,hyp_attributif,both,['sobreinversión'],['característica'],la_ART_el sobreinversión_NC_sobreinversión es_VSfin_ser la_ART_el característica_NC_característica, la sobreinversión es la característica,"de acuerdo con el punto de vista de quienes sostienen que la sobreinversión es la característicadel auge, que el único remedio posible para la siguiente depresión",« OUI »,ART NC VSfin ART NC,16
H01,H01_104,economy,hyp_attributif,both,['sentido'],['característica'],sentido_NC_sentido fuera_VSfin_ser una_ART_un característica_NC_característica, sentido fuera una característica,". [4] Además, aunque la sobreinversión en este sentido fuera una característicanormal del auge, el remedio no estaría en imponer de súbito",« OUI »,NC VSfin ART NC,27
H01,H01_105,economy,hyp_attributif,left,['tasa'],[None],tasa_NC_tasa sea_VSfin_ser un_ART_un obstáculo_NC_obstáculo, tasa sea un obstáculo,"desacertada de expectativas que, mientras dura, impide que esta tasa sea un obstáculoreal. El auge es una situación tal que el exceso de",« NON »,NC VSfin ART NC,27
H01,H01_106,economy,hyp_attributif,left,['auge'],[None],El_ART_el auge_NC_auge es_VSfin_ser una_ART_un situación_NC_situación, El auge es una situación,"dura, impide que esta tasa sea un obstáculo real. El auge es una situacióntal que el exceso de optimismo triunfa sobre una tasa de interés",« OUI »,ART NC VSfin ART NC,16
H01,H01_107,economy,hyp_attributif,left,['economía'],[None],economía_NC_economía es_VSfin_ser el_ART_el dominio_NC_dominio, economía es el dominio,"resto de la gente que piensa, habla y escribe de economía es el dominiode técnicas [2] que clasificamos bajo los tres títulos generales",« NON »,NC VSfin ART NC,27
H01,H01_108,economy,hyp_attributif,both,['económicos'],['historia'],campos_NC_campo económicos_ADJ_económico es_VSfin_ser la_ART_el historia_NC_historia, campos económicos es la historia,"Historia económica & rsqb; El más importante de esos tres campos económicos es la historiaeconómica, la cual desemboca en los hechos de hoy día y",« NON »,NC ADJ VSfin ART NC,13
H01,H01_109,economy,hyp_attributif,both,['historia'],['fuente'],la_ART_el historia_NC_historia es_VSfin_ser una_ART_un fuente_NC_fuente, la historia es una fuente,"lamentables consecuencias de la anterior argumentación. Primera: puesto que la historia es una fuenteimportante -aunque no la única- del material del economista, y puesto",« OUI »,ART NC VSfin ART NC,16
H01,H01_110,economy,hyp_attributif,both,"['economista', 'mismo']",['producto'],el_ART_el economista_NC_economista mismo_ADJ_mismo es_VSfin_ser un_ART_un producto_NC_producto, el economista mismo es un producto,"del material del economista, y puesto que, además, el economista mismo es un productode su propia época y de todo el tiempo anterior, el",« OUI »,ART NC ADJ VSfin ART NC,14
H01,H01_111,economy,hyp_attributif,left,"['historia', 'historia económica']",[None],la_ART_el historia_NC_historia económica_ADJ_económico es_VSfin_ser una_ART_un parte_NC_parte, la historia económica es una parte,": hemos de registrar resueltamente el hecho de que, como la historia económica es una partede la economía, las técnicas del historiador son como pasajeros en",« NON »,ART NC ADJ VSfin ART NC,14
H01,H01_112,economy,hyp_attributif,both,"['métodos', 'estadísticos', 'métodos estadísticos']",['condición'],métodos_NC_método estadísticos_ADJ_estadístico es_VSfin_ser una_ART_un condición_NC_condición, métodos estadísticos es una condición,"métodos. Así pues, el dominio suficiente de los modernos métodos estadísticos es una condiciónnecesaria (aunque no suficiente) para evitar que el economista moderno",« NON »,NC ADJ VSfin ART NC,13
H01,H01_113,economy,hyp_attributif,left,"['métodos', 'estadísticos', 'métodos estadísticos']",[None],los_ART_el métodos_NC_método estadísticos_ADJ_estadístico son_VSfin_ser parte_NC_parte, los métodos estadísticos son parte,"programa. Pero reconoceremos, en principio al menos, que los métodos estadísticos son partede los instrumentos del análisis económico, aunque no hayan sido construidos",« NON »,ART NC ADJ VSfin NC,4
H01,H01_114,economy,hyp_attributif,left,['hipótesis'],[None],hipótesis_NC_hipótesis son_VSfin_ser elementos_NC_elemento, hipótesis son elementos,esas significaciones entiende por teorías hipótesis explicativas Desde luego que esas hipótesis son elementosesenciales de la historiografía y de la estadística también. Por ejemplo,« NON »,NC VSfin NC,9
H01,H01_115,economy,hyp_attributif,both,"['teoría', 'teoría económica']",['caja'],la_ART_el teoría_NC_teoría económica_ADJ_económico es_VSfin_ser una_ART_un caja_NC_caja, la teoría económica es una caja,". Según la frase insuperablemente acertada de la señora Robinson, la teoría económica es una cajade herramientas. La justificación de este concepto de la teoría económica",« OUI »,ART NC ADJ VSfin ART NC,14
H01,H01_116,economy,hyp_attributif,none,[None],[None],verlas_NC_verlas fue_VSfin_ser Léon_NP_Léon, verlas fue Léon,"de todas sus posibilidades; en realidad, el primero en verlas fue LéonWalras (cfr. infra, Parte IV, cap. 6",« NON »,NC VSfin NP,4
H01,H01_117,economy,hyp_attributif,none,[None],[None],La_NP_La formulación_NC_formulación del_PDEL_del texto_NC_texto es_VSfin_ser una_ART_un exposición_NC_exposición, La formulación del texto es una exposición,si se reúnen y formulan explícitamente). [12] La formulación del texto es una exposiciónbreve de la doctrina de E. Mach según la cual toda,« NON »,NP NC PDEL NC VSfin ART NC,1
H01,H01_118,economy,hyp_attributif,left,['ciencia'],[None],la_ART_el ciencia_NC_ciencia es_VSfin_ser un_ART_un tema_NC_tema, la ciencia es un tema,las razones por las cuales y la medida en la cual la ciencia es un temaapropiado para la investigación sociológica. Desde luego que nuestro interés por,« OUI »,ART NC VSfin ART NC,16
H01,H01_119,economy,hyp_attributif,right,[None],['producto'],observador_NC_observador analista_NC_analista es_VSfin_ser producto_NC_producto, observador analista es producto,situación se agrava aún por el hecho de que el mismo observador analista es productode un determinado ambiente social -y de su situación personal en ese,« NON »,NC NC VSfin NC,1
H01,H01_120,economy,hyp_attributif,none,[None],[None],El_ART_el país_NC_país enemigo_ADJ_enemigo es_VSfin_ser el_ART_el antro_NC_antro, El país enemigo es el antro,", excepto por lo que hace a la fragilidad humana. El país enemigo es el antrode los monstruos, mientras que el nuestro es hogar de héroes",« NON »,ART NC ADJ VSfin ART NC,14
H01,H01_121,economy,hyp_attributif,left,['capitalista'],[None],la_ART_el sociedad_NC_sociedad capitalista_ADJ_capitalista son_VSfin_ser glorificaciones_NC_glorificación, la sociedad capitalista son glorificaciones,". Según Marx -y por decirlo simplificadamente-, las ideologías de la sociedad capitalista son glorificacionesde lo que él llamó clase capitalista, cuyos intereses se basarían",« OUI »,ART NC ADJ VSfin NC,4
H01,H01_122,economy,hyp_attributif,left,['ideologías'],[None],las_ART_el ideologías_NC_ideología son_VSfin_ser sobrestructuras_NC_sobrestructuras, las ideologías son sobrestructuras,El principio mismo no implica más que dos cosas: que las ideologías son sobrestructuraslevantadas sobre y producidas por las realidades de la estructura social objetiva,« OUI »,ART NC VSfin NC,9
H01,H01_123,economy,hyp_attributif,right,[None],['factor'],la_ART_el posición_NC_posición social_ADJ_social es_VSfin_ser un_ART_un factor_NC_factor, la posición social es un factor,al concepto de influencia ideológica. No hay duda de que la posición social es un factorpoderoso en la configuración de nuestra mentalidad. Pero eso no equivale,« NON »,ART NC ADJ VSfin ART NC,14
H01,H01_124,economy,hyp_attributif,none,[None],[None],el_ART_el mundo_NC_mundo es_VSfin_ser víctima_NC_víctima, el mundo es víctima,"se puede decir de un modo ligeramente más realista: todo el mundo es víctimadel autoengaño ideológico, excepto el moderno intelectual radical, el cual",« NON »,ART NC VSfin NC,9
H01,H01_125,economy,hyp_attributif,right,[None],['hecho'],cuestiones_NC_cuestión es_VSfin_ser el_ART_el hecho_NC_hecho, cuestiones es el hecho,humanas. Ahora bien: si algo evidente hay en estas cuestiones es el hechode que ese intelectual no es más que un haz de prejuicios,« NON »,NC VSfin ART NC,27
H01,H01_126,economy,hyp_attributif,none,[None],[None],lengua_NC_lengua materna_ADJ_materno era_VSfin_ser el_ART_el alemán-_NC_alemán-, lengua materna era el,"sociología del saber "". Pero parece claro que Schumpeter -cuya lengua materna era eltraduce con alguna intención filosófica cuando escribe The Sociology of Science.",« NON »,NC ADJ VSfin ART NC,13
H01,H01_127,economy,hyp_attributif,left,['alemana'],[None],La_ART_el palabra_NC_palabra alemana_ADJ_alemán es_VSfin_ser Wissenssoziologie_NP_Wissenssoziologie, La palabra alemana es Wissenssoziologie,"término'sociología del conocimiento'del modo siguiente: "" La palabra alemana es Wissenssoziologie, y los autores más dignos de cita, Max Scheler y",« OUI »,ART NC ADJ VSfin NP,1
H01,H01_128,economy,hyp_attributif,both,['ideología'],['factor'],ideología_NC_ideología de_PREP_de las_ART_el burocracias_NC_burocracia es_VSfin_ser un_ART_un factor_NC_factor, ideología de las burocracias es un factor,"la influencia de las ideologías en el análisis, pues esta ideología de las burocracias es un factorimportante de la acientífica costumbre de los economistas de utilizar una teoría",« NON »,NC PREP ART NC VSfin ART NC,3
H01,H01_129,economy,hyp_attributif,left,['pirámide social'],[None],pirámide_NC_pirámide social_ADJ_social eran_VSfin_ser los_ART_el campesinos_NC_campesino, pirámide social eran los campesinos,"civilización de la época feudal. La base económica de esta pirámide social eran los campesinossiervos y los artesanos del señor, de cuyo trabajo vivía éste",« NON »,NC ADJ VSfin ART NC,13
H01,H01_130,economy,hyp_attributif,left,['feudalismo'],[None],el_ART_el feudalismo_NC_feudalismo es_VSfin_ser la_ART_el simbiosis_NC_simbiosis, el feudalismo es la simbiosis,"municipios lombardos. Por eso, visto como realidad histórica, el feudalismo es la simbiosisde dos sistemas sociales esencialmente diferentes y en gran parte -aunque no",« NON »,ART NC VSfin ART NC,16
H01,H01_131,economy,hyp_attributif,right,[None],['monjes'],tiempos_NC_tiempo fueron_VSfin_ser monjes_NC_monje, tiempos fueron monjes,"lo tanto, casi todos los "" intelectuales "" de aquellos tiempos fueron monjeso frailes. Consideremos brevemente algunas consecuencias de esa circunstancia. Todos",« NON »,NC VSfin NC,9
H01,H01_132,economy,hyp_attributif,none,[None],[None],país_NC_país era_VSfin_ser la_ART_el Cristiandad_NC_cristiandad, país era la Cristiandad,"autoridad suprema del papa, que era esencialmente internacional: su país era la Cristiandad'y su estado la Iglesia. Pero no es eso todo",« NON »,NC VSfin ART NC,27
H01,H01_133,economy,hyp_attributif,left,['resultado'],[None],El_ART_el resultado_NC_resultado fue_VSfin_ser el_ART_el nacimiento_NC_nacimiento, El resultado fue el nacimiento,Dante como la completa ausencia del punto de vista nacionalista. El resultado fue el nacimientode una civilización esencialmente internacional y de una república internacional de los,« NON »,ART NC VSfin ART NC,16
H01,H01_134,economy,hyp_attributif,none,[None],[None],La_ART_el Iglesia_NP_Iglesia era_VSfin_ser juez_NC_juez, La Iglesia era juez,representar como cosa inmutable un orden temporal de las cosas. La Iglesia era juezde todas las cosas humanas; el conflicto con la autoridad temporal,« NON »,ART NP VSfin NC,1
H01,H01_135,economy,hyp_attributif,left,['temporal'],[None],la_ART_el autoridad_NC_autoridad temporal_ADJ_temporal era_VSfin_ser una_ART_un posibilidad_NC_posibilidad, la autoridad temporal era una posibilidad,"era juez de todas las cosas humanas; el conflicto con la autoridad temporal era una posibilidadsiempre presente, y a menudo realidad; las órdenes monásticas eran",« NON »,ART NC ADJ VSfin ART NC,14
H01,H01_136,economy,hyp_attributif,none,[None],[None],las_ART_el órdenes_NC_orden monásticas_ADJ_monástico eran_VSfin_ser instrumentos_NC_instrumento, las órdenes monásticas eran instrumentos,"era una posibilidad siempre presente, y a menudo realidad; las órdenes monásticas eran instrumentosimportantes de la autoridad pontificia, pero eso no bastaba para impedirlas",« NON »,ART NC ADJ VSfin NC,4
H01,H01_137,economy,hyp_attributif,left,['ciencia'],[None],la_ART_el ciencia_NC_ciencia es_VSfin_ser medición_NC_medición, la ciencia es medición,teórico. Pero era uno de esos teóricos para los cuales la ciencia es medición; uno de esos teóricos que forjan instrumentos analíticos adecuados para manejar,« OUI »,ART NC VSfin NC,9
H01,H01_138,economy,hyp_attributif,left,['generalizaciones'],[None],generalizaciones_NC_generalización son_VSfin_ser la_ART_el combinación_NC_combinación, generalizaciones son la combinación,"desprecian cordialmente todos los demás; uno de esos teóricos cuyas generalizaciones son la combinaciónde cifras y razonamiento, nunca tolerados separadamente. La relación entre",« NON »,NC VSfin ART NC,27
H01,H01_139,economy,hyp_attributif,none,[None],[None],la_ART_el mujer_NC_mujer son_VSfin_ser ejemplos_NC_ejemplo, la mujer son ejemplos,del matrimonio en relación con las edades del marido y de la mujer son ejemplosal azar de un amplio campo de investigación que se iba a,« NON »,ART NC VSfin NC,9
H01,H01_140,economy,hyp_attributif,left,"['velocidad', 'dinero']",[None],velocidad_NC_velocidad del_PDEL_del dinero_NC_dinero es_VSfin_ser -y_NC_-y, velocidad del dinero es,", que la mayoría de sus contemporáneos. Su concepto de velocidad del dinero escon razón- el más famoso, y se volverá a citar en",« NON »,NC PDEL NC VSfin NC,1
H01,H01_141,economy,hyp_attributif,left,['trabajo'],[None],el_ART_el trabajo_NC_trabajo es_VSfin_ser el_ART_el padre_NC_padre, el trabajo es el padre,"mundo conoce la frase, repetida ad nauseam de que "" el trabajo es el padre... de la riqueza, así como las tierras son su madre",« OUI »,ART NC VSfin ART NC,16
