id,subid,topic,relational_semantic_type,presence,candidate_term_left,candidate_term_right,Pivot,occurrence,full_context,annotation,tags,global_freq
H01,H01_142,economy,hyp_attributif,none,[None],[None],Davenant_NP_Davenant fue_VSfin_ser un_ART_un funcionario_NC_funcionario, Davenant fue un funcionario,"fila que merece, pero que no ha conseguido todavía. Davenant fue un funcionariopúblico, pero también un político, elegido tres veces al parlamento",« NON »,NP VSfin ART NC,24
H01,H01_143,economy,hyp_attributif,none,[None],[None],afirmación_NC_afirmación son_VSfin_ser los_ART_el Estados_NC_estado, afirmación son los Estados,"la burguesía no gobernaba políticamente: las excepciones principales a esa afirmación son los EstadosUnidos y, durante los diecisiete años del régimen de Luis-Felipe,",« NON »,NC VSfin ART NC,27
H01,H01_144,economy,hyp_attributif,left,['cátedra'],[None],La_ART_el cátedra_NC_cátedra era_VSfin_ser una_ART_un fundación_NC_fundación, La cátedra era una fundación,cátedra de economía política en el Trinity College de Dublín. La cátedra era una fundacióndel arzobispo Whately. Escribió también acerca de las leyes de pobres,« NON »,ART NC VSfin ART NC,16
H01,H01_145,economy,hyp_attributif,none,[None],[None],Thunen_NP_Thunen era_VSfin_ser un_ART_un Junker_NC_Junker, Thunen era un Junker,"de este período, con la posible excepción de Cournot. Thunen era un Junkerde la Alemania septentrional y siguió la profesión típica del Junkertum prusiano",« NON »,NP VSfin ART NC,24
H01,H01_146,economy,hyp_attributif,none,[None],[None],granjero_NC_granjero práctico_ADJ_práctico era_VSfin_ser un_ART_un pensador_NC_pensador, granjero práctico era un pensador,"poder dedicarse durante el invierno a sus intereses intelectuales. Este granjero práctico era un pensadornato, sin embargo 'completamente incapaz de supervisar las cuadrillas que",« NON »,NC ADJ VSfin ART NC,13
H01,H01_147,economy,hyp_attributif,none,[None],[None],Thunen_NP_Thunen era_VSfin_ser un_ART_un agrónomo_NC_agrónomo, Thunen era un agrónomo,"generalizaciones de épocas más antiguas, pero, ante todo, Thunen era un agrónomoeducado en las ideas de Thaer y un cultivador de la economía",« NON »,NP VSfin ART NC,24
H01,H01_148,economy,hyp_attributif,none,[None],[None],localizaciones_NC_localización son_VSfin_ser zonas_NC_zona, localizaciones son zonas,"la caza; sobre la base de sus supuestos, esas localizaciones son zonasanulares. Como subproducto obtiene Thunen una teoría de la renta superior",« NON »,NC VSfin NC,9
H01,H01_149,economy,hyp_attributif,both,['producción'],['salarios'],gastos_NC_gasto de_PREP_de producción_NC_producción son_VSfin_ser los_ART_el salarios_NC_salario, gastos de producción son los salarios,"un proceso productivo de un año en el cual los únicos gastos de producción son los salarios. Llamemos p al valor en dólares del producto nacional neto,",« NON »,NC PREP NC VSfin ART NC,2
H01,H01_150,economy,hyp_attributif,left,['hecho'],[None],el_ART_el hecho_NC_hecho es_VSfin_ser un_ART_un elemento_NC_elemento, el hecho es un elemento,una seria depresión para la agricultura europea. Desde luego que el hecho es un elementoesencial del aumento del 50 por ciento del salario real de los,« NON »,ART NC VSfin ART NC,16
H01,H01_151,economy,hyp_attributif,none,[None],[None],adaptación_NC_adaptación posible_ADJ_posible era_VSfin_ser la_ART_el bancarrota_NC_bancarrota, adaptación posible era la bancarrota,"para muchos individuos y para muchos grupos el único método de adaptación posible era la bancarrota. Y para los trabajadores, el paro o su omnipresente amenaza",« NON »,NC ADJ VSfin ART NC,13
H01,H01_152,economy,hyp_attributif,right,[None],['factor'],la_ART_el burocracia_NC_burocracia era_VSfin_ser un_ART_un factor_NC_factor, la burocracia era un factor,"con una determinada dificultad económica. En países en los cuales la burocracia era un factorpotente y, como en Alemania, se había adherido al liberalismo",« OUI »,ART NC VSfin ART NC,16
H01,H01_153,economy,hyp_attributif,both,['tipo'],['obra'],tipo_NC_tipo fue_VSfin_ser obra_NC_obra, tipo fue obra,de nuestro conocimiento factual. Mucho trabajo adicional de este mismo tipo fue obrade personas y grupos en relación con ese esfuerzo colectivo de la,« NON »,NC VSfin NC,9
H01,H01_154,economy,hyp_attributif,right,[None],['monopolista'],empresa_NC_empresa será_VSfin_ser un_ART_un monopolista_NC_monopolista, empresa será un monopolista,"el monopolio "" se trague el análisis competitivo "": cada empresa será un monopolista, esto es, vendedor único de su propio producto, y",« NON »,NC VSfin ART NC,27
H01,H01_155,economy,hyp_attributif,both,['dinámica'],['punto'],la_ART_el dinámica_NC_dinámica es_VSfin_ser un_ART_un punto_NC_punto, la dinámica es un punto,"o "" progreso "". [1] Así definida, la dinámica es un puntode partida auténticamente nuevo. En varios recodos de nuestro camino,",« OUI »,ART NC VSfin ART NC,16
H01,H01_156,economy,hyp_attributif,right,[None],['característica'],preocupación_NC_preocupación es_VSfin_ser una_ART_un característica_NC_característica, preocupación es una característica,"problemas del ciclo económico. Como ya hemos visto, esa preocupación es una característicadestacada de nuestro tiempo. El anterior análisis de los factores que",« NON »,NC VSfin ART NC,27
H01,H01_157,economy,hyp_attributif,left,['uso'],[None],uso_NC_uso del_PDEL_del léxico_NC_léxico son_VSfin_ser Frisch_NP_Frisch, uso del léxico son Frisch,con la teoría del crecimiento. Las principales autoridades de nuestro uso del léxico son Frischy Hicks. Ejemplos destacados de otro uso son HARROD (véase,« NON »,NC PDEL NC VSfin NP,1
H01,H01_158,economy,hyp_attributif,left,['uso'],[None],uso_NC_uso son_VSfin_ser HARROD_NP_Harrod, uso son HARROD,"del léxico son Frisch y Hicks. Ejemplos destacados de otro uso son HARROD(véase particularmente Towards a Dynamic Economics, 1948) y Stigler",« NON »,NC VSfin NP,4
H01,H01_159,economy,hyp_attributif,left,['coeficientes'],[None],los_ART_el coeficientes_NC_coeficiente sean_VSfin_ser constantes_NC_constante, los coeficientes sean constantes,"del número de variables, sino también el postulado de que los coeficientes sean constantes: si no lo fueran, la ecuación no sería tan fácil",« NON »,ART NC VSfin NC,9
H01,H01_160,economy,hyp_attributif,both,"['ritmo', 'crecimiento', 'ritmo de crecimiento']",['debilidad'],el_ART_el ritmo_NC_ritmo de_PREP_de crecimiento_NC_crecimiento es_VSfin_ser la_ART_el debilidad_NC_debilidad, el ritmo de crecimiento es la debilidad,"progresivamente creciente. Una de las causas de la moderación en el ritmo de crecimiento es la debilidadque muestra el consumo, pese a su perfil creciente. El",« NON »,ART NC PREP NC VSfin ART NC,10
H01,H01_161,economy,hyp_attributif,both,"['debilidad', 'consumo', 'debilidad del consumo']",['característica'],La_ART_el debilidad_NC_debilidad del_PDEL_del consumo_NC_consumo es_VSfin_ser una_ART_un característica_NC_característica, La debilidad del consumo es una característica,"del 1, 1 % y 0, 8 %. La debilidad del consumo es una característicacomún a los tres países, así como los ajustes fiscales necesarios",« OUI »,ART NC PDEL NC VSfin ART NC,1
H01,H01_162,economy,hyp_attributif,none,[None],[None],España_NP_España fueron_VSfin_ser el_ART_el avión_NC_avión, España fueron el avión,"otra parte, las dos vías utilizadas preferentemente para entrar en España fueron el avión(63 % de los casos) y la carretera (32",« NON »,NP VSfin ART NC,24
H01,H01_163,economy,hyp_attributif,left,"['bienes', 'industriales', 'bienes industriales']",[None],los_ART_el bienes_NC_bien industriales_ADJ_industrial fue_VSfin_ser el_ART_el elemento_NC_elemento, los bienes industriales fue el elemento,buen comportamiento de los precios de los alimentos elaborados y de los bienes industriales fue el elementodeterminante de esta reducción trascendental de la tasa de inflación. Gracias,« NON »,ART NC ADJ VSfin ART NC,14
H01,H01_164,economy,hyp_attributif,right,[None],['factores'],Nueva_NC_nueva York_NP_York fueron_VSfin_ser los_ART_el factores_NC_factor, Nueva York fueron los factores,de interés y la trayectoria al alza de la Bolsa de Nueva York fueron los factoresexplicativos más directos de la carrera alcista de la bolsa española.,« OUI »,NC NP VSfin ART NC,2
H01,H01_165,economy,hyp_attributif,none,[None],[None],la_ART_el Ley_NC_ley es_VSfin_ser el_ART_el fortalecimiento_NC_fortalecimiento, la Ley es el fortalecimiento,"ambientales o culturales. Otro de los grandes cambios que introducirá la Ley es el fortalecimientodel derecho de propiedad, con relación al régimen urbanístico. En",« NON »,ART NC VSfin ART NC,16
H01,H01_166,economy,hyp_attributif,both,"['bruta', 'deuda bruta']",['variable'],La_ART_el deuda_NC_deuda bruta_ADJ_bruto es_VSfin_ser la_ART_el variable_NC_variable, La deuda bruta es la variable,"la posición activa del Estado en el Banco de España. La deuda bruta es la variableseñalada en la condición de convergencia de Maastricht, que difiere pues",« OUI »,ART NC ADJ VSfin ART NC,14
