id,presence,candidate_term_left,candidate_term_right,occurrence,full_context
H17_economy_65,left,"['día', 'conocimientos']",[None], día que la adquisición de conocimientos el aprendizaje,1962) y Sheshinski (1967). Arrowhabía argumentado en su día que la adquisición de conocimientos el aprendizajeestaba vinculada a la experiencia y citaba ejemplos de la industria aeronáutica
H17_economy_66,left,"['determinadas', 'unidades']",[None], la población de las determinadas unidades políticas los países,"explicar por qué, en los datos, hay poca relación entre la población de las determinadas unidades políticas los paísesy las tasas de crecimiento. Otra consecuencia importante del efecto de"
H17_economy_67,none,[None],[None], países uno desarrollado el norte,"). En su planteamiento, el mundo se divide en dos países uno desarrollado el nortey otro en vías de desarrollo (el sur). También"
H17_economy_68,left,"['variables', 'variables de control']",[None], variables de control xxx y xxx,"el hecho de que ahora contamos con dos restricciones dinámicas y dos variables de control xxx y xxxen lugar de una. Por este motivo, al construir el"
H17_economy_69,right,[None],"['capital', 'medio', 'capital humano', 'capital humano medio']", xxx el capital humano medio,"transversalidad. Para que haya una consistencia interna, debe cumplirse que xxx el capital humano mediosea igual a xxx (que también es el capital humano medio"
H17_economy_70,both,['crecimiento'],"['productividad', 'sector educativo', 'productividad del sector', 'productividad del sector educativo']", el crecimiento es xxx la productividad del sector educativo,. La única diferencia es que el parámetro de productividad relevante para el crecimiento es xxx la productividad del sector educativoen lugar de xxx (la productividad del sector de bienes finales
H17_economy_71,right,[None],"['productividad', 'bienes', 'bienes finales', 'productividad del sector', 'sector de bienes', 'sector de bienes finales']", lugar de xxx la productividad del sector de bienes finales,"el crecimiento es xxx (la productividad del sector educativo) en lugar de xxx la productividad del sector de bienes finales. Es decir, en este modelo, el sector que realmente"
H17_economy_72,left,['boletín'],[None], referencias están tomadas de un boletín nº,"y £ 46. 000, 000. [7] Estas referencias están tomadas de un boletín nºdel National Bureau of Economic Research, en el que se dan"
H17_economy_73,right,[None],"['abstracción', 'ganancia']", suerte ni satisfacción abstracción hecha de la ganancia,"él. Si la naturaleza humana no sintiera la tentación de probar suerte ni satisfacción abstracción hecha de la gananciaen construir una fábrica, un ferrocarril, una mina o una"
H17_economy_74,left,"['serie', 'embotellamientos']",[None], una serie de embotellamientos necks,". Así, al aumentar la producción, se llegará sucesivamente a una serie de embotellamientos necksen los que la oferta de determinados bienes deja de ser elástica"
H17_economy_75,both,['etnología'],['antropología'], la prehistoria y la etnología antropología,"que han adquirido otros nombres a consecuencia de la especialización, como la prehistoria y la etnología antropología. [5] Hay que observar en seguida dos lamentables consecuencias"
H17_economy_76,right,[None],['proposiciones'], las cosas proposiciones,"ello afecta a nuestra presente discusión, es indiferente que llamemos a las cosas proposicionesque se toman como dadas hipótesis, axiomas, postulados, supuestos"
H17_economy_77,right,[None],['proposiciones'], las cosas proposiciones,"axiomas, postulados, supuestos o incluso principios; [9] las cosas proposicionesque consideramos haber asentado mediante procedimientos admisibles se llaman teoremas. Como"
H17_economy_78,left,"['economía', 'pensamiento']",[None], un expediente para conseguir economía de pensamiento Denkökonomie,E. Mach según la cual toda ciencia (teórica) es un expediente para conseguir economía de pensamiento Denkökonomie. CAPÍTULO 4 LA SOCIOLOGÍA DE LA ECONOMÍA Ya nos hemos referido
H17_economy_79,left,"['ciencia', 'ciencias']",[None], la ciencia de las ciencias Wissenschaftslehre,"nos hemos referido a un departamento de la ciencia que hemos llamado la ciencia de las ciencias Wissenschaftslehre. Esta ciencia -que arranca de la lógica y también, en"
H17_economy_80,left,"['sociología', 'ciencia']",[None], la llamada sociología de la ciencia 4 Wissenisseziologie,"particulares. Pero hay una ciencia más acerca de la ciencia, la llamada sociología de la ciencia 4 Wissenisseziologie, [1] la cual estudia la ciencia como fenómeno social"
H17_economy_81,left,['alemán'],[None], el Diccionario alemán de Sociología Handwörterbuch der Soziologie,"Mannheim. El artículo de este último acerca de este tema en el Diccionario alemán de Sociología Handwörterbuch der Soziologiepuede servir como introducción "". & rsqb; [2]"
H17_economy_82,both,['clero'],['monjes'], El clero regular los monjes,"convertirse en un hombre-clave, configurador de ideas y de políticas. El clero regular los monjesy los frailes suministraban, por así decirlo, el estado mayor"
H17_economy_83,left,['escuelas'],[None], las escuelas doctores scholastici,solía llamar a los hombres de ciencia medievales escolásticos o maestros de las escuelas doctores scholastici. Para evitar la falsedad de las concepciones habituales el lector puede
H17_economy_84,none,[None],[None], Rubess Billuart et Aliorum Taurini,"Thomae Aquinatas, Doctoris Angelici, Summa Theologica, diligenter emendata de Rubess Billuart et Aliorum Taurini. Este clásico inacabado ha conseguido en el curso de los siglos"
H17_economy_85,none,[None],[None], El tratado francés de tratado Chevalier,"se apartó nunca mucho de los principios librecambistas. [6] El tratado francés de tratado Chevalierseñala una interrupción importante, aunque breve, de la política generalmente"
H17_economy_86,none,[None],[None], la conclusión de la Unión Aduanera Zollverein,queda un poco eclipsado por las maniobras y contramaniobras que precedieron a la conclusión de la Unión Aduanera Zollvereinde 1834 y por las concesiones hechas de vez en cuando a
H17_economy_87,both,['explicó'],"['rendimientos', 'capital', 'físico', 'capital físico']", Longfield explicó los beneficios rendimientos del capital físico,", no sólo en el del coste marginal. Esto es, Longfield explicó los beneficios rendimientos del capital físicoy los salarios sobre la base de las aportaciones al producto total"
H17_economy_88,left,"['adición', 'último', 'capital']",[None], la adición del último elemento de capital instrumentos,"sobre la base de las aportaciones al producto total que resultan de la adición del último elemento de capital instrumentoso trabajo al mecanismo productivo. Así parece, al menos,"
H17_economy_89,both,['más'],['sección'], la política que más nos interesan sección 4,"de intentar ver cómo se reflejó todo eso en los departamentos de la política que más nos interesan sección 4, hemos de echar un breve vistazo a lo que antes hemos"
H17_economy_90,both,['siglo'],"['valor', 'juicio de valor']", siglo este problema del Werturteil juicio de valor,tipo sobre los fenómenos que analizan. Durante la primera década del siglo este problema del Werturteil juicio de valorprovocó acaloradas discusiones que culminaron con la casi trifulca del congreso de
H17_economy_91,none,[None],[None], campaña por la desvinculación axiológica Wertfreiheit,", dentro del Verein mismo, los campeones más destacados de aquella campaña por la desvinculación axiológica Wertfreiheitfueron M. Weber y Sombart, 10 que pertenecían ambos al"
H17_economy_92,left,"['cátedra', 'socialistas de cátedra']",[None], socialistas de cátedra Kathedersozialisten,por la reforma social y cuyas cabezas fueron muy desafortunadamente bautizadas ' socialistas de cátedra Kathedersozialisten; y el grupo que fue llamado y se llamó a sí
H17_economy_93,both,"['escuela', 'histórica', 'escuela histórica']",['capítulo'], escuela histórica capítulo 4,"el grupo que fue llamado y se llamó a sí mismo ' escuela histórica capítulo 4. La cuestión muy debatida, de los juicios de valor del"
H17_economy_94,left,"['forma', 'más']",[None], forma más sencilla por HICKS Theory of Wages,"372, 504 y 512. El concepto, introducido en su forma más sencilla por HICKS Theory of Wagesy JOAN ROBINSON (Economics of Imperfect Competition, 1933),"
H17_economy_95,none,[None],[None], JOAN ROBINSON Economics of Imperfect Competition,"más sencilla por HICKS (Theory of Wages, 1932) y JOAN ROBINSON Economics of Imperfect Competition, fue eficazmente utilizado en seguida por ambos autores para la formulación"
H17_economy_96,right,[None],"['autor', 'comunicación del autor']", estudiante en la Universidad de Michigan comunicación del autor,"tesis de Ph. D. ya en 1921, cuando era estudiante en la Universidad de Michigan comunicación del autor. Pese a las influencias subconscientes que pudieran llegarle de su temprana"
H17_economy_97,both,"['concurrencia', 'corriente', 'época']","['autor', 'comunicación del autor']", la concurrencia corriente en la época comunicación del autor,mejor que lo que entonces creía Chamberlin que era la teoría de la concurrencia corriente en la época comunicación del autor. En este caso me ha parecido conveniente abandonar el principio de
H17_economy_98,none,[None],[None], momento Chamberlin incluido,"uso de ese práctico instrumento se le ocurriera a muchos en aquel momento Chamberlin incluido, especialmente a los que antes habían forcejeado con las curvas totales"
H17_economy_99,left,"['esquema', 'dinámico', 'esquema dinámico']",[None], un esquema dinámico explícito Samuelson,"de que ni siquiera la teoría estática se puede desarrollar plenamente sin un esquema dinámico explícito Samuelson, [3] ya antes registrado, es un primer paso"
H17_economy_100,left,['consumo'],[None], el consumo Ct,consumo corriente más la inversión corriente. Supóngase que postulamos arbitrariamente que el consumo Ctde un período (t) es igual a una proporción constante
H17_economy_101,left,['inversión'],[None], la inversión It,"de la renta del período (t-1), xxx y que la inversión Iten el período t equivale a una proporción constante xxx de la"
H17_economy_102,both,"['definiciones', 'agregados']",['ecuaciones'], las definiciones de agregados obviamente importantes ecuaciones definitorias,que acaso sea más adecuado llamarlas consideraciones de sentido común; contienen las definiciones de agregados obviamente importantes ecuaciones definitoriasen un sistema de ecuaciones casi siempre lineales y de coeficientes constantes
H17_economy_103,both,['agregados'],"['ecuaciones', 'equilibrio']", agregados ecuaciones de equilibrio,como las relaciones que el sentido común indica como vigentes entre dichos agregados ecuaciones de equilibrioy las relaciones que se supone describen el comportamiento de clases de
H17_economy_104,none,[None],[None], Roos Dynamic Economics,"Numerosos autores adoptan una posición intermedia, por ejemplo CHAFILES F. Roos Dynamic Economics. Repito también que mi insistencia en esta distinción no se debe"
H17_economy_105,left,"['producto', 'bruto', 'producto interior bruto']",[None], producto interior bruto PIB,"El déficit público se situó en el 6, 6 % del producto interior bruto PIBen 1996, bien lejos del límite del 3 % fijado en"
H17_economy_106,both,['caja'],"['ingresos', 'cobros']", criterios de caja ingresos y cobros sin periodificar,"de Economía. Es cierto, sin embargo, que atendiendo a criterios de caja ingresos y cobros sin periodificar, el déficit del Estado se disparó por diversos motivos, de"
H17_economy_107,both,['circunstancias'],['baja'], circunstancias atenuantes climatología baja de la construcción,1 % del mismo mes de 1996. Pese a las diversas circunstancias atenuantes climatología baja de la construcciónlo cierto es que las cifras no admiten paliativos y se recordaba
H17_economy_108,none,[None],[None], materia presupuestaria tributaria y financiera BOE,"12 / 1995 de 28 de diciembre, sobre medidas urgentes en materia presupuestaria tributaria y financiera BOE, que prorroga los Presupuestos Generales del Estado para 1995, en"
H17_economy_109,none,[None],[None], el tabaco y el alcohol BOE,"y regularizar anticipos de fondos y se incrementan los impuestos especiales sobre el tabaco y el alcohol BOE. Agosto: El banco central alemán, Bundesbank, baja el"
H17_economy_110,none,[None],[None], diciembre BOE,"leyes: la Ley Orgánica 3 / 1996, de 27 de diciembre BOE, que modifica la Ley Orgánica 8 / 1980, y la"
H17_economy_111,none,[None],[None], diciembre BOE,"1980, y la Ley 14 / 1996, de 30 de diciembre BOEde cesión de tributos del Estado a las CC. AA."
H17_economy_112,both,"['divisas', 'reservas centrales', 'centrales de divisas']",['febrero'], Saldo de reservas centrales de divisas febrero,la Caja de Ahorros y Pensiones de Barcelona. CALENDARIO marzo Tabla Saldo de reservas centrales de divisas febrero.. Contabilidad nacional trimestral (cuarto trimestre).. Índice
H17_economy_113,both,"['precios', 'consumo', 'precios de consumo']",['febrero'], Índice de precios de consumo febrero,).. Contabilidad nacional trimestral (cuarto trimestre).. Índice de precios de consumo febrero. Subasta decenal del Banco de España. Coyuntura comercio por menor
H17_economy_114,both,['comercio'],['enero'], Coyuntura comercio por menor enero,consumo (febrero). Subasta decenal del Banco de España. Coyuntura comercio por menor enero. Índice de producción industrial (enero). Subasta decenal del
H17_economy_115,both,"['producción', 'industrial', 'producción industrial']",['enero'], Índice de producción industrial enero,Banco de España. Coyuntura comercio por menor (enero). Índice de producción industrial enero. Subasta decenal del Banco de España. abril Tabla Encuesta de
H17_economy_116,left,"['activa', 'población activa']",[None], abril Tabla Encuesta de población activa diciembre,industrial (enero). Subasta decenal del Banco de España. abril Tabla Encuesta de población activa diciembre. Subasta decenal del Banco de España.. Índice de precios
H17_economy_117,both,"['precios', 'industriales', 'precios industriales']",['febrero'], Índice de precios industriales febrero,(diciembre). Subasta decenal del Banco de España.. Índice de precios industriales febrero.. Saldo de reservas centrales de divisas (marzo).
H17_economy_118,left,"['divisas', 'reservas centrales', 'centrales de divisas']",[None], reservas centrales de divisas marzo,. Índice de precios industriales (febrero).. Saldo de reservas centrales de divisas marzo. Encuesta de salarios (cuarto trimestre). Índice de precios
H17_economy_119,left,"['precios', 'consumo', 'precios de consumo']",[None], Índice de precios de consumo marzo,(marzo). Encuesta de salarios (cuarto trimestre). Índice de precios de consumo marzo. Coyuntura comercio por menor (febrero). Índice de producción
H17_economy_120,both,['comercio'],['febrero'], Coyuntura comercio por menor febrero,trimestre). Índice de precios de consumo (marzo). Coyuntura comercio por menor febrero. Índice de producción industrial (febrero). Encuesta de población
H17_economy_121,both,"['producción', 'industrial', 'producción industrial']",['febrero'], Índice de producción industrial febrero,(marzo). Coyuntura comercio por menor (febrero). Índice de producción industrial febrero. Encuesta de población activa (enero). COYUNTURA INTERNACIONAL Preocupación
H17_economy_122,both,"['activa', 'población activa']",['enero'], Encuesta de población activa enero,(febrero). Índice de producción industrial (febrero). Encuesta de población activa enero. COYUNTURA INTERNACIONAL Preocupación por los datos económicos alemanes Estados Unidos creció
H17_economy_123,left,"['relación', 'producto', 'bruto', 'producto interior bruto']",[None], relación al producto interior bruto PIB,"anterior, trece países han mejorado la ratio de déficit público con relación al producto interior bruto PIB, y sólo uno ha empeorado (Alemania). El país"
H17_economy_124,none,[None],[None], El país restante Luxemburgo,"PIB), y sólo uno ha empeorado (Alemania). El país restante Luxemburgo, continúa presentando superávit en sus cuentas públicas y es el único"
H17_economy_125,left,"['producto', 'bruto', 'producto interior bruto']",[None], el producto interior bruto PIB,"el Banco de España, en el último trimestre de 1996, el producto interior bruto PIBexperimentó un incremento interanual del 2, 5 %. El crecimiento"
H17_economy_126,none,[None],[None], la encuesta del Instituto Nacional de Estadística INE,", la mejora se circunscribió a los componentes no alimenticios. Según la encuesta del Instituto Nacional de Estadística INE, de octubre a diciembre, los índices de ventas de artículos"
H17_economy_127,left,['movimientos'],[None], los movimientos turísticos en fronteras FRONTUR,". Desde otra vertiente, los resultados de la estadística mensual de los movimientos turísticos en fronteras FRONTURhan ofrecido datos interesantes sobre las características básicas del turismo receptor."
H17_economy_128,right,[None],"['importe', 'activo']", Suspensiones de pago importe activo,Cifra de negocios. Resultados (sin dotaciones ni provisiones). Suspensiones de pago importe activo. Sociedades mercantiles constituidas. Crédito comercial. Consumo. Demanda de
H17_economy_129,right,[None],"['variación', 'anual', 'variación anual']", INDICADORES DE EMPLEO Porcentaje de variación anual,"17, 8 % obtenido para los mayores de 25 años. INDICADORES DE EMPLEO Porcentaje de variación anualTabla NOTA: Cifras correspondientes a la encuesta de población activa."
H17_economy_130,left,"['índice', 'precios', 'consumo', 'índice de precios', 'precios de consumo']",[None], El índice de precios de consumo IPC,"INE y elaboración propia. PRECIOS La inflación baja del 3 % El índice de precios de consumo IPCaumentó un 0, 3 % en enero, tres décimas por"
H17_economy_131,right,[None],"['mensuales', 'porcentaje']", TIPOS DE Interés Medias mensuales en porcentaje,"promedio diario en diciembre a 3, 8 billones en enero. TIPOS DE Interés Medias mensuales en porcentajeTabla NOTAS: - Cifras provisionales. - Día 24 para el"
H17_economy_132,right,[None],"['miles', 'pesetas']", LETRAS DEL TESORO Tabla Importe miles de millones de pesetas,contrasta con la caída registrada en el mes anterior. EMISIONES DE LETRAS DEL TESORO Tabla Importe miles de millones de pesetas. Tipo de interés (%). Nominal solicitado. Nominal
H17_economy_133,right,[None],"['inversión', 'inversión mobiliaria', 'fondos de inversión']", los inversores de los FIM fondos de inversión mobiliaria,"051 millones. Cabe señalar, asimismo, el mayor atractivo para los inversores de los FIM fondos de inversión mobiliariaque los FIAMM (fondos de inversión en activos del mercado monetario"
H17_economy_134,right,[None],['variación'], Depósitos BANCARIOS A EMPRESAS Y FAMILIAS Porcentajes de variación,en relación con el mismo mes del año precedente. Crédito Y Depósitos BANCARIOS A EMPRESAS Y FAMILIAS Porcentajes de variaciónNOTAS: Cifras provisionales. Incluyen saldos en pesetas y en moneda
H17_economy_135,right,[None],"['mensuales', 'porcentaje']", TIPOS DE Interés BANCARIOS Medias mensuales en porcentaje,serie desestacionalizada. FUENTES: Banco de España y elaboración propia. TIPOS DE Interés BANCARIOS Medias mensuales en porcentajeTabla NOTAS: Cifras provisionales. Tipos de referencia recomendados por el
H17_economy_136,left,"['crecimiento', 'producto', 'bruto', 'producto interior bruto']",[None], un crecimiento del producto interior bruto PIB,"del nivel de actividad, el ejercicio de 1996 se cerró con un crecimiento del producto interior bruto PIBdel 2, 3 %, según una primera estimación del Ministerio"
H17_economy_137,right,[None],['anuales'], EMPLEO ESTIMADO Medias anuales,"de Estadística, Ministerio de Economía y Hacienda y elaboración propia. EMPLEO ESTIMADO Medias anualesTabla Sectores de actividad. Total. % variación. Agricultura."
H17_economy_138,right,[None],"['anual', 'porcentaje']", TIPOS DE Interés Media anual en porcentaje,Tabla NOTA: Provisional. FUENTE: Instituto Nacional de Estadística. TIPOS DE Interés Media anual en porcentajeTabla NOTA: Emisiones en el mercado primario. FUENTE: Banco
H17_economy_139,right,[None],['pesetas'], COMERCIO EXTERIOR Miles de millones de pesetas,. Lira italiana. Ecu. FUENTE: Banco de España. COMERCIO EXTERIOR Miles de millones de pesetasTabla Importaciones. Exportaciones. Saldo comercial. NOTA: Provisional.
H17_economy_140,right,[None],['pesetas'], ENDEUDAMIENTO NETO DEL SECTOR PÚBLICO Miles de millones de pesetas,"la Administración del Estado, Banco de España y elaboración propia. ENDEUDAMIENTO NETO DEL SECTOR PÚBLICO Miles de millones de pesetasTabla NOTAS: El endeudamiento neto es igual a la deuda bruta"
H18_economy_1,none,[None],[None], la infraestructura económica necesaria en particular las telecomunicaciones,el ritmo de integración es la disponibilidad y el mantenimiento adecuado de la infraestructura económica necesaria en particular las telecomunicacionesy el transporte. Contar con un sistema de comunicaciones de alta
H18_economy_2,none,[None],[None], los obstáculos normativos sobre todo para las empresas,"suministro de incentivos de mercado en el sector privado, y eliminar los obstáculos normativos sobre todo para las empresasextranjeras. - Aumento de las actividades de investigación y desarrollo,"
H18_economy_3,left,"['activa', 'población activa']",[None], la población activa trabaja en la agricultura sobre todo en explotaciones,"varían extraordinariamente. En los países pobres, el 61 % de la población activa trabaja en la agricultura sobre todo en explotacionesagrícolas familiares; el 22 % trabaja en el sector rural no"
H18_economy_4,left,"['muchos', 'trabajadores']",[None], muchos trabajadores sobre todo en las explotaciones,"países receptores. La participación en el comercio internacional ha beneficiado a muchos trabajadores sobre todo en las explotacionesagrícolas, las fábricas y el sector de servicios de Asia."
H18_economy_5,both,"['propiedades', 'enteramente']",['función'], unas propiedades enteramente diferenciadas En particular la función,podría argumentar que el capital físico y el humano son bienes con unas propiedades enteramente diferenciadas En particular la funciónde producción de capital físico es distinta de la de capital humano
H18_economy_6,both,['industria'],['industria'], la industria en particular a la industria,"se permite a la teoría clásica extender sus conclusiones por analogía de la industria en particular a la industriaen conjunto, es completamente incapaz de contestar la pregunta relativa a"
H18_economy_7,both,"['dinero', 'atributos']",['artificio'], El dinero en sus atributos importantes es sobre todo un artificio,"de la distribución y no una teoría del dinero "" autónoma. El dinero en sus atributos importantes es sobre todo un artificiosutil para ligar el presente con el futuro; y no podemos"
H18_economy_8,both,"['factores', 'producción']",['trabajadores'], los factores de la producción y en particular los trabajadores,"unidades de costo. Este resultado es consecuencia del supuesto de que los factores de la producción y en particular los trabajadores, están dispuestos a resistirse a una reducción en sus remuneraciones monetarias"
H18_economy_9,both,['ideas'],['relación'], las ideas o contenidos mentales sobre todo en relación,"origen francés y significó al principio, simplemente, el análisis de las ideas o contenidos mentales sobre todo en relacióncon las teorías de Condillac. A veces se usó también,"
H18_economy_10,both,['autor'],['norteamericano'], el autor es sobre todo norteamericano,burocracias conservadoras. El uso de 'liberal 'a que alude el autor es sobre todo norteamericano. [3] Algunos de sus puntos son discutibles. Por
H18_economy_11,both,"['más', 'libro', 'aportaciones originales']",['capítulos'], las aportaciones originales más importantes del libro sobre todo en los capítulos,"problemas económicos aparecían bajo una nueva luz. En cualquier caso, las aportaciones originales más importantes del libro sobre todo en los capítulos4-7, referentes a la diferenciación del producto y a los costes"
H18_economy_12,both,"['factores', 'produjeron', 'macrodinámica']",['macrodinámica'], los factores que produjeron la macrodinámica y en particular la macrodinámica,"es una característica destacada de nuestro tiempo. El anterior análisis de los factores que produjeron la macrodinámica y en particular la macrodinámicaestadística, permite inferir que este desarrollo se habría producido aunque no"
H18_economy_13,both,"['tipos', 'oficiales', 'tipos oficiales']",['influencia'], el mantenimiento de tipos oficiales y sobre todo la influencia,"de incremento de tipos de interés. En la City londinense, el mantenimiento de tipos oficiales y sobre todo la influenciade la bolsa neoyorquina, más intensa que en el continente,"
H18_economy_14,left,"['comportamiento', 'expansivo', 'enero']",[None], un comportamiento expansivo en enero debido sobre todo al sector,"9 %. Los factores autónomos creadores de liquidez de base tuvieron un comportamiento expansivo en enero debido sobre todo al sectorexterior, de modo que disminuyeron las necesidades de liquidez del sistema"
H18_economy_15,left,"['auge', 'exportaciones']",[None], un auge importante de las exportaciones en particular gracias,"se manifestó también en el comercio de servicios, marcado también por un auge importante de las exportaciones en particular graciasal turismo, hasta el punto que el saldo de la rúbrica"
