id,presence,candidate_term_left,candidate_term_right,occurrence,full_context
H24_economy_54,none,[None],[None], nombrado Presidente,", 864 pesetas. Mayo: José M. Aznar es nombrado Presidentedel Gobierno de España. Junio: El BOE publica los Reales"
H25_economy_1,left,['escribir'],[None], escribir como xxx lo que constituye la función de demanda,", las condiciones de primer orden del bien xxx se pueden escribir como xxx lo que constituye la función de demandadel bien xxx. Según esta función, la demanda de xxx"
H26_economy_1,right,[None],['modelos'], el motivo por el que son denominados modelos,"una variable del modelo crezca de manera exógena. Éste es el motivo por el que son denominados modelosde crecimiento endógeno. A pesar de su simplicidad, es importante"
H27_economy_1,left,"['progreso', 'progreso tecnológico']",[None], El progreso tecnológico se presenta bajo la forma de un aumento,"es el enfoque que hemos escogido en nuestro modelo dinámico. El progreso tecnológico se presenta bajo la forma de un aumentoconstante del número de inputs, xxx. El hecho de que"
H28_economy_1,none,[None],[None], pasos que la que se ofreció en el capítulo,"el momento. Puesto que la demostración sigue exactamente los mismos pasos que la que se ofreció en el capítulo5, no la reproduciremos aquí. Sin embargo, y a"
H30_economy_1,left,"['tasa', 'crecimiento', 'tasa de crecimiento']",[None], país con su tasa de crecimiento es conocido como el efecto de escala,. El fenómeno que relaciona el tamaño o la escala del país con su tasa de crecimiento es conocido como el efecto de escalay es el principal motivo por el cual los modelos de crecimiento
H30_economy_2,left,"['tasa', 'crecimiento', 'tasa de crecimiento']",[None], tasa de crecimiento es conocida como la hipótesis de convergencia,"crecimiento. Esta relación inversa entre la renta inicial y su tasa de crecimiento es conocida como la hipótesis de convergencia. Esta hipótesis es interesante, puesto que es susceptible de ser"
H31_economy_1,right,[None],['función'], nombre de función,5] En el cap. 20 se designará con el nombre de funcióndel empleo a una que está íntimamente ligada con la anterior.
H31_economy_2,right,[None],['función'], nombre de función,"capítulo 20, en el que estudiaremos su recíproca con el nombre de funciónde ocupación. Pero, en general, lo que se ha"
H31_economy_3,right,[None],['fluctuaciones'], nombre de fluctuaciones,"en periodos cortos, como en el caso conocido con el nombre de fluctuacionescíclicas de la ocupación, durante las cuales los hábitos, a"
H32_economy_1,both,['puntos'],"['igual', 'valor']", puntos con igual valor,RENTA FIJA. Precios de Ejercicio. - Se expresarán en puntos con igual valorque la Prima. HORARIO DE NEGOCIACIÓN Será el mismo que el
H32_economy_2,both,['puntos'],"['igual', 'valor']", puntos con igual valor,RENTA FIJA. Precios de Ejercicio. - Se expresarán en puntos con igual valorque la Prima. HORARIO DE NEGOCIACIÓN Será el mismo que el
H32_economy_3,both,['puntos'],"['igual', 'valor']", puntos con igual valor,RENTA FIJA. Precios de Ejercicio. - Se expresarán en puntos con igual valorque la Prima. HORARIO DE NEGOCIACIÓN Será el mismo que el
H32_economy_4,both,['puntos'],"['igual', 'valor']", puntos con igual valor,RENTA FIJA. Precios de Ejercicio. - Se expresarán en puntos con igual valorque la Prima. HORARIO DE NEGOCIACIÓN Será el mismo que el
H32_economy_5,both,['función'],"['producción', 'tipo']", la función de producción es del tipo Douglas,"por xxx [4]. Consideraremos, adicionalmente, que la función de producción es del tipo Douglas: xxx siendo xxx el nivel de la tecnología. Desde una"
H32_economy_6,both,['función'],"['producción', 'tipo']", la función de producción Douglas es del tipo xxx,"adelante) promueven un crecimiento endógeno. En este modelo, la función de producción Douglas es del tipo xxxsiendo xxx el capital privado y xxx el stock de capital agregado"
H32_economy_7,both,['funciones'],"['producción', 'tipo']", funciones de producción del tipo Douglas,"resultado). Es importante destacar que cuando se parte de funciones de producción del tipo Douglas, los dos tipos de progreso técnico son completamente equivalentes, puesto"
H32_economy_8,both,['función'],"['producción', 'tipo']", una función de producción del tipo Douglas,"análisis de algunas de estas extensiones). Si se utiliza una función de producción del tipo Douglas, la producción agregada vendrá dada por xxx siendo xxx. Supondremos"
H32_economy_9,left,"['capital', 'físico', 'capital físico']",[None], capital físico como humano por ejemplo xxx,", que el sector educativo posee una tecnología que utiliza tanto capital físico como humano por ejemplo xxx, donde xxx y xxx son el capital físico y humano utilizados"
H32_economy_10,left,['crecimiento'],[None], calidad y crecimiento véase por ejemplo Aghion,"cual es el progreso tecnológico. Para modelos de escaleras de calidad y crecimiento véase por ejemplo Aghiony Howitt (1992), Grossman y Helpman (1991,"
H32_economy_11,both,"['unidades', 'trabajo', 'unidades de trabajo']","['igual', 'remuneración']", las unidades de trabajo de igual remuneración,"trabajo. Englobamos, por decirlo así, la no-homogeneidad de las unidades de trabajo de igual remuneracióndentro del equipo, que juzgamos cada vez menos adecuado para emplear"
H32_economy_12,both,"['individuo', 'ahorra']","['igual', 'cantidad']", un individuo ahorra aumenta en igual cantidad,"está en llegar a la justificable inferencia de que, cuando un individuo ahorra aumenta en igual cantidadla inversión global. Es verdad que cuando un individuo ahorra aumenta"
H32_economy_13,both,['capital'],['curva'], capital que es igual que la curva,"los principales entre los factores que determinan la eficiencia marginal del capital que es igual que la curvade demanda de inversión. Sin embargo, no hay mucho que"
H32_economy_14,both,['ideologías'],['racionalizaciones'], las ideologías al igual que las racionalizaciones,"imposible exagerar en la importancia que tiene el hecho de que las ideologías al igual que las racionalizacionesindividuales, no son mentiras. Y que los enunciados de hecho"
H32_economy_15,left,['autores'],[None], autores adoptan una posición intermedia por ejemplo CHAFILES,"Towards a Dynamic Economics, 1948) y Stigler. Numerosos autores adoptan una posición intermedia por ejemplo CHAFILESF. Roos (Dynamic Economics, 1934). Repito también"
H33_economy_1,both,"['productividad', 'mano', 'obra', 'mano de obra']",['sea'], la productividad de la mano de obra o sea la cuantía,en la remuneración se debe en gran medida a diferencias en la productividad de la mano de obra o sea la cuantíay el valor del aporte de los trabajadores a la producción.
H33_economy_2,none,[None],[None], el tiempo es decir la gente,"más o menos "" lisas "" o "" suaves "" en el tiempo es decir la genteprefiere consumir un poco cada día en lugar de morirse de hambre"
H33_economy_3,both,"['nivel', 'equilibrio', 'ocupación', 'nivel de equilibrio']",['nivel'], el nivel de equilibrio de la ocupación es decir el nivel,"lo que llamaremos la propensión a consumir de la comunidad, el nivel de equilibrio de la ocupación es decir el nivelque no induce a los empresarios en conjunto a ampliar o contraer"
H33_economy_4,both,"['ocupación', 'plena', 'ocupación plena']",['salario'], la ocupación plena es decir el salario,global. Este nivel no puede ser mayor que el de la ocupación plena es decir el salarioreal no puede ser menor que la desutilidad marginal del trabajo;
H33_economy_5,both,"['expectativa', 'demanda', 'mayor']",['aumento'], la expectativa de una demanda mayor es decir un aumento,"que usará cierto equipo de producción, y cuando afirmamos que la expectativa de una demanda mayor es decir un aumentode la función de demanda global, provocará otro en la producción"
H33_economy_6,both,"['tasa', 'inversión', 'tasa de inversión']",['curva'], la tasa de inversión es decir la curva,"del capital. Ni son dos factores separados, que afectan la tasa de inversión es decir la curvade la eficiencia marginal del capital y el estado de la confianza"
H33_economy_7,none,[None],[None], la confianza es decir la confianza,debemos tener también en cuenta la otra faceta del estado de la confianza es decir la confianzade las instituciones de crédito en aquellos que buscan préstamos en ellas
H33_economy_8,both,"['teoría', 'precios']","['sea', 'análisis']", la teoría de los precios o sea el análisis,"a medida que la ocupación crece. Es decir, que la teoría de los precios o sea el análisisde la relación entre los cambios en la cantidad de dinero y"
H33_economy_9,left,['general'],[None], un grupo general a saber el espíritu,los demás tienen en común algo que invita a reunirlos en un grupo general a saber el espíritudel análisis numérico. Todos ellos han sido económetras. Su obra
H33_economy_10,left,"['punto', 'más']",[None], el punto más difícil del programa a saber la supresión,"Peel realizó (en lo esencial) el librecambio, incluso el punto más difícil del programa a saber la supresióndel gravamen a la importación de cereales. Aunque su gabinete v"
H33_economy_11,right,[None],['esquema'], un ejemplo a saber el esquema,"sería tan fácil de manejar. [7] Citaremos sólo un ejemplo a saber el esquemadel propio profesor FRISCH, presentado en su potente artículo "" PropagationProblems"
H33_economy_12,left,"['curva', 'tipos', 'interés', 'curva de tipos', 'tipos de interés']",[None], la curva de tipos de interés es decir la estructura,"rebasando mínimos históricos. En la tercera semana de febrero, la curva de tipos de interés es decir la estructurade los rendimientos por plazos, presentaba la forma que se puede"
H33_economy_13,left,"['curva', 'tipos', 'interés', 'curva de tipos', 'tipos de interés']",[None], la curva de tipos de interés es decir la estructura,"sobre los niveles mínimos de enero. De esta manera, la curva de tipos de interés es decir la estructuraplazos-rendimientos, se ha aplanado en las últimas semanas aun manteniendo una"
H34_economy_1,both,['noventa'],['volumen'], principios de los noventa el volumen,"observados en cuatro indicadores desde principios de los años ochenta hasta principios de los noventa el volumenreal de comercio como proporción del PIB, la inversión extranjera directa"
H34_economy_2,left,"['ritmo', 'integración', 'ritmo de integración']",[None], rapidez en el ritmo de integración las políticas,"integración. Hay tres tipos de políticas que influyen con relativa rapidez en el ritmo de integración las políticasmacroeconómicas, las relativas a las telecomunicaciones y la infraestructura de transporte"
H34_economy_3,none,[None],[None], Obstáculos externos medidas,"comenzaron a dar impulso a ese aspecto de sus economías. Obstáculos externos medidasantidumping y el Acuerdo Multifibras Con todo, existen ciertos obstáculos externos"
H34_economy_4,left,"['utilidades', 'brutas', 'más']",[None], las utilidades brutas fue incluso más reveladora US,"kilos por hectárea en las plantaciones estatales. La diferencia en las utilidades brutas fue incluso más reveladora US$ 1. 196 por hectárea en las plantaciones privadas, y"
H34_economy_5,both,['resto'],['relación'], resto del mundo La relación,"de los países de la región volvió a sobrepasar el del resto del mundo La relacióncomercio - PIB continuó aumentando. Por primera vez, los aranceles"
H34_economy_6,both,['producto'],['aranceles'], el producto Los aranceles,"del comercio se corresponde con la mejora reciente que ha experimentado el producto Los arancelesmáximos se sitúan en el 45 %, incluso después de haber"
H34_economy_7,both,['años'],['aranceles'], años Los aranceles,"extraordinario de los índices de comercio registrado en los últimos diez años Los arancelesse redujeron al 15 %, frente al 30 % a fines"
H34_economy_8,both,['aumento'],['volumen'], el mundo y va en aumento El volumen,los países de la región es cercano al promedio de todo el mundo y va en aumento El volumende comercio como proporción del PIB sobrepasó levemente el de los países
H34_economy_9,both,['años'],['índices'], años Los índices,"período de estancamiento de su integración, que dura ya diez años Los índicesde comercio se han mantenido sin variaciones. Los aranceles apenas han"
H34_economy_10,both,['ingreso'],['obras'], garantía del ingreso las obras,programas de transferencias públicas pueden complementar las medidas no oficiales de garantía del ingreso las obraspúblicas constituyen por lo general el mejor método de transferencia para los
H34_economy_11,none,[None],[None], estrategias de desarrollo el abandono,uno o dos cambios fundamentales que han debido introducir en sus estrategias de desarrollo el abandonodel proteccionismo en pro de una mayor integración en los mercados internacionales
H34_economy_12,right,[None],['ingenieros'], empleos en cada país los ingenieros,"debe en parte a las diferencias de remuneración correspondientes a distintos empleos en cada país los ingenieros, por ejemplo, ganan más que los trabajadores no calificados de"
H34_economy_13,both,['más'],['relación'], la par de sus homólogos más prósperos la relación,cual los grupos de trabajadores más pobres comienzan a ponerse a la par de sus homólogos más prósperos la relaciónentre los salarios de los grupos más pobres y los más ricos
H34_economy_14,left,['ser'],[None], Cataluña pueden ser españoles o extranjeros Fondos,función del riesgo. Los fondos que comercializa la Caja de Cataluña pueden ser españoles o extranjeros Fondosde Inversión Españoles Fondos de Inversión Extranjeros Inversión a menos de 2
H34_economy_15,left,"['acuerdo', 'siguiente', 'fórmula']",[None], acuerdo con la siguiente fórmula Precio,por los Miembros que deban recibir la Deuda se calculará de acuerdo con la siguiente fórmula Preciode liquidación del Bono Nocional al cierre de la última sesión x
H34_economy_16,left,['bajo'],[None], España bajo el epígrafe de Operaciones,Boletín de la Central de Anotaciones en Cuenta del Banco de España bajo el epígrafe de Operacionesde Compraventa Simple al Contado entre Titulares. La Relación de Valores
H34_economy_17,left,"['acuerdo', 'siguiente', 'fórmula']",[None], acuerdo con la siguiente fórmula Precio,por los Miembros que deban recibir la Deuda se calculará de acuerdo con la siguiente fórmula Preciode liquidación del Bono nocional al cierre de la última sesión x
H34_economy_18,none,[None],[None], ESPECIFICACIONES TÉCNICAS Subyacente Cantidad,"establecerán mediante Circular, dentro de los términos del Reglamento. ESPECIFICACIONES TÉCNICAS Subyacente Cantidaden pesetas resultante de multiplicar un nominal de diez millones de pesetas"
H34_economy_19,right,[None],['meses'], Vencimientos Los meses,"cien y especificada hasta la centésima de uno por cien. Vencimientos Los mesesde marzo, junio, septiembre y diciembre, negociándose como mínimo"
H34_economy_20,both,"['día', 'negociación', 'día de negociación']",['día'], día de negociación El día,"septiembre y diciembre, negociándose como mínimo cuatro vencimientos. Último día de negociación El díay a la hora española en que, en el caso de"
H34_economy_21,both,['vencimiento'],['vencimiento'], Fecha de vencimiento El vencimiento,"por el orden definido, expresado en tanto por cien. Fecha de vencimiento El vencimientoserá coincidente con el último día de negociación. Fecha de liquidación"
H34_economy_22,left,['liquidación'],[None], Fecha de liquidación Los pagos,El vencimiento será coincidente con el último día de negociación. Fecha de liquidación Los pagosy los cobros correspondiente a la liquidación por diferencias al vencimiento tomarán
H34_economy_23,both,['precio'],['fluctuación'], Fluctuación mínima del precio La fluctuación,día hábil para MEFF RENTA FIJA siguiente al de vencimiento. Fluctuación mínima del precio La fluctuacióncorrespondiente a un movimiento en un sentido u otro de una centésima
H34_economy_24,none,[None],[None], ESPECIFICACIONES TÉCNICAS Subyacente Cantidad,"establecerán mediante Circular, dentro de los términos del Reglamento. ESPECIFICACIONES TÉCNICAS Subyacente Cantidaden pesetas resultante de multiplicar un nominal de diez millones de pesetas"
H34_economy_25,right,[None],['meses'], Vencimientos Los meses,"cien y especificada hasta la centésima de uno por cien. Vencimientos Los mesesde marzo, junio, septiembre y diciembre, negociándose como mínimo"
H34_economy_26,both,"['día', 'negociación', 'día de negociación']",['día'], día de negociación El día,"septiembre y diciembre, negociándose como mínimo cuatro vencimientos. Último día de negociación El díay a la hora española en que, en el caso de"
H34_economy_27,both,['vencimiento'],['vencimiento'], Fecha de vencimiento El vencimiento,"por el orden definido, expresado en tanto por cien. Fecha de vencimiento El vencimientoserá coincidente con el último día de negociación. Fecha de liquidación"
H34_economy_28,left,['liquidación'],[None], Fecha de liquidación Los pagos,El vencimiento será coincidente con el último día de negociación. Fecha de liquidación Los pagosy los cobros correspondiente a la liquidación por diferencias al vencimiento tomarán
H34_economy_29,both,['precio'],['fluctuación'], Fluctuación mínima del precio La fluctuación,día hábil para MEFF RENTA FIJA siguiente al de vencimiento. Fluctuación mínima del precio La fluctuacióncorrespondiente a un movimiento en un sentido u otro de una centésima
H34_economy_30,none,[None],[None], ESPECIFICACIONES TÉCNICAS Subyacente Cantidad,"establecerán mediante Circular, dentro de los términos del Reglamento. ESPECIFICACIONES TÉCNICAS Subyacente Cantidaden pesetas resultante de multiplicar un nominal de diez millones de pesetas"
H34_economy_31,right,[None],['meses'], Vencimientos Los meses,"cien y especificada hasta la centésima de uno por cien. Vencimientos Los mesesde marzo, junio, septiembre y diciembre, negociándose como mínimo"
H34_economy_32,both,"['día', 'negociación', 'día de negociación']",['día'], día de negociación El día,"septiembre y diciembre, negociándose como mínimo cuatro vencimientos. Último día de negociación El díay a la hora española en que, en el caso de"
H34_economy_33,both,['vencimiento'],['vencimiento'], Fecha de vencimiento El vencimiento,"por el orden definido, expresado en tanto por cien. Fecha de vencimiento El vencimientoserá coincidente con el último día de negociación. Fecha de liquidación"
H34_economy_34,left,['liquidación'],[None], Fecha de liquidación Los pagos,El vencimiento será coincidente con el último día de negociación. Fecha de liquidación Los pagosy los cobros correspondiente a la liquidación por diferencias al vencimiento tomarán
H34_economy_35,both,['precio'],['fluctuación'], Fluctuación mínima del precio La fluctuación,día hábil para MEFF RENTA FIJA siguiente al de vencimiento. Fluctuación mínima del precio La fluctuacióncorrespondiente a un movimiento en un sentido u otro de una centésima
H34_economy_36,left,"['siguiente', 'función']",[None], través de la siguiente función xxx,es capaz de transformar estos dos factores en producción final a través de la siguiente función xxxen la que por xxx entendemos la producción agregada. Para simplificar
H34_economy_37,left,"['producción', 'tipo']",[None], producción es del tipo Douglas xxx,"4]. Consideraremos, adicionalmente, que la función de producción es del tipo Douglas xxxsiendo xxx el nivel de la tecnología. Desde una perspectiva macroeconómica"
H34_economy_38,left,"['obtenemos', 'siguiente', 'relación']",[None], tiempo obtenemos la siguiente relación xxx,miembro son constantes. Si tomamos logaritmos y derivamos respecto del tiempo obtenemos la siguiente relación xxx. Esta expresión es una ecuación clave que requiere un cierto detenimiento
H34_economy_39,left,"['producción', 'efectos', 'desbordamiento', 'efectos desbordamiento']",[None], la producción los llamados efectos desbordamiento la decisión,. Este fenómeno puede explicarse mediante la existencia de externalidades en la producción los llamados efectos desbordamiento la decisiónde cada productor individual afecta positivamente a la producción de todos los
H34_economy_40,none,[None],[None], UNA TASA DE AHORRO CONSTANTE UNA EXPOSICIÓN,escala excluyen siempre el crecimiento de la población. MODELOS CON UNA TASA DE AHORRO CONSTANTE UNA EXPOSICIÓNGRÁFICA Es frecuente oír decir a los asesores económicos del Tercer Mundo
H34_economy_41,both,['neoclásico'],['modelo'], Crecimiento neoclásico el modelo,"análisis continuaremos suponiendo que la tasa de ahorro es constante. Crecimiento neoclásico el modelode Solow y Swan Para empezar, vamos a suponer que contamos"
H34_economy_42,left,"['diferencia', 'funciones']",[None], la diferencia entre dos funciones xxx,se nos indica que esta tasa de crecimiento viene dada por la diferencia entre dos funciones xxx. Se han representado estas dos funciones en el gráfico 2.
H34_economy_43,both,"['modelo', 'factores', 'producción', 'factores de producción']",['capital'], El modelo incluye tres factores de producción capital,"ellos bautizaron como un "" modelo de Solow ampliado "". El modelo incluye tres factores de producción capital, trabajo en el sentido convencional y capital humano (designado por"
H34_economy_44,left,['tecnología'],[None], una tecnología Douglas xxx,"sentido convencional y capital humano (designado por H) en una tecnología Douglas xxx. Mankiw, Romer y Weil supusieron, además, que tanto"
H34_economy_45,none,[None],[None], CRECIMIENTO NEOCLÁSICO EL MODELO,alrededor de xxx se obtiene (2. 2). CRECIMIENTO NEOCLÁSICO EL MODELODE RAMSEY EL modelo de las familias productoras Hasta este momento se
H34_economy_46,left,['expresión'],[None], expresión xxx,"rendimientos constantes de escala, [3] obtenemos la siguiente expresión xxx. El segundo miembro de (3. 3) está expresado"
H34_economy_47,left,"['caso', 'siguientes']",[None], caso son las siguientes xxx,"inversión). Las condiciones de primer orden, en este caso son las siguientes xxx. La ecuación (3. 10) dice que el valor"
H34_economy_48,left,"['crecimiento', 'consumo', 'crecimiento del consumo']",[None], el crecimiento del consumo xxx,"11), para llegar a la condición que debe cumplir el crecimiento del consumo xxx. La ecuación (3. 13) se denomina, en"
H34_economy_49,left,['forma'],[None], forma xxx,"Euler. Para interpretarla, es conveniente reescribirla de la siguiente forma xxx. El miembro de la izquierda recoge el beneficio o rendimiento que"
H34_economy_50,left,"['siguiente', 'modo']",[None], xxx puede expresarse del siguiente modo xxx,"de los agentes individuales. Si empleamos una tecnología Cobb-Douglas, xxx puede expresarse del siguiente modo xxx. La ecuación (3. 12) recoge la condición de"
H34_economy_51,both,['diferentes'],['economía'], contextos diferentes una economía,en mostrar cómo estas ecuaciones dinámicas son también aplicables en dos contextos diferentes una economíacon mercados competitivos y una economía dirigida por un planificador. EL
H34_economy_52,left,['forma'],[None], forma xxx,progreso técnico neutral de Hicks se pueden escribir de la siguiente forma xxxen la cual xxx es un índice del estado de la tecnología
H34_economy_53,left,['expresión'],[None], expresión xxx,"tecnología en el momento xxx, que evoluciona según la siguiente expresión xxx(es decir que xxx), y xxx sigue siendo una"
H34_economy_54,left,"['producción', 'siguiente', 'forma']",[None], producción debe tener la siguiente forma xxx,"1961) demostraron que esta condición implica que la función de producción debe tener la siguiente forma xxxen la cual xxx, de nuevo, es un índice de"
H34_economy_55,left,"['acumulación', 'siguiente', 'expresión']",[None], acumulación con la siguiente expresión xxx,"no se producen avances tecnológicos xxx, y una función de acumulación con la siguiente expresión xxx, en la cual se cumple que xxx, siendo xxx una"
H34_economy_56,left,"['utilidad', 'siguiente', 'forma']",[None], utilidad de la siguiente forma xxx,"de modo que xxx), podemos escribir la función de utilidad de la siguiente forma xxxy la restricción presupuestaria como xxx. Los individuos maximizan (4"
H34_economy_57,left,['caso'],[None], caso xxx,"que la función de utilidad esté acotada es, en este caso xxxa la par que la ecuación diferencial que describe el crecimiento del"
H34_economy_58,left,"['crecimiento', 'consumo', 'crecimiento del consumo']",[None], el crecimiento del consumo es xxx,": xxx a la par que la ecuación diferencial que describe el crecimiento del consumo es xxx. La condición de transversalidad requiere que xxx, siendo xxx el"
H34_economy_59,none,[None],[None], MODELOS CONVEXOS DE CRECIMIENTO ENDÓGENO EL MODELO,prociclicidad de los salarios reales y los tipos de interés. MODELOS CONVEXOS DE CRECIMIENTO ENDÓGENO EL MODELOAK El modelo de las familias productoras En este capítulo estudiaremos el
H34_economy_60,left,"['cápita', 'siguiente', 'forma']",[None], cápita de la siguiente forma xxx,"de acumulación de la economía puede expresarse, en términos per cápita de la siguiente forma xxx. La ecuación (5. 3) corresponde a la anterior"
H34_economy_61,left,['condiciones'],[None], Las condiciones de primer orden son xxx,"Para solucionar este problema, debemos construir el Hamiltoniano xxx. Las condiciones de primer orden son xxx. Tal como se hizo en el capítulo 2, se puede"
H34_economy_62,left,"['modo', 'siguiente', 'resultado']",[None], modo el siguiente resultado xxx,resultado en (5. 6). Obtenemos de este modo el siguiente resultado xxx. Obsérvese que (5. 8) indica que el consumo
