id,presence,candidate_term_left,candidate_term_right,occurrence,full_context
H1_economy_1,none,[None],[None], la falta de infraestructura apropiada puede ser un impedimento,", el elevado costo del transporte de las exportaciones demuestra que la falta de infraestructura apropiada puede ser un impedimentograve para la integración. Países de integración rápida y lenta Si"
H1_economy_2,both,"['índice', 'integración', 'índice de integración']",['promedio'], El índice de integración es el promedio,de los productos manufacturados en el total de las exportaciones. El índice de integración es el promediosimple de las variaciones de los cuatro indicadores en el período señalado
H1_economy_3,both,['aranceles'],['factor'], Los aranceles son un factor,varían en forma considerable en las distintas regiones en desarrollo. Los aranceles son un factorimportante porque cuando los niveles de protección son elevados el crecimiento puede
H1_economy_4,both,"['relación', 'integración', 'crecimiento']",['efecto'], la relación entre integración y crecimiento es el efecto,países de integración escasa y lenta. Un factor que explica la relación entre integración y crecimiento es el efectofavorable de un sistema de comercio más libre y de la inversión
H1_economy_5,right,[None],['factor'], La reforma de las políticas es un factor,del ambiente institucional y las políticas que adopten los gobiernos. La reforma de las políticas es un factorfundamental La importancia que reviste la reforma de las políticas queda de
H1_economy_6,left,"['inestabilidad', 'inestabilidad macroeconómica']",[None], la inestabilidad macroeconómica fue la causa,"el sector de exportaciones de la economía. Se estima que la inestabilidad macroeconómica fue la causade la disminución de hasta 0, 9 puntos porcentuales al año"
H1_economy_7,left,"['ritmo', 'integración', 'ritmo de integración']",[None], el ritmo de integración es la disponibilidad,"necesario. El segundo aspecto en materia de políticas que afecta el ritmo de integración es la disponibilidady el mantenimiento adecuado de la infraestructura económica necesaria, en particular"
H1_economy_8,right,[None],['fenómeno'], el regionalismo es un fenómeno,"e histórica que ayudará a determinar su éxito. Dado que el regionalismo es un fenómenobastante reciente y adopta múltiples formas, no admite conclusiones simples."
H1_economy_9,left,['gradual'],[None], la eliminación gradual del Acuerdo Multifibras serán los países,provenientes de países en desarrollo. Probablemente los principales beneficiarios de la eliminación gradual del Acuerdo Multifibras serán los paísesproductores más eficientes cuyas exportaciones a los mercados de los países industriales
H1_economy_10,left,"['dinamismo', 'inversión']",[None], el dinamismo de la inversión continuaron siendo los pilares,regionales Asia oriental Los extraordinarios resultados en materia de exportaciones y el dinamismo de la inversión continuaron siendo los pilaresdel acelerado crecimiento del producto en Asia oriental durante 1995. Por
H1_economy_11,none,[None],[None], los inmigrantes como Françoise son el blanco,"Hoa, que aceptan salarios más bajos, en tanto que los inmigrantes como Françoise son el blancodel resentimiento de Jean-Paul. Entretanto, Duong se esfuerza por ahorrar"
H1_economy_12,left,['trabajadores'],[None], la nutrición de los trabajadores son la clave,inversiones en la capacitación y el mejoramiento de la salud y la nutrición de los trabajadores son la claveno sólo del bienestar de la población activa sino también del buen
H1_economy_13,left,['economía'],[None], las mujeres en una economía dada puede ser reflejo,en el mercado de trabajo. El salario más bajo de las mujeres en una economía dada puede ser reflejode su menor productividad en el empleo. En los países en
H1_economy_14,left,['variables'],[None], las variables del primer miembro son constantes,". De este modo, podemos escribir xxx, donde todas las variables del primer miembro son constantes. Si tomamos logaritmos y derivamos respecto del tiempo obtenemos la siguiente"
H1_economy_15,right,[None],['fuente'], las actividades de I D son una fuente,"sido empleado en muchos trabajos por los economistas que creen que las actividades de I D son una fuenteimportante de crecimiento económico. En el capítulo 9, analizaremos un"
H1_economy_16,left,"['tasa', 'depreciación', 'tasa de depreciación']",[None], la tasa de depreciación es un determinante,"de esto, y como se podrá constatar más adelante, la tasa de depreciación es un determinanteimportante de la tasa de crecimiento de la economía, por lo"
H1_economy_17,right,[None],['familia'], el agente representativo es una familia,"A partir de Barro (1974), se supone que el agente representativo es una familiao un grupo de individuos vinculados unos con otros a través del"
H1_economy_18,none,[None],[None], los niños del presente serán los adultos,"aumentará las tasas de fertilidad en el futuro, puesto que los niños del presente serán los adultosque ganarán estos mayores salarios. Mayores salarios futuros, por lo"
H1_economy_19,both,['fertilidad'],['variables'], la emigración y la fertilidad son variables,donde se recogen ejemplos de modelos de crecimiento en los que la emigración y la fertilidad son variablesendógenas. Braun (1993) examina también modelos de migración y
H1_economy_20,both,"['estacionario', 'estado estacionario']",['supuesto'], el estado estacionario es el supuesto,. La razón intuitiva que explica la ausencia de crecimiento en el estado estacionario es el supuestode que los rendimientos del capital son decrecientes y se aproximan a
H1_economy_21,left,"['transición', 'modelo']",[None], la transición Un aspecto importante del modelo es la rapidez,a xxx. 2 Una medida cuantitativa de la duración de la transición Un aspecto importante del modelo es la rapidezcon la cual la economía alcanza el nuevo estado estacionario. Para
H1_economy_22,left,"['capital', 'físico', 'capital físico', 'participación del capital', 'participación del capital físico']",[None], la participación del capital físico es xxx,"que la velocidad de convergencia es igual a xxx. Si la participación del capital físico es xxxy la participación del capital humano xxx, la tasa relevante del"
H1_economy_23,both,"['utilidad', 'individuos']",['suma'], la utilidad de los individuos es la suma,"población. La expresión (3. 1) indica que la utilidad de los individuos es la suma(es decir, la integral) de sus funciones instantáneas de"
H1_economy_24,left,['modelo'],[None], los agentes del modelo son dinastías,"las herencias intergeneracionales. En este contexto, deberemos suponer que los agentes del modelo son dinastíaso familias, siendo el número de individuos pertenecientes a cada dinastía"
H1_economy_25,both,"['función', 'utilidad', 'función de utilidad']",['consumo'], el argumento de la función de utilidad es el consumo,"cero. Condiciones análogas se aplican al trabajo. Obsérvese que el argumento de la función de utilidad es el consumoper cápita (c minúscula), mientras que en la restricción"
H1_economy_26,both,"['propiedades', 'neoclásicas', 'propiedades neoclásicas']",['función'], las propiedades neoclásicas es la función,"y 2, una función de producción bastante sencilla que satisface las propiedades neoclásicas es la funciónCobb-Douglas xxx. Esta función puede reescribirse en términos per cápita del"
H1_economy_27,none,[None],[None], el consumidor es partidario,"comportan trayectorias de consumo poco lisas. Por lo tanto, el consumidor es partidariode intercambiar parte de su consumo futuro por consumo presente. Esto"
H1_economy_28,left,['término'],[None], El término de la derecha es el beneficio,", representa el beneficio de consumir ahora [5]. El término de la derecha es el beneficioo rendimiento neto obtenido del ahorro y, por tanto, de"
H1_economy_29,right,[None],['tipo'], Una pregunta a la que se enfrentaron fue el tipo,"los economistas neoclásicos introdujeron el crecimiento exógeno de la productividad. Una pregunta a la que se enfrentaron fue el tipode progreso técnico que se debía introducir. En la práctica,"
H1_economy_30,left,"['modelo', 'neoclásico', 'progreso', 'modelo neoclásico', 'progreso técnico']",[None], El modelo neoclásico con progreso técnico Es el momento,"que las cosechas más recientes de capital son más productivas. El modelo neoclásico con progreso técnico Es el momentode regresar al progreso técnico potenciador del trabajo, que expresamos en"
H1_economy_31,left,"['función', 'utilidad', 'función de utilidad']",[None], la función de utilidad es xxx,". En primer lugar, la tasa efectiva de descuento de la función de utilidad es xxx, en lugar de ser xxx. En segundo lugar, la"
H1_economy_32,left,"['tasa', 'depreciación', 'tasa efectiva']",[None], la tasa efectiva de depreciación es xxx,", en lugar de ser xxx. En segundo lugar, la tasa efectiva de depreciación es xxx, en lugar de xxx. Si dejamos de lado estas dos"
H1_economy_33,right,[None],['rendimiento'], El miembro de la derecha es el rendimiento,"futuro al presente para lograr así un consumo más liso. El miembro de la derecha es el rendimientode la inversión, que se reduce a la productividad marginal neta"
H1_economy_34,right,[None],['capital'], una oferta neta positiva es el capital,"economía cerrada sin gobierno, el único activo del que existe una oferta neta positiva es el capital, por lo cual, necesariamente xxx. Si sustituimos este resultado"
H1_economy_35,left,['producción'],[None], la producción agregada vendrá dada por xxx siendo xxx,"Si se utiliza una función de producción del tipo Cobb-Douglas, la producción agregada vendrá dada por xxx siendo xxx. Supondremos que cada individuo representa una parte muy reducida del tamaño"
H1_economy_36,none,[None],[None], EL Hamiltoniano será xxx,"consecuencia, se pueden aplicar las técnicas habituales de optimización. EL Hamiltoniano será xxxy las condiciones de primer orden que obtenemos son: xxx."
H1_economy_37,right,[None],['inversión'], la experiencia era la inversión,"productividad. También defendía que una buena medida del aumento de la experiencia era la inversión, debido a que "" cada máquina nueva que es producida y"
H1_economy_38,both,['índice'],['inversión'], un índice de experiencia es la inversión,"estímulos "" (p. 157). Esto implica que un índice de experiencia es la inversiónacumulada o, lo que es lo mismo, el stock de"
H1_economy_39,both,"['número', 'economía']",['número'], el número de empresas de la economía sea un número,"en un modelo AK de crecimiento endógeno. Supongamos ahora que el número de empresas de la economía sea un númeromuy elevado xxx, constante. Puesto que xxx es grande,"
H1_economy_40,left,"['unidad', 'escala']",[None], la unidad de escala relevante sería el área,"personajes de sangre azul. De acuerdo con el modelo, la unidad de escala relevante sería el áreaen la cual un determinado tipo de conocimiento se desborda. Es"
H1_economy_41,both,"['efectos', 'escala', 'efectos de escala']",['supuesto'], los efectos de escala es el supuesto,"vez mayor. Técnicamente, la razón que está detrás de los efectos de escala es el supuestode que la externalidad depende del volumen agregado de capital. Una"
H1_economy_42,both,"['capital', 'físico', 'capital físico']",['bienes'], el capital físico y el humano eran bienes,"implícitos en nuestro argumento se apoyaba en el hecho de que el capital físico y el humano eran bienessimilares, en el sentido de que ambos podían ser acumulados a"
H1_economy_43,both,"['capital', 'físico', 'capital físico']",['bienes'], el capital físico y el humano son bienes,"la misma tecnología. Sin embargo, se podría argumentar que el capital físico y el humano son bienescon unas propiedades enteramente diferenciadas. En particular, la función de"
H1_economy_44,both,"['factores', 'producción', 'factores de producción']",['capital'], los factores de producción son el capital,") parte de una función de producción Cobb-Douglas en la que los factores de producción son el capitalfísico y el humano, de modo que la producción viene dada"
H1_economy_45,left,"['tasas', 'crecimiento', 'tasas de crecimiento']",[None], las tasas de crecimiento son xxx,". Vemos que, en ausencia de externalidades, xxx, las tasas de crecimiento son xxx. Es interesante observar que esta expresión es similar a la tasa"
H1_economy_46,left,['crecimiento'],[None], el crecimiento es xxx,La única diferencia es que el parámetro de productividad relevante para el crecimiento es xxx(la productividad del sector educativo) en lugar de xxx (
H1_economy_47,left,['más'],[None], los descubrimientos más interesantes es la aparición,"estado estacionario. AL margen de este hecho, uno de los descubrimientos más interesantes es la apariciónde un comportamiento asimétrico entre xxx y xxx: la tasa de"
H1_economy_48,both,['modelos'],['existencia'], El elemento común de todos esos modelos es la existencia,relaciona con la tasa agregada de crecimiento de la economía. El elemento común de todos esos modelos es la existenciade empresas dedicadas a la investigación y el desarrollo (I +
H1_economy_49,both,['resultado'],['progreso'], el resultado de la cual es el progreso,"Se entabla pues una guerra tecnológica entre líderes y seguidores, el resultado de la cual es el progresotecnológico. Para modelos de escaleras de calidad y crecimiento, véase"
H1_economy_50,both,['parámetro'],['trabajo'], un parámetro tecnológico y xxx es el trabajo,"xxx siendo xxx los bienes intermedios de capital, xxx es un parámetro tecnológico y xxx es el trabajo. En otras palabras, la producción se obtiene a partir de"
H1_economy_51,both,['bien'],['número'], el bien que se acumula es el número,"no es más que un modelo xxx, en el cual el bien que se acumula es el númerode bienes de capital xxx). Las empresas contratan el trabajo"
H1_economy_52,left,['precio'],[None], el precio de tales activos es un margen,"ecuación (9. 11) indica, pues, que el precio de tales activos es un margenconstante sobre el coste marginal, siendo el margen una función de"
H1_economy_53,both,['tecnología'],['bien'], El motivo es que la tecnología es un bien,"en el capítulo 7, presenta un efecto de escala. El motivo es que la tecnología es un bienno rival: el coste de desarrollar un nuevo producto es independiente"
H1_economy_54,none,[None],[None], los costes de I D son constantes,"las dos fuerzas opuestas sean del mismo tamaño, tendremos que los costes de I D son constantestal y como ocurre con nuestro modelo, lo que permite generar"
H1_economy_55,none,[None],[None], la Economía Política es una investigación,"9 de octubre de 1820: "" Ud. supone que la Economía Política es una investigaciónde la naturaleza y causas de la riqueza -y yo estimo que"
H1_economy_56,both,"['costo', 'uso', 'costo de uso']",['ganancia'], el costo de uso es la ganancia,"la producción resultante sobre la suma del costo de factores y el costo de uso es la ganancia, o, como lo llamaremos, el ingreso del empresario."
H1_economy_57,left,"['costo', 'factores']",[None], el costo de los otros factores son constantes,"oportunidad. En este resumen supondremos que el salario nominal y el costo de los otros factores son constantespor unidad de trabajo empleado; pero esta simplificación, de la"
H1_economy_58,left,"['salarios', 'nominales', 'salarios nominales']",[None], los salarios nominales son constantes,"cambios en D son compatibles con nuestro supuesto provisional de que los salarios nominales son constantes. Por esta razón será necesario, para realizar una exposición más"
H1_economy_59,both,['casos'],['suposición'], la mayoría de los casos es la suposición,"a su eficacia en el empleo específico real (que en la mayoría de los casos es la suposiciónrealista que debe hacerse), la eficacia descendente del trabajo empleado"
H1_economy_60,left,"['descendente', 'trabajo']",[None], la eficacia descendente del trabajo empleado es un ejemplo,"los casos es la suposición realista que debe hacerse), la eficacia descendente del trabajo empleado es un ejemplosobresaliente del alza del precio de oferta, cuando crece la producción"
H1_economy_61,left,"['inversión', 'ahorro']",[None], la inversión sobre el ahorro era la fuerza,1] Dije allí que el cambio en el excedente de la inversión sobre el ahorro era la fuerzamotora que regia las modificaciones en el volumen de la producción.
H1_economy_62,both,"['excedente', 'ahorro']",['fenómeno'], un excedente forzado de ahorro sería un fenómeno,"plazo "". Esta definición tendría sentido, pero significaría que un excedente forzado de ahorro sería un fenómenomuy raro e inestable, y una deficiencia forzada de ahorro el"
H1_economy_63,none,[None],[None], el momento en que esto es una concomitancia,alza de la unidad de salarios en términos monetarios (desde el momento en que esto es una concomitanciafrecuente de la mejoría en la ocupación); y estas tendencias
H1_economy_64,both,"['tasa', 'interés', 'tasa de interés']",['factor'], la tasa de interés era el factor,"de interés, que se basó en la idea de que la tasa de interés era el factorque ponía en equilibrio la oferta y la demanda de ahorros,"
H1_economy_65,both,"['propensión', 'consumir']",['función'], la propensión a consumir es una función,"la función de demanda global. Admitido, pues, que la propensión a consumir es una funciónbastante estable, de tal manera que, por lo general,"
H1_economy_66,both,['ocupación'],['función'], la ocupación es función,"la importancia del hecho ya mencionado antes de que, mientras la ocupación es funcióndel consumo y la inversión previstos, el consumo es, ceteris"
H1_economy_67,left,"['aumento', 'riqueza', 'aumento de riqueza']",[None], el aumento de riqueza ha sido motivo,"de paso, que el efecto de la política fiscal sobre el aumento de riqueza ha sido motivode importante confusión, que, sin embargo no podemos examinar adecuadamente"
H1_economy_68,both,"['valor', 'inversiones']",['consecuencia'], el valor de las inversiones fueran consecuencia,y procederemos en las secciones siguientes como si los cambios en el valor de las inversiones fueran consecuenciasolamente de cambios de la expectativa de sus rendimientos probables y de
H1_economy_69,right,[None],['propiedad'], las empresas eran propiedad,"gobierna el mercado. En otros tiempos, cuando casi todas las empresas eran propiedadde los empresarios o de sus amigos y asociados, la inversión"
H1_economy_70,none,[None],[None], un juego que era una mezcla,"esperanzas que indujeron a invertir. Los hombres de negocios jugaban un juego que era una mezclade habilidad y suerte, cuyo resultado medio para los jugadores es"
H1_economy_71,left,['doctrina'],[None], la doctrina según la cual es una virtud,", es más antisocial que el fetiche de la liquidez, la doctrina según la cual es una virtudpositiva de las instituciones de inversión concentrar sus recursos en la posesión"
H1_economy_72,left,"['promedio', 'opinión promedio']",[None], la opinión promedio espera que sea la opinión,"grado en el que dedicamos nuestra inteligencia a anticipar lo que la opinión promedio espera que sea la opiniónpromedio. Y existen algunos, según creo, que practican los"
H1_economy_73,left,"['media', 'opinión media']",[None], la opinión media cree que será la opinión,los norteamericanos son capaces de interesarse demasiado por descubrir lo que la opinión media cree que será la opiniónmedia; y esta debilidad nacional encuentra su Némesis en el mercado
H1_economy_74,right,[None],['ventaja'], LOS SALARIOS NOMINALES Habría sido una ventaja,los mercados de artículos distintos a los valores. MODIFICACIONES EN LOS SALARIOS NOMINALES Habría sido una ventajahaber podido examinar los efectos de un cambio en los salarios nominales
H1_economy_75,both,"['baja', 'salarios', 'nominales', 'salarios nominales']",['reducción'], la baja de los salarios nominales es una reducción,"2 Si nos referimos a un sistema no cerrado, y la baja de los salarios nominales es una reducciónrelativamente a los salarios nominales en el exterior cuando ambos se convierten"
H1_economy_76,both,"['baja', 'salarios', 'nominales', 'salarios nominales']",['reducción'], la baja de los salarios nominales sea una reducción,"de la propensión a consumir. 4 Si se espera que la baja de los salarios nominales sea una reducciónrelativamente a los salarios nominales en el futuro, el cambio será"
H1_economy_77,none,[None],[None], un decreto administrativo y es una política,fortalecer la demanda efectiva; pero esto sólo podría lograrse por un decreto administrativo y es una políticapoco práctica en un sistema de libre contratación del trabajo. Por
H1_economy_78,both,"['cantidad', 'dinero', 'excedente', 'cantidad de dinero']",['proporción'], la cantidad de dinero excedente es una proporción,"sobre los precios. Entrarán en juego las tendencias opuestas si la cantidad de dinero excedente es una proporciónanormalmente baja del ingreso nacional. Así, el efecto neto de"
H1_economy_79,both,"['mercado', 'valores', 'alza', 'mercado de valores']",['condición'], un mercado de valores al alza puede ser condición,"accionista "" como el de Estados Unidos en la actualidad, un mercado de valores al alza puede ser condicióncasi esencial de una propensión a consumir satisfactoria; y esta circunstancia"
H1_economy_80,both,['sobreinversión'],['característica'], la sobreinversión es la característica,"de acuerdo con el punto de vista de quienes sostienen que la sobreinversión es la característicadel auge, que el único remedio posible para la siguiente depresión"
H1_economy_81,both,"['sobreinversión', 'sentido']",['característica'], la sobreinversión en este sentido fuera una característica,"puro desperdicio de recursos. [4] Además, aunque la sobreinversión en este sentido fuera una característicanormal del auge, el remedio no estaría en imponer de súbito"
H1_economy_82,left,['auge'],[None], El auge es una situación,"dura, impide que esta tasa sea un obstáculo real. El auge es una situacióntal que el exceso de optimismo triunfa sobre una tasa de interés"
H1_economy_83,both,"['alza', 'precios']",['subproducto'], el alza de los precios sólo es un subproducto,"mayor producción lo que provoca el incremento del ahorro; y el alza de los precios sólo es un subproductodel aumento de productos, que igual ocurrirá, si no hay"
H1_economy_84,right,[None],['viejo'], la paz que lo ha sido el viejo,he dicho que el nuevo sistema podría ser más favorable a la paz que lo ha sido el viejo. Vale la pena repetir y subrayar ese aspecto. La guerra
H1_economy_85,both,['historia'],['fuente'], la historia es una fuente,"lamentables consecuencias de la anterior argumentación. Primera: puesto que la historia es una fuenteimportante -aunque no la única- del material del economista, y puesto"
H1_economy_86,both,"['economista', 'mismo']",['producto'], el economista mismo es un producto,"del material del economista, y puesto que, además, el economista mismo es un productode su propia época y de todo el tiempo anterior, el"
H1_economy_87,left,"['historia', 'historia económica']",[None], la historia económica es una parte,": hemos de registrar resueltamente el hecho de que, como la historia económica es una partede la economía, las técnicas del historiador son como pasajeros en"
H1_economy_88,left,"['métodos', 'estadísticos', 'métodos estadísticos']",[None], los métodos estadísticos son parte,"programa. Pero reconoceremos, en principio al menos, que los métodos estadísticos son partede los instrumentos del análisis económico, aunque no hayan sido construidos"
H1_economy_89,left,"['punto', 'estrictamente']",[None], un punto de vista estrictamente lógico son creaciones,"teniendo en cuenta las observaciones hechas, sin embargo, desde un punto de vista estrictamente lógico son creacioneslibres del análisis. [10] Difieren de las hipótesis de"
H1_economy_90,both,"['teoría', 'teoría económica']",['caja'], la teoría económica es una caja,". Según la frase insuperablemente acertada de la señora Robinson, la teoría económica es una cajade herramientas. La justificación de este concepto de la teoría económica"
H1_economy_91,none,[None],[None], el primero en verlas fue Léon,"para darse cuenta de todas sus posibilidades; en realidad, el primero en verlas fue LéonWalras (cfr. infra, Parte IV, cap. 6"
H1_economy_92,left,"['clase', 'teoremas', 'económicos', 'clase de teoremas económicos']",[None], una clase de teoremas económicos que son normas,"vez de acuerdo con ella. Eso quiere decir que existe una clase de teoremas económicos que son normaso ideales lógicos (no, desde luego, éticos ni políticos"
H1_economy_93,left,['ciencia'],[None], la medida en la cual la ciencia es un tema,adecuada para comunicar al lector las razones por las cuales y la medida en la cual la ciencia es un temaapropiado para la investigación sociológica. Desde luego que nuestro interés por
H1_economy_94,none,[None],[None], La muchacha amada es un ángel,"un partido que no sea el nuestro será un charlatán. La muchacha amada es un ángel, excepto por lo que hace a la fragilidad humana. El"
H1_economy_95,none,[None],[None], El país enemigo es el antro,", excepto por lo que hace a la fragilidad humana. El país enemigo es el antrode los monstruos, mientras que el nuestro es hogar de héroes"
H1_economy_96,left,"['ideologías', 'capitalista']",[None], las ideologías de la sociedad capitalista son glorificaciones,"exclusivamente como económicos. Según Marx -y por decirlo simplificadamente-, las ideologías de la sociedad capitalista son glorificacionesde lo que él llamó clase capitalista, cuyos intereses se basarían"
