Reference,LeftContext,Pivot,RightContext
1_e00079-plain,técnicas del historiador son como pasajeros en el gran autobús que,llamamos_VLfin_llamar análisis_NC_análisis,económico. El conocimiento de segunda mano es siempre insatisfactorio; por
1_e00079-plain,(proposiciones) que consideramos haber asentado mediante procedimientos admisibles se,llaman_VLfin_llamar teoremas_NC_teorema,". Como es natural, una proposición puede aparecer en una argumentación"
1_e00079-plain,nos hemos referido a un departamento de la ciencia que hemos,llamado_VLadj_llamar la_ART_el ciencia_NC_ciencia,de las ciencias (Wissenschaftslehre). Esta ciencia -que arranca de
1_e00079-plain,han familiarizado con un hábito de nuestra inteligencia al que se,llama_VLfin_llamar racionalización_NC_racionalización,. [3] Este hábito consiste en consolarnos e impresionar a
1_e00079-plain,observador situado en otro tiempo y en otra clase. Marx,llamó_VLfin_llamar ideologías_NC_ideología,[5] a esos sistemas de ideas. La tesis de
1_e00079-plain,ideologías de la sociedad capitalista son glorificaciones de lo que él,llamó_VLfin_llamar clase_NC_clase,"capitalista, cuyos intereses se basarían en la caza de beneficios pecuniarios"
1_e00079-plain,para obligar a los intelectuales clérigos a exponer y defender o,representar_VLinf_representar como_CSUBX_como cosa_NC_cosa,inmutable un orden temporal de las cosas. La Iglesia era juez
1_e00079-plain,"tanto, no tenía nada que ver con lo que hoy",llamamos_VLfin_llamar método_NC_método,estadístico. Pero la finalidad de esa información sí que era prácticamente
1_e00079-plain,"y tendencias de política económica, lo que me dispongo a",llamar_VLinf_llamar liberalismo_NC_liberalismo,económico. La afirmación puede sorprender. Pero la causa de esa
1_e00079-plain,en una época en la cual lo único que podía ya,llamar_VLinf_llamar la_ART_el atención_NC_atención,del lector era precisamente su insuficiencia. El primer volumen de su
1_e00079-plain,"valga mucho la pena en sí misma, sino porque ha",llamado_VLadj_llamar la_ART_el atención_NC_atención,mas de lo que merece: se trata de la célebre fórmula
1_e00079-plain,hemos de echar un breve vistazo a lo que antes hemos,llamado_VLadj_llamar fuerzas_NC_fuerza,hostiles al laissez-faire burgués las cuales cobraban impulso durante este período.
1_e00079-plain,uno de ellos se hace perfectamente elástica: el caso corrientemente,llamado_VLadj_llamar competición_NC_competición,"perfecta (op. cit., pág. 5)."
1_e00079-plain,"de industria (pequeña) individual, a la que se",refiere_VLfin_referir la_ART_el mayoría_NC_mayoría,"de sus diagramas, el haber despreciado la economía de la empresa"
1_e00079-plain,"teóricas y muy simples, tanto que acaso sea más adecuado",llamarlas_VCLIinf_llamar consideraciones_NC_consideración,de sentido común; contienen las definiciones de agregados obviamente importantes (
1_e00079-plain,se habría producido aunque no existieran esas peculiares fluctuaciones que generalmente,llamamos_VLfin_llamar ciclos_NC_ciclo,económicos. De lo antes dicho en esta parte y en la
1_e00079-plain,. Aún más útil como resumen de lo que ahora podríamos,llamar_VLinf_llamar el_ART_el trabajo_NC_trabajo,"más reciente en el campo de la dinámica es su artículo """
1_e00091-plain,", 864 pesetas. Mayo: José M. Aznar es",nombrado_VLadj_nombrar Presidente_NC_presidente,del Gobierno de España. Junio: El BOE publica los Reales
1_e00051-plain,", las condiciones de primer orden del bien xxx se pueden",escribir_VLinf_escribir como_CSUBX_como xxx_NP_xxx lo_PPC_él que_CQUE_que constituye_VLfin_constituir la_ART_el función_NC_función de_PREP_de demanda_NC_demanda,"del bien xxx. Según esta función, la demanda de xxx"
1_e00051-plain,una variable del modelo crezca de manera exógena. Éste es,el_ART_el motivo_NC_motivo por_PREP_por el_ART_el que_CQUE_que son_VSfin_ser denominados_VLadj_denominar modelos_NC_modelo,"de crecimiento endógeno. A pesar de su simplicidad, es importante"
1_e00051-plain,es el enfoque que hemos escogido en nuestro modelo dinámico.,El_ART_el progreso_NC_progreso tecnológico_ADJ_tecnológico se_SE_se presenta_VLfin_presentar bajo_PREP_bajo la_ART_el forma_NC_forma de_PREP_de un_ART_un aumento_NC_aumento,"constante del número de inputs, xxx. El hecho de que"
1_e00051-plain,el momento. Puesto que la demostración sigue exactamente los mismos,pasos_NC_paso que_CQUE_que la_ART_el que_CQUE_que se_SE_se ofreció_VLfin_ofrecer en_PREP_en el_ART_el capítulo_NC_capítulo,"5, no la reproduciremos aquí. Sin embargo, y a"
1_e00051-plain,. El fenómeno que relaciona el tamaño o la escala del,país_NC_país con_PREP_con su_PPO_suyo tasa_NC_tasa de_PREP_de crecimiento_NC_crecimiento es_VSfin_ser conocido_VLadj_conocer como_CSUBX_como el_ART_el efecto_NC_efecto de_PREP_de escala_NC_escala,y es el principal motivo por el cual los modelos de crecimiento
1_e00051-plain,crecimiento. Esta relación inversa entre la renta inicial y su,tasa_NC_tasa de_PREP_de crecimiento_NC_crecimiento es_VSfin_ser conocida_VLadj_conocer como_CSUBX_como la_ART_el hipótesis_NC_hipótesis de_PREP_de convergencia_NC_convergencia,". Esta hipótesis es interesante, puesto que es susceptible de ser"
1_e00053-plain,5] En el cap. 20 se designará con el,nombre_NC_nombre de_PREP_de función_NC_función,del empleo a una que está íntimamente ligada con la anterior.
1_e00053-plain,"capítulo 20, en el que estudiaremos su recíproca con el",nombre_NC_nombre de_PREP_de función_NC_función,"de ocupación. Pero, en general, lo que se ha"
1_e00053-plain,"en periodos cortos, como en el caso conocido con el",nombre_NC_nombre de_PREP_de fluctuaciones_NC_fluctuación,"cíclicas de la ocupación, durante las cuales los hábitos, a"
1_e00032-plain,RENTA FIJA. Precios de Ejercicio. - Se expresarán en,"puntos_NC_punto,_CM_, con_PREP_con igual_ADJ_igual valor_NC_valor",que la Prima. HORARIO DE NEGOCIACIÓN Será el mismo que el
1_e00032-plain,RENTA FIJA. Precios de Ejercicio. - Se expresarán en,"puntos_NC_punto,_CM_, con_PREP_con igual_ADJ_igual valor_NC_valor",que la Prima. HORARIO DE NEGOCIACIÓN Será el mismo que el
1_e00032-plain,RENTA FIJA. Precios de Ejercicio. - Se expresarán en,"puntos_NC_punto,_CM_, con_PREP_con igual_ADJ_igual valor_NC_valor",que la Prima. HORARIO DE NEGOCIACIÓN Será el mismo que el
1_e00032-plain,RENTA FIJA. Precios de Ejercicio. - Se expresarán en,"puntos_NC_punto,_CM_, con_PREP_con igual_ADJ_igual valor_NC_valor",que la Prima. HORARIO DE NEGOCIACIÓN Será el mismo que el
1_e00051-plain,"por xxx [4]. Consideraremos, adicionalmente, que",la_ART_el función_NC_función de_PREP_de producción_NC_producción es_VSfin_ser del_PDEL_del tipo_NC_tipo Cobb-Douglas_NP_Cobb-Douglas,: xxx siendo xxx el nivel de la tecnología. Desde una
1_e00051-plain,"adelante) promueven un crecimiento endógeno. En este modelo,",la_ART_el función_NC_función de_PREP_de producción_NC_producción Cobb-Douglas_NP_Cobb-Douglas es_VSfin_ser del_PDEL_del tipo_NC_tipo xxx_NP_xxx,siendo xxx el capital privado y xxx el stock de capital agregado
1_e00051-plain,resultado). Es importante destacar que cuando se parte de,funciones_NC_función de_PREP_de producción_NC_producción del_PDEL_del tipo_NC_tipo Cobb-Douglas_NP_Cobb-Douglas,", los dos tipos de progreso técnico son completamente equivalentes, puesto"
1_e00051-plain,análisis de algunas de estas extensiones). Si se utiliza,una_ART_un función_NC_función de_PREP_de producción_NC_producción del_PDEL_del tipo_NC_tipo Cobb-Douglas_NP_Cobb-Douglas,", la producción agregada vendrá dada por xxx siendo xxx. Supondremos"
1_e00051-plain,", que el sector educativo posee una tecnología que utiliza tanto","capital_NC_capital físico_ADJ_físico como_ADV_como humano_ADJ_humano,_CM_, por_PREP_por ejemplo_NC_ejemplo xxx_NP_xxx",", donde xxx y xxx son el capital físico y humano utilizados"
1_e00051-plain,cual es el progreso tecnológico. Para modelos de escaleras de,"calidad_NC_calidad y_CC_y crecimiento_NC_crecimiento,_CM_, véase_VCLIfin_verse por_PREP_por ejemplo_NC_ejemplo Aghion_NP_Aghion","y Howitt (1992), Grossman y Helpman (1991,"
1_e00053-plain,"trabajo. Englobamos, por decirlo así, la no-homogeneidad de",las_ART_el unidades_NC_unidad de_PREP_de trabajo_NC_trabajo de_PREP_de igual_ADJ_igual remuneración_NC_remuneración,"dentro del equipo, que juzgamos cada vez menos adecuado para emplear"
1_e00053-plain,"está en llegar a la justificable inferencia de que, cuando","un_ART_un individuo_NC_individuo ahorra_VLfin_ahorrar,_CM_, aumenta_VLfin_aumentar en_PREP_en igual_ADJ_igual cantidad_NC_cantidad",la inversión global. Es verdad que cuando un individuo ahorra aumenta
1_e00053-plain,los principales entre los factores que determinan la eficiencia marginal del,"capital_NC_capital,_CM_, que_CQUE_que es_VSfin_ser igual_ADJ_igual que_CQUE_que la_ART_el curva_NC_curva","de demanda de inversión. Sin embargo, no hay mucho que"
1_e00079-plain,imposible exagerar en la importancia que tiene el hecho de que,"las_ART_el ideologías_NC_ideología,_CM_, al_PAL_al igual_ADJ_igual que_CQUE_que las_ART_el racionalizaciones_NC_racionalización","individuales, no son mentiras. Y que los enunciados de hecho"
1_e00079-plain,"Towards a Dynamic Economics, 1948) y Stigler. Numerosos","autores_NC_autor adoptan_VLfin_adoptar una_ART_un posición_NC_posición intermedia_ADJ_intermedio,_CM_, por_PREP_por ejemplo_NC_ejemplo CHAFILES_NC_CHAFILES","F. Roos (Dynamic Economics, 1934). Repito también"
1_e00004-plain,en la remuneración se debe en gran medida a diferencias en,"la_ART_el productividad_NC_productividad de_PREP_de la_ART_el mano_NC_mano de_PREP_de obra_NC_obra,_CM_, o_CC_o sea_VSfin_ser la_ART_el cuantía_NC_cuantía",y el valor del aporte de los trabajadores a la producción.
1_e00051-plain,"más o menos "" lisas "" o "" suaves "" en","el_ART_el tiempo_NC_tiempo (_LP_(es_VSfin_ser decir_VLinf_decir,_CM_, la_ART_el gente_NC_gente",prefiere consumir un poco cada día en lugar de morirse de hambre
1_e00053-plain,"lo que llamaremos la propensión a consumir de la comunidad,","el_ART_el nivel_NC_nivel de_PREP_de equilibrio_NC_equilibrio de_PREP_de la_ART_el ocupación_NC_ocupación,_CM_, es_VSfin_ser decir_VLinf_decir,_CM_, el_ART_el nivel_NC_nivel",que no induce a los empresarios en conjunto a ampliar o contraer
1_e00053-plain,global. Este nivel no puede ser mayor que el de,"la_ART_el ocupación_NC_ocupación plena_ADJ_pleno,_CM_, es_VSfin_ser decir_VLinf_decir,_CM_, el_ART_el salario_NC_salario",real no puede ser menor que la desutilidad marginal del trabajo;
1_e00053-plain,"que usará cierto equipo de producción, y cuando afirmamos que","la_ART_el expectativa_NC_expectativa de_PREP_de una_ART_un demanda_NC_demanda mayor_ADJ_grande,_CM_, es_VSfin_ser decir_VLinf_decir,_CM_, un_ART_un aumento_NC_aumento","de la función de demanda global, provocará otro en la producción"
1_e00053-plain,"del capital. Ni son dos factores separados, que afectan","la_ART_el tasa_NC_tasa de_PREP_de inversión_NC_inversión,_CM_, es_VSfin_ser decir_VLinf_decir,_CM_, la_ART_el curva_NC_curva",de la eficiencia marginal del capital y el estado de la confianza
1_e00053-plain,debemos tener también en cuenta la otra faceta del estado de,"la_ART_el confianza_NC_confianza,_CM_, es_VSfin_ser decir_VLinf_decir,_CM_, la_ART_el confianza_NC_confianza",de las instituciones de crédito en aquellos que buscan préstamos en ellas
1_e00053-plain,"a medida que la ocupación crece. Es decir, que","la_ART_el teoría_NC_teoría de_PREP_de los_ART_el precios_NC_precio,_CM_, o_CC_o sea_VSfin_ser el_ART_el análisis_NC_análisis",de la relación entre los cambios en la cantidad de dinero y
1_e00079-plain,los demás tienen en común algo que invita a reunirlos en,"un_ART_un grupo_NC_grupo general_ADJ_general,_CM_, a_PREP_a saber_VLinf_saber,_CM_, el_ART_el espíritu_NC_espíritu",del análisis numérico. Todos ellos han sido económetras. Su obra
1_e00079-plain,"Peel realizó (en lo esencial) el librecambio, incluso","el_ART_el punto_NC_punto más_ADV_más difícil_ADJ_difícil del_PDEL_del programa_NC_programa,_CM_, a_PREP_a saber_VLinf_saber:_COLON_: la_ART_el supresión_NC_supresión",del gravamen a la importación de cereales. Aunque su gabinete v
1_e00079-plain,sería tan fácil de manejar. [7] Citaremos sólo,"un_ART_un ejemplo_NC_ejemplo,_CM_, a_PREP_a saber_VLinf_saber,_CM_, el_ART_el esquema_NC_esquema","del propio profesor FRISCH, presentado en su potente artículo "" PropagationProblems"
1_e00091-plain,"rebasando mínimos históricos. En la tercera semana de febrero,","la_ART_el curva_NC_curva de_PREP_de tipos_NC_tipo de_PREP_de interés_NC_interés,_CM_, es_VSfin_ser decir_VLinf_decir,_CM_, la_ART_el estructura_NC_estructura","de los rendimientos por plazos, presentaba la forma que se puede"
1_e00091-plain,"sobre los niveles mínimos de enero. De esta manera,","la_ART_el curva_NC_curva de_PREP_de tipos_NC_tipo de_PREP_de interés_NC_interés,_CM_, es_VSfin_ser decir_VLinf_decir,_CM_, la_ART_el estructura_NC_estructura","plazos-rendimientos, se ha aplanado en las últimas semanas aun manteniendo una"
1_e00001-plain,observados en cuatro indicadores desde principios de los años ochenta hasta,principios_NC_principio de_PREP_de los_ART_el noventa_CARD_noventa:_COLON_: el_ART_el volumen_NC_volumen,"real de comercio como proporción del PIB, la inversión extranjera directa"
1_e00001-plain,integración. Hay tres tipos de políticas que influyen con relativa,rapidez_NC_rapidez en_PREP_en el_ART_el ritmo_NC_ritmo de_PREP_de integración_NC_integración:_COLON_: las_ART_el políticas_NC_política,"macroeconómicas, las relativas a las telecomunicaciones y la infraestructura de transporte"
1_e00001-plain,comenzaron a dar impulso a ese aspecto de sus economías.,Obstáculos_NC_obstáculo externos_ADJ_externo:_COLON_: medidas_NC_medida,"antidumping y el Acuerdo Multifibras Con todo, existen ciertos obstáculos externos"
1_e00001-plain,kilos por hectárea en las plantaciones estatales. La diferencia en,las_ART_el utilidades_NC_utilidad brutas_ADJ_bruto fue_VSfin_ser incluso_ADV_incluso más_ADV_más reveladora_ADJ_revelador:_COLON_: US_NP_US,"$ 1. 196 por hectárea en las plantaciones privadas, y"
1_e00001-plain,de los países de la región volvió a sobrepasar el del,resto_NC_resto del_PDEL_del mundo_NC_mundo:_COLON_: La_ART_el relación_NC_relación,"comercio - PIB continuó aumentando. Por primera vez, los aranceles"
1_e00001-plain,del comercio se corresponde con la mejora reciente que ha experimentado,el_ART_el producto_NC_producto:_COLON_: Los_ART_el aranceles_NC_arancel,"máximos se sitúan en el 45 %, incluso después de haber"
1_e00001-plain,extraordinario de los índices de comercio registrado en los últimos diez,años_NC_año:_COLON_: Los_ART_el aranceles_NC_arancel,"se redujeron al 15 %, frente al 30 % a fines"
1_e00001-plain,los países de la región es cercano al promedio de todo,el_ART_el mundo_NC_mundo y_CC_y va_VLfin_ir en_PREP_en aumento_NC_aumento:_COLON_: El_ART_el volumen_NC_volumen,de comercio como proporción del PIB sobrepasó levemente el de los países
1_e00001-plain,"período de estancamiento de su integración, que dura ya diez",años_NC_año:_COLON_: Los_ART_el índices_NC_índice,de comercio se han mantenido sin variaciones. Los aranceles apenas han
1_e00004-plain,programas de transferencias públicas pueden complementar las medidas no oficiales de,garantía_NC_garantía del_PDEL_del ingreso_NC_ingreso:_COLON_: las_ART_el obras_NC_obra,públicas constituyen por lo general el mejor método de transferencia para los
1_e00004-plain,uno o dos cambios fundamentales que han debido introducir en sus,estrategias_NC_estrategia de_PREP_de desarrollo_NC_desarrollo:_COLON_: el_ART_el abandono_NC_abandono,del proteccionismo en pro de una mayor integración en los mercados internacionales
1_e00004-plain,debe en parte a las diferencias de remuneración correspondientes a distintos,empleos_NC_empleo en_PREP_en cada_QU_cada país_NC_país:_COLON_: los_ART_el ingenieros_NC_ingeniero,", por ejemplo, ganan más que los trabajadores no calificados de"
1_e00004-plain,cual los grupos de trabajadores más pobres comienzan a ponerse a,la_ART_el par_NC_par de_PREP_de sus_PPO_suyo homólogos_ADJ_homólogo más_ADV_más prósperos_ADJ_próspero:_COLON_: la_ART_el relación_NC_relación,entre los salarios de los grupos más pobres y los más ricos
1_e00010-plain,función del riesgo. Los fondos que comercializa la Caja de,Cataluña_NP_Cataluña pueden_VMfin_poder ser_VSinf_ser españoles_ADJ_español o_CC_o extranjeros_ADJ_extranjero:_COLON_: Fondos_NC_fondo,de Inversión Españoles Fondos de Inversión Extranjeros Inversión a menos de 2
1_e00032-plain,por los Miembros que deban recibir la Deuda se calculará de,acuerdo_NC_acuerdo con_PREP_con la_ART_el siguiente_ADJ_siguiente fórmula_NC_fórmula:_COLON_: Precio_NC_precio,de liquidación del Bono Nocional al cierre de la última sesión x
1_e00032-plain,Boletín de la Central de Anotaciones en Cuenta del Banco de,España_NP_España bajo_PREP_bajo el_ART_el epígrafe_NC_epígrafe de_PREP_de:_COLON_: Operaciones_NC_operación,de Compraventa Simple al Contado entre Titulares. La Relación de Valores
1_e00032-plain,por los Miembros que deban recibir la Deuda se calculará de,acuerdo_NC_acuerdo con_PREP_con la_ART_el siguiente_ADJ_siguiente fórmula_NC_fórmula:_COLON_: Precio_NC_precio,de liquidación del Bono nocional al cierre de la última sesión x
1_e00032-plain,"establecerán mediante Circular, dentro de los términos del Reglamento.",ESPECIFICACIONES_NC_especificación TÉCNICAS_ADJ_técnico Subyacente_ADJ_subyacente:_COLON_: Cantidad_NC_cantidad,en pesetas resultante de multiplicar un nominal de diez millones de pesetas
1_e00032-plain,cien y especificada hasta la centésima de uno por cien.,Vencimientos_NC_vencimiento:_COLON_: Los_ART_el meses_NC_mes,"de marzo, junio, septiembre y diciembre, negociándose como mínimo"
1_e00032-plain,"septiembre y diciembre, negociándose como mínimo cuatro vencimientos. Último",día_NC_día de_PREP_de negociación_NC_negociación:_COLON_: El_ART_el día_NC_día,"y a la hora española en que, en el caso de"
1_e00032-plain,"por el orden definido, expresado en tanto por cien.",Fecha_NC_fecha de_PREP_de vencimiento_NC_vencimiento:_COLON_: El_ART_el vencimiento_NC_vencimiento,será coincidente con el último día de negociación. Fecha de liquidación
1_e00032-plain,El vencimiento será coincidente con el último día de negociación.,Fecha_NC_fecha de_PREP_de liquidación_NC_liquidación:_COLON_: Los_ART_el pagos_NC_pago,y los cobros correspondiente a la liquidación por diferencias al vencimiento tomarán
1_e00032-plain,día hábil para MEFF RENTA FIJA siguiente al de vencimiento.,Fluctuación_NC_fluctuación mínima_ADJ_pequeño del_PDEL_del precio_NC_precio:_COLON_: La_ART_el fluctuación_NC_fluctuación,correspondiente a un movimiento en un sentido u otro de una centésima
1_e00032-plain,"establecerán mediante Circular, dentro de los términos del Reglamento.",ESPECIFICACIONES_NC_especificación TÉCNICAS_ADJ_técnico Subyacente_ADJ_subyacente:_COLON_: Cantidad_NC_cantidad,en pesetas resultante de multiplicar un nominal de diez millones de pesetas
1_e00032-plain,cien y especificada hasta la centésima de uno por cien.,Vencimientos_NC_vencimiento:_COLON_: Los_ART_el meses_NC_mes,"de marzo, junio, septiembre y diciembre, negociándose como mínimo"
1_e00032-plain,"septiembre y diciembre, negociándose como mínimo cuatro vencimientos. Último",día_NC_día de_PREP_de negociación_NC_negociación:_COLON_: El_ART_el día_NC_día,"y a la hora española en que, en el caso de"
1_e00032-plain,"por el orden definido, expresado en tanto por cien.",Fecha_NC_fecha de_PREP_de vencimiento_NC_vencimiento:_COLON_: El_ART_el vencimiento_NC_vencimiento,será coincidente con el último día de negociación. Fecha de liquidación
1_e00032-plain,El vencimiento será coincidente con el último día de negociación.,Fecha_NC_fecha de_PREP_de liquidación_NC_liquidación:_COLON_: Los_ART_el pagos_NC_pago,y los cobros correspondiente a la liquidación por diferencias al vencimiento tomarán
1_e00032-plain,día hábil para MEFF RENTA FIJA siguiente al de vencimiento.,Fluctuación_NC_fluctuación mínima_ADJ_pequeño del_PDEL_del precio_NC_precio:_COLON_: La_ART_el fluctuación_NC_fluctuación,correspondiente a un movimiento en un sentido u otro de una centésima
1_e00032-plain,"establecerán mediante Circular, dentro de los términos del Reglamento.",ESPECIFICACIONES_NC_especificación TÉCNICAS_ADJ_técnico Subyacente_ADJ_subyacente:_COLON_: Cantidad_NC_cantidad,en pesetas resultante de multiplicar un nominal de diez millones de pesetas
1_e00032-plain,cien y especificada hasta la centésima de uno por cien.,Vencimientos_NC_vencimiento:_COLON_: Los_ART_el meses_NC_mes,"de marzo, junio, septiembre y diciembre, negociándose como mínimo"
1_e00032-plain,"septiembre y diciembre, negociándose como mínimo cuatro vencimientos. Último",día_NC_día de_PREP_de negociación_NC_negociación:_COLON_: El_ART_el día_NC_día,"y a la hora española en que, en el caso de"
1_e00032-plain,"por el orden definido, expresado en tanto por cien.",Fecha_NC_fecha de_PREP_de vencimiento_NC_vencimiento:_COLON_: El_ART_el vencimiento_NC_vencimiento,será coincidente con el último día de negociación. Fecha de liquidación
1_e00032-plain,El vencimiento será coincidente con el último día de negociación.,Fecha_NC_fecha de_PREP_de liquidación_NC_liquidación:_COLON_: Los_ART_el pagos_NC_pago,y los cobros correspondiente a la liquidación por diferencias al vencimiento tomarán
1_e00032-plain,día hábil para MEFF RENTA FIJA siguiente al de vencimiento.,Fluctuación_NC_fluctuación mínima_ADJ_pequeño del_PDEL_del precio_NC_precio:_COLON_: La_ART_el fluctuación_NC_fluctuación,correspondiente a un movimiento en un sentido u otro de una centésima
1_e00051-plain,es capaz de transformar estos dos factores en producción final a,través_NC_través de_PREP_de la_ART_el siguiente_ADJ_siguiente función_NC_función:_COLON_: xxx_NP_xxx,en la que por xxx entendemos la producción agregada. Para simplificar
1_e00051-plain,"4]. Consideraremos, adicionalmente, que la función de",producción_NC_producción es_VSfin_ser del_PDEL_del tipo_NC_tipo Cobb-Douglas_NP_Cobb-Douglas:_COLON_: xxx_NP_xxx,siendo xxx el nivel de la tecnología. Desde una perspectiva macroeconómica
1_e00051-plain,miembro son constantes. Si tomamos logaritmos y derivamos respecto del,tiempo_NC_tiempo obtenemos_VLfin_obtener la_ART_el siguiente_ADJ_siguiente relación_NC_relación:_COLON_: xxx_NP_xxx,. Esta expresión es una ecuación clave que requiere un cierto detenimiento
1_e00051-plain,. Este fenómeno puede explicarse mediante la existencia de externalidades en,"la_ART_el producción_NC_producción,_CM_, los_ART_el llamados_VLadj_llamar efectos_NC_efecto desbordamiento_NC_desbordamiento:_COLON_: la_ART_el decisión_NC_decisión",de cada productor individual afecta positivamente a la producción de todos los
1_e00051-plain,escala excluyen siempre el crecimiento de la población. MODELOS CON,UNA_ART_un TASA_NC_tasa DE_PREP_de AHORRO_NC_ahorro CONSTANTE_ADJ_constante:_COLON_: UNA_ART_un EXPOSICIÓN_NC_exposición,GRÁFICA Es frecuente oír decir a los asesores económicos del Tercer Mundo
1_e00051-plain,análisis continuaremos suponiendo que la tasa de ahorro es constante.,Crecimiento_NC_crecimiento neoclásico_ADJ_neoclásico:_COLON_: el_ART_el modelo_NC_modelo,"de Solow y Swan Para empezar, vamos a suponer que contamos"
1_e00051-plain,se nos indica que esta tasa de crecimiento viene dada por,la_ART_el diferencia_NC_diferencia entre_PREP_entre dos_CARD_dos funciones_NC_función:_COLON_: xxx_NP_xxx,. Se han representado estas dos funciones en el gráfico 2.
1_e00051-plain,"ellos bautizaron como un "" modelo de Solow ampliado "".",El_ART_el modelo_NC_modelo incluye_VLfin_incluir tres_CARD_tres factores_NC_factor de_PREP_de producción_NC_producción:_COLON_: capital_NC_capital,", trabajo en el sentido convencional y capital humano (designado por"
1_e00051-plain,sentido convencional y capital humano (designado por H) en,una_ART_un tecnología_NC_tecnología Cobb-Douglas_NP_Cobb-Douglas:_COLON_: xxx_NP_xxx,". Mankiw, Romer y Weil supusieron, además, que tanto"
1_e00051-plain,alrededor de xxx se obtiene (2. 2).,CRECIMIENTO_NC_crecimiento NEOCLÁSICO_ADJ_neoclásico:_COLON_: EL_ART_el MODELO_NC_modelo,DE RAMSEY EL modelo de las familias productoras Hasta este momento se
1_e00051-plain,"rendimientos constantes de escala, [3] obtenemos la siguiente",expresión_NC_expresión:_COLON_: xxx_NP_xxx,. El segundo miembro de (3. 3) está expresado
1_e00051-plain,"inversión). Las condiciones de primer orden, en este","caso_NC_caso,_CM_, son_VSfin_ser las_ART_el siguientes_ADJ_siguiente:_COLON_: xxx_NP_xxx",. La ecuación (3. 10) dice que el valor
1_e00051-plain,"11), para llegar a la condición que debe cumplir",el_ART_el crecimiento_NC_crecimiento del_PDEL_del consumo_NC_consumo:_COLON_: xxx_NP_xxx,". La ecuación (3. 13) se denomina, en"
1_e00051-plain,"Euler. Para interpretarla, es conveniente reescribirla de la siguiente",forma_NC_forma:_COLON_: xxx_NP_xxx,. El miembro de la izquierda recoge el beneficio o rendimiento que
1_e00051-plain,"de los agentes individuales. Si empleamos una tecnología Cobb-Douglas,",xxx_NP_xxx puede_VMfin_poder expresarse_VCLIinf_expresarse del_PDEL_del siguiente_ADJ_siguiente modo_NC_modo:_COLON_: xxx_NP_xxx,. La ecuación (3. 12) recoge la condición de
1_e00051-plain,en mostrar cómo estas ecuaciones dinámicas son también aplicables en dos,contextos_NC_contexto diferentes_ADJ_diferente:_COLON_: una_ART_un economía_NC_economía,con mercados competitivos y una economía dirigida por un planificador. EL
