Reference	LeftContext	Pivot	RightContext
1_m00003-plain	IDT que, en el campo de la investigación en biomedicina y	salud_NC_salud,_CM_, realizan_VLfin_realizar centro_NC_centro de_PREP_de investigación_NC_investigación,_CM_, universidades_NC_universidad y_CC_y empresas_NC_empresa,_CM_, en_PREP_en particular_ADJ_particular	las pequeñas y medianas, establecidas en los Estados miembros, así
1_m00003-plain	problemas derivados del envejecimiento Vista la importancia socioeconómica que tiene el hacerse	cargo_NC_cargo de_PREP_de las_ART_el enfermedades_NC_enfermedad crónicas_ADJ_crónico,_CM_, la_ART_el investigación_NC_investigación se_SE_se dirigirá_VLfin_dirigir en_PREP_en particular_ADJ_particular	a las enfermedades autoinmunes y a la inmunogenética, así como las
1_m00092-plain	positivos y son estimulados por los determinantes de clase II presentes en	la_ART_el mayoría_NC_mayoría de_PREP_de los_ART_el linfocitos_NC_linfocito B_ALFS_B,_CM_, los_ART_el macrófagos_NC_macrófago y_CC_y en_PREP_en especial_ADJ_especial	sobre las células dendríticas presentadoras de antígeno. Por lo tanto,
1_m00244-plain	de esperanza de vida. Pero podemos suponer, a partir de	estudios_NC_estudio locales_ADJ_local,_CM_, que_CQUE_que las_ART_el infecciones_NC_infección,_CM_, la_ART_el malaria_NC_malaria sobre_PREP_sobre todo_QU_todo	, son la primera causa de muerte. Nuestra investigación puso de
1_m00293-plain	una cadencia sorprendentemente regular en los linajes supervivientes. Dicho de otro	modo_NC_modo,_CM_, la_ART_el evolución_NC_evolución génica_ADJ_génico es_VSfin_ser,_CM_, sobre_PREP_sobre todo_QU_todo	, resultado de la acumulación inflexible de mutaciones que no parecen ser
1_m00300-plain	hay que empezar por definir qué se entiende por ésta. Muchos	investigadores_NC_investigador,_CM_, Simón_NP_Simón LeVay_NP_LeVay en_PREP_en particular_ADJ_particular	, consideran dicha inclinación un rasgo sexualmente dimórfico: los varones están
