Reference	LeftContext	Pivot	RightContext
1_m00686-plain	por ciento de los complejos aislados contenían proteínas de función desconocida.	Y_CC_y más_ADV_más aún_ADV_aún,_CM_, hasta_PREP_hasta el_ART_el 80_CARD_@card@	por ciento de las proteínas interaccionaban al menos con otra proteína,
1_m00689-plain	síntesis de nuevas proteínas. La mayoría de las proteínas se renuevan	al_PAL_al cabo_NC_cabo de_PREP_de unos_ART_un días_NC_día,_CM_, incluso_ADV_incluso en_PREP_en las_ART_el	células que raramente se dividen, como hepatocitos o neuronas. Según
1_m00689-plain	Pharmaceutical están ensayando un inhibidor experimental del proteosoma cuya acción se extenderá	a_PREP_a varios_QU_varios tipos_NC_tipo de_PREP_de cáncer_NC_cáncer,_CM_, incluido_VLadj_incluir el_ART_el mieloma_NC_mieloma	múltiple. La misma empresa ha empezado las fases iniciales de inocuidad
1_m00690-plain	de enlace preciso que utiliza para engancharse al CD4, lugar de	anclaje_NC_anclaje en_PREP_en las_ART_el células_NC_célula inmunitarias_ADJ_inmunitario,_CM_, hasta_PREP_hasta el_ART_el último_ADJ_último	nanosegundo, en que se abre de repente como una navaja.
1_m00696-plain	para sustituir, de forma selectiva y en todo lo posible,	el_ART_el anticuerpo_NC_anticuerpo murino_NC_murino con_PREP_con proteína_NC_proteína humana_ADJ_humano,_CM_, incluida_VLadj_incluir la_ART_el mayor_ADJ_grande	parte de las regiones de unión al antígeno. Campath, fabricado
1_m00697-plain	cuantas vacunas. Pero las cosas han dado un vuelco radical.	Contamos_VLfin_contar con_PREP_con numerosos_ADJ_numeroso tratamientos_NC_tratamiento antivíricos_ADJ_antivírico,_CM_, incluidas_VLadj_incluir varias_QU_varios vacunas_NC_vacuna	nuevas; muchos más se encuentran en vías de desarrollo. Si
1_m00697-plain	) Descifrada la secuencia del virus de interés, se coteja con	las_ART_el ya_ADV_ya identificadas_VLadj_identificar en_PREP_en otros_QU_otro organismos_NC_organismo,_CM_, incluidos_VLadj_incluir otros_QU_otro virus_NC_virus	, para así averiguar su segmentación en genes. Las ristras de
1_m00699-plain	otros, podrían ser moléculas que influyan sobre las interacciones entre hidratos	de_PREP_de carbono_NC_carbono y_CC_y otras_QU_otro moléculas_NC_molécula,_CM_, incluidas_VLadj_incluir las_ART_el interacciones_NC_interacción	con enzimas (catalizadores biológicos) que controlan la síntesis o degradación
1_m00699-plain	proteína que activa la respuesta inmunitaria. Hay en estudio otras vacunas	con_PREP_con glucoconjugados_NC_glucoconjugados para_PREP_para enfermedades_NC_enfermedad infecciosas_ADJ_infeccioso,_CM_, incluida_VLadj_incluir la_ART_el que_CQUE_que	debe proteger contra infecciones de Staphylococcus aureus en pacientes hospitalizados. Diversos
1_m00708-plain	del tronco cerebral podría entorpecer el desarrollo y tendido adecuado de redes	nerviosas_ADJ_nervioso de_PREP_de otras_QU_otro regiones_NC_región cerebrales_ADJ_cerebral,_CM_, incluidas_VLadj_incluir las_ART_el que_CQUE_que	intervienen en funciones de nivel superior, como el habla, dando
1_m00710-plain	contra la gripe, el fármaco debía hallarse capacitado para atacar a	todas_QU_todo las_ART_el variantes_NC_variante del_PDEL_del virus_NC_virus,_CM_, incluidas_VLadj_incluir las_ART_el que_CQUE_que	se ignora si provocan enfermedad en humanos. Una cepa de virus
1_m00710-plain	constante en todas las cepas. Actuaría así contra cualquier virus de	la_ART_el gripe_NC_gripe que_CQUE_que apareciera_VLfin_aparecer en_PREP_en personas_NC_persona,_CM_, incluidos_VLadj_incluir los_ART_el transmitidos_VLadj_transmitir	directamente por animales. El trabajo estructural que permitió desarrollar los inhibidores
1_m00715-plain	y reorganizan para formar tejido nuevo. Al propio tiempo, se	van_VLfin_ir desintegrando_VLger_desintegrar los_ART_el polímeros_NC_polímero artificiales_ADJ_artificial,_CM_, hasta_PREP_hasta que_CQUE_que sólo_ADV_sólo	queda formado un producto completamente natural, un neoórgano. La creación
1_m00715-plain	en la sabiduría bioquímica del organismo. Se transfieren las células apropiadas	,_CM_, en_PREP_en una_ART_un matriz_NC_matriz tridimensional_ADJ_tridimensional,_CM_, hasta_PREP_hasta el_ART_el lugar_NC_lugar	deseado; el crecimiento se produce dentro de la persona o del
1_m00715-plain	síndrome infantil. A quienes padecen incontinencia severa o reflujo vesical se	les_PPC_él somete_VLfin_someter a_PREP_a procedimientos_NC_procedimiento varios_QU_varios,_CM_, incluida_VLadj_incluir una_ART_un intervención_NC_intervención	quirúrgica delicada. Los adultos reciben a veces colágeno, que proporciona
1_m00725-plain	estudios en fase II, el irinotecan posee actividad antitumoral objetiva en	los_ART_el pacientes_NC_paciente con_PREP_con cáncer_NC_cáncer colorrectal_ADJ_colorrectal metastásico_ADJ_metastásico,_CM_, incluso_ADV_incluso en_PREP_en los_ART_el	pacientes con tumores documentados resistentes al fluorouracilo con tasas de respuesta del
1_m00731-plain	la reacción de PCR La PCR puede amplificar secuencias a partir de	cantidades_NC_cantidad ínfimas_ADJ_bajo de_PREP_de DNA_NC_dna diana_NC_diana,_CM_, incluso_ADV_incluso a_PREP_a partir_VLinf_partir	del DNA contenido en una sola célula. Esta elevada sensibilidad ha
1_m00731-plain	puesto a punto unas condiciones de reacción en las que se pueden	llegar_VLinf_llegar a_PREP_a amplificar_VLinf_amplificar fragmentos_NC_fragmento largos_ADJ_largo,_CM_, incluyendo_VLger_incluir un_ART_un fragmento_NC_fragmento	de 42kb derivado del genoma del bacteriófago xxx. Las condiciones para
1_m00731-plain	hebra no sirva para iniciar o continuar la síntesis del DNA.	Muchas_QU_mucho DNA_NC_dna polimerasas_NC_polimerasa,_CM_, incluyendo_VLger_incluir la_ART_el de_PREP_de	E. coli, presentan una actividad xxx exonucleasa integrada. Cuando
1_m00731-plain	, la actividad xxx exonucleasa elimina un nucleótido por vez a partir	del_PDEL_del extremo_NC_extremo 3_CARD_3 '_QT_'hidroxilo_NC_hidroxilo,_CM_, hasta_PREP_hasta que_CQUE_que llega_VLfin_llegar	a un par de bases terminal correctamente apareado. Esto permite que
1_m00731-plain	menos un nucleótido incorrecto como consecuencia de un error de copiado.	Esto_DM_este implica_VLfin_implicar que_CQUE_que,_CM_, incluso_ADV_incluso cuando_CSUBX_cuando se_SE_se	usa como molde una única secuencia de DNA, el producto final
1_m00731-plain	identificado mediante ensayos de complementación funcional En algunos casos se puede realizar	un_ART_un ensayo_NC_ensayo de_PREP_de complementación_NC_complementación funcional_ADJ_funcional,_CM_, incluso_ADV_incluso cuando_CSUBX_cuando se_SE_se	desconoce el producto génico. Se han empleado mutantes de levadura para
1_m00731-plain	en las hemoglobinopatías y en las mutaciones en RET - El que	las_ART_el enfermedades_NC_enfermedad genéticas_ADJ_genético suelan_VLfin_soler ser_VSinf_ser variables_ADJ_variable,_CM_, incluso_ADV_incluso dentro_ADV_dentro de_PREP_de	la misma familia, de forma que conocer la existencia de la
1_m00731-plain	con nucleasa S1 resulta en la digestión progresiva de la secuencia protuberante	de_PREP_de DNA_NC_dna de_PREP_de 3_CARD_3 '_QT_',_CM_, hasta_PREP_hasta el_ART_el punto_NC_punto	en el que el DNA está hibridado al extremo 5'del
1_m00731-plain	Anticuerpos manipulados por ingeniería genética: los genes de los anticuerpos pueden	manipularse_VLinf_manipular para_CSUBI_para formar_VLinf_formar nuevos_ADJ_nuevo anticuerpos_NC_anticuerpo,_CM_, incluyendo_VLger_incluir anticuerpos_NC_anticuerpo parcial_ADJ_parcial	o completamente humanizados, para su uso como nuevos agentes terapéuticos;
1_m00731-plain	cada célula individual (ver página 191 en adelante). Otros	mecanismos_NC_mecanismo añaden_VLfin_añadir aún_ADV_aún más_ADV_más diversidad_NC_diversidad,_CM_, incluyendo_VLger_incluir frecuentes_ADJ_frecuente mutaciones_NC_mutación	somáticas. Como resultado se tiene que cada individuo posee una población
1_m00731-plain	los anticuerpos de roedor permite acceder a un gran acervo de mAbs	de_PREP_de roedores_NC_roedor para_PREP_para la_ART_el terapia_NC_terapia,_CM_, incluyendo_VLger_incluir los_ART_el específicos_ADJ_específico	contra antígenos humanos que son difíciles de obtener en una respuesta inmune
1_m00731-plain	han sido construidos contra una amplia gama de patógenos microbianos y marcadores	de_PREP_de superficie_NC_superficie de_PREP_de células_NC_célula humanas_ADJ_humano,_CM_, incluyendo_VLger_incluir antígenos_NC_antígeno tumorales_ADJ_tumoral	. En algunos casos han sido también empleados en clínica (ver
1_m00735-plain	se perdieron para el seguimiento antes del periodo 3 (fig.	1_CARD_1,_CM_, incluyendo_VLger_incluir los_ART_el que_CQUE_que	no recibieron la medicación en estudio), con lo que la
