id,presence,candidate_term_left,candidate_term_right,occurrence,full_context
H4_economy_1,both,['gradual'],"['productores', 'más']", la eliminación gradual del Acuerdo Multifibras serán los países productores más eficientes,vestuario provenientes de países en desarrollo. Probablemente los principales beneficiarios de la eliminación gradual del Acuerdo Multifibras serán los países productores más eficientescuyas exportaciones a los mercados de los países industriales están muy limitadas
H4_economy_2,both,['dinero'],['más'], dinero prestado ésta es una razón más de,"en tan gran escala, si es que en alguna, con dinero prestado ésta es una razón más delos rendimientos superiores que el pasatiempo da a quien posee cierto acopio"
H4_economy_3,both,"['último', 'hecho', 'este último']",['más'], este último hecho ha sido la causa de más de,muy variamente en condiciones institucionales diferentes y que el pasar por alto este último hecho ha sido la causa de más deun grave error. Y también es verdad que siempre que intentamos
H4_economy_4,both,"['concepto', 'velocidad', 'dinero']",['más'], concepto de velocidad del dinero es con el más famoso,"en algunos puntos, que la mayoría de sus contemporáneos. Su concepto de velocidad del dinero es con el más famoso, y se volverá a citar en el capítulo 6. Otro"
H4_economy_5,right,[None],"['factores', 'más', 'directos']", la Bolsa de Nueva York fueron los factores explicativos más directos,coyuntura bajista de tipos de interés y la trayectoria al alza de la Bolsa de Nueva York fueron los factores explicativos más directosde la carrera alcista de la bolsa española. Fruto del buen
