Reference	LeftContext	Pivot	RightContext
1_a00104-plain	a los planes, decisiones y desarrollos de	la_ART_el empresa_NC_empresa._FS_. Es_VSfin_ser una_ART_un especie_NC_especie de_PREP_de estado_NC_estado	de auditoría medioambiental crónico que filtra cada uno de los procesos,
1_i00018-plain	el router propaga paquetes de tipo 20.	El_ART_el tipo_NC_tipo 20_CODE_@card@ es_VSfin_ser una_ART_un clase_NC_clase de_PREP_de paquete_NC_paquete	IPX que se refiere a cualquier paquete propagado. Por ejemplo,
1_i00059-plain	NetWare 4 empieza con el objeto Volumen.	Un_ART_un objeto_NC_objeto Volumen_NC_volumen es_VSfin_ser un_ART_un tipo_NC_tipo de_PREP_de objeto_NC_objeto	Hoja. Se refiere a un volumen físico en el que se
1_m00238-plain	vista que no comparto. Para mi,	el_ART_el embrión_NC_embrión es_VSfin_ser un_ART_un grupo_NC_grupo de_PREP_de células_NC_célula	que no adquiere sensibilidad hasta una etapa ulterior del desarrollo; en
1_m00270-plain	la interacción de dos clases de proteínas.	Una_ART_un clase_NC_clase es_VSfin_ser un_ART_un grupo_NC_grupo de_PREP_de enzimas_NC_enzima	llamadas proteínas quinasas, que fosforilan selectivamente proteínas diana. Aunque en
1_m00306-plain	), una molécula rica en energía.	El_ART_el cloroplasto_NC_cloroplasto es_VSfin_ser un_ART_un tipo_NC_tipo de_PREP_de plastidio_NC_plastidio	que se encuentra en vegetales superiores, algas y algunos protozoos.
